name,subDistrict,district,province,level
โรงเรียนเขาทะลุพิทยาคม,เขาทะลุ,สวี,ชุมพร,มัธยมศึกษา
โรงเรียนครนพิทยาคม,ครน,สวี,ชุมพร,มัธยมศึกษา
โรงเรียนชลธารวิทยา,บ้านควน,หลังสวน,ชุมพร,มัธยมศึกษา
โรงเรียนด่านสวีวิทยา,ด่านสวี,สวี,ชุมพร,มัธยมศึกษา
โรงเรียนท่าแซะรัชดาภิเษก,ท่าแซะ,ท่าแซะ,ชุมพร,มัธยมศึกษา
โรงเรียนท่าข้ามวิทยา,ท่าข้าม,ท่าแซะ,ชุมพร,มัธยมศึกษา
โรงเรียนทุ่งคาพิทยาคาร,ทุ่งคา,เมืองชุมพร,ชุมพร,มัธยมศึกษา
โรงเรียนทุ่งตะโกวิทยา,ทุ่งตะไคร,ทุ่งตะโก,ชุมพร,มัธยมศึกษา
โรงเรียนนาสักวิทยา,นาสัก,สวี,ชุมพร,มัธยมศึกษา
โรงเรียนปะทิววิทยา,บางสน,ปะทิว,ชุมพร,มัธยมศึกษา
โรงเรียนปากน้ำชุมพรวิทยา,หาดทรายรี,เมืองชุมพร,ชุมพร,มัธยมศึกษา
โรงเรียนปากน้ำหลังสวนวิทยา,ปากน้ำ,หลังสวน,ชุมพร,มัธยมศึกษา
โรงเรียนพะโต๊ะวิทยา,พะโต๊ะ,พะโต๊ะ,ชุมพร,มัธยมศึกษา
โรงเรียนมาบอำมฤตวิทยา,ดอนยาง,ปะทิว,ชุมพร,มัธยมศึกษา
โรงเรียนเมืองหลังสวน,วังตะกอ,หลังสวน,ชุมพร,มัธยมศึกษา
โรงเรียนละแมวิทยา,ละแม,ละแม,ชุมพร,มัธยมศึกษา
โรงเรียนศรียาภัย,ท่าตะเภา,เมืองชุมพร,ชุมพร,มัธยมศึกษา
โรงเรียนศรียาภัย 2,นาชะอัง,เมืองชุมพร,ชุมพร,มัธยมศึกษา
โรงเรียนสวนศรีวิทยา,หลังสวน,หลังสวน,ชุมพร,มัธยมศึกษา
โรงเรียนสวีวิทยา,นาโพธิ์,สวี,ชุมพร,มัธยมศึกษา
โรงเรียนสอาดเผดิมวิทยา,ท่าตะเภา,เมืองชุมพร,ชุมพร,มัธยมศึกษา
โรงเรียนหงษ์เจริญวิทยาคม,หงษ์เจริญ,ท่าแซะ,ชุมพร,มัธยมศึกษา
โรงเรียนชุมชนบ้านคุริง (มิตรภาพที่ 25),ทรัพย์อนันต์,ท่าแซะ,ชุมพร,อนุบาล–มัธยมศึกษาตอนต้น
โรงเรียนชุมชนบ้านถ้ำสิงห์,ถ้ำสิงห์,เมืองชุมพร,ชุมพร,อนุบาล–มัธยมศึกษาตอนต้น
โรงเรียนชุมชนบ้านทะเลทรัพย์,ทะเลทรัพย์,ปะทิว,ชุมพร,อนุบาล–มัธยมศึกษาตอนต้น
โรงเรียนชุมชนบ้านนาชะอัง,นาชะอัง,เมืองชุมพร,ชุมพร,อนุบาล–มัธยมศึกษาตอนต้น
โรงเรียนชุมชนประชานิคม,ท่าแซะ,ท่าแซะ,ชุมพร,อนุบาล–มัธยมศึกษาตอนต้น
โรงเรียนชุมชนมาบอำมฤต,ดอนยาง,ปะทิว,ชุมพร,อนุบาล–ประถมศึกษา
โรงเรียนชุมชนวัดหาดพันไกร,หาดพันไกร,เมืองชุมพร,ชุมพร,อนุบาล–มัธยมศึกษาตอนต้น
โรงเรียนไทยรัฐวิทยา 66 (บ้านนาเนียน),วังใหม่,เมืองชุมพร,ชุมพร,อนุบาล–มัธยมศึกษาตอนต้น
โรงเรียนไทยรัฐวิทยา 76 (บ้านพละ),เขาไชยราช,ปะทิว,ชุมพร,อนุบาล–มัธยมศึกษาตอนต้น
โรงเรียนไทยรัฐวิทยา 77 (บ้านเนินสันติ),ท่าแซะ,ท่าแซะ,ชุมพร,ประถมศึกษา–มัธยมศึกษาตอนต้น
โรงเรียนไทยรัฐวิทยา 78 (วัดสามัคคีชัย),สะพลี,ปะทิว,ชุมพร,อนุบาล–มัธยมศึกษาตอนต้น
โรงเรียนบ้านกลาง,หงษ์เจริญ,ท่าแซะ,ชุมพร,อนุบาล–ประถมศึกษา
โรงเรียนบ้านแก่งเพกา,ทรัพย์อนันต์,ท่าแซะ,ชุมพร,อนุบาล–ประถมศึกษา
โรงเรียนบ้านเขาชันโต๊ะ,วิสัยเหนือ,เมืองชุมพร,ชุมพร,อนุบาล–มัธยมศึกษาตอนต้น
โรงเรียนบ้านเขาบ่อ,ทุ่งคา,เมืองชุมพร,ชุมพร,อนุบาล–มัธยมศึกษาตอนต้น
โรงเรียนบ้านเขาพาง,ท่าข้าม,ท่าแซะ,ชุมพร,อนุบาล–ประถมศึกษา
โรงเรียนบ้านเขายาวราษฎร์พัฒนา,วิสัยเหนือ,เมืองชุมพร,ชุมพร,อนุบาล–มัธยมศึกษาตอนต้น
โรงเรียนบ้านเขาเลี้ยว,เขาไชยราช,ปะทิว,ชุมพร,อนุบาล–ประถมศึกษา
โรงเรียนบ้านเขาวง,บ้านนา,เมืองชุมพร,ชุมพร,อนุบาล–ประถมศึกษา
โรงเรียนบ้านคลองสูบ,วิสัยเหนือ,เมืองชุมพร,ชุมพร,อนุบาล–มัธยมศึกษาตอนต้น
โรงเรียนบ้านคอกม้า,บางสน,ปะทิว,ชุมพร,อนุบาล–ประถมศึกษา
โรงเรียนบ้านคอเตี้ย,บางหมาก,เมืองชุมพร,ชุมพร,อนุบาล–ประถมศึกษา
โรงเรียนบ้านคอสน,ท่ายาง,เมืองชุมพร,ชุมพร,อนุบาล–ประถมศึกษา
โรงเรียนบ้านคันธทรัพย์,สลุย,ท่าแซะ,ชุมพร,อนุบาล–มัธยมศึกษาตอนต้น
โรงเรียนบ้านงาช้าง,สองพี่น้อง,ท่าแซะ,ชุมพร,อนุบาล–มัธยมศึกษาตอนต้น
โรงเรียนบ้านจันทึง,หินแก้ว,ท่าแซะ,ชุมพร,อนุบาล–ประถมศึกษา
โรงเรียนบ้านช่องไทรราษฎร์พัฒนา,ทุ่งคา,เมืองชุมพร,ชุมพร,อนุบาล–ประถมศึกษา
โรงเรียนบ้านชุมโค,ชุมโค,ปะทิว,ชุมพร,อนุบาล–ประถมศึกษา
โรงเรียนบ้านไชยราช,เขาไชยราช,ปะทิว,ชุมพร,อนุบาล–ประถมศึกษา
โรงเรียนบ้านดอนเคี่ยม,รับร่อ,ท่าแซะ,ชุมพร,อนุบาล–ประถมศึกษา
โรงเรียนบ้านดอนตะเคียน,บางสน,ปะทิว,ชุมพร,อนุบาล–ประถมศึกษา
โรงเรียนบ้านดอนทราย,ชุมโค,ปะทิว,ชุมพร,อนุบาล–ประถมศึกษา
โรงเรียนบ้านดอนไทรงาม,บางหมาก,เมืองชุมพร,ชุมพร,อนุบาล–มัธยมศึกษาตอนต้น
โรงเรียนบ้านตาหงษ์,หงษ์เจริญ,ท่าแซะ,ชุมพร,อนุบาล–ประถมศึกษา
โรงเรียนบ้านถ้ำธง,ปากคลอง,ปะทิว,ชุมพร,อนุบาล–ประถมศึกษา
โรงเรียนบ้านทรัพย์สมบูรณ์,ชุมโค,ปะทิว,ชุมพร,อนุบาล–ประถมศึกษา
โรงเรียนบ้านทรายแก้ว,เขาไชยราช,ปะทิว,ชุมพร,อนุบาล–ประถมศึกษา
โรงเรียนบ้านทรายขาว,สองพี่น้อง,ท่าแซะ,ชุมพร,อนุบาล–มัธยมศึกษาตอนต้น
โรงเรียนบ้านท่ามะปริง,บ้านนา,เมืองชุมพร,ชุมพร,อนุบาล–มัธยมศึกษาตอนต้น
โรงเรียนบ้านท่าไม้ลาย,วังใหม่,เมืองชุมพร,ชุมพร,อนุบาล–มัธยมศึกษาตอนต้น
โรงเรียนบ้านท่าลานทอง,คุริง,ท่าแซะ,ชุมพร,อนุบาล–ประถมศึกษา
โรงเรียนบ้านทุ่งมะขาม,หาดทรายรี,เมืองชุมพร,ชุมพร,อนุบาล–มัธยมศึกษาตอนต้น
โรงเรียนบ้านทุ่งเรี้ย,ดอนยาง,ปะทิว,ชุมพร,อนุบาล–ประถมศึกษา
โรงเรียนบ้านทุ่งหงษ์,ทุ่งคา,เมืองชุมพร,ชุมพร,อนุบาล–ประถมศึกษา
โรงเรียนบ้านธรรมเจริญ,หงษ์เจริญ,ท่าแซะ,ชุมพร,อนุบาล–มัธยมศึกษาตอนต้น
โรงเรียนบ้านนาแซะ,วังใหม่,เมืองชุมพร,ชุมพร,อนุบาล–มัธยมศึกษาตอนต้น
โรงเรียนบ้านน้ำพุ,ปากคลอง,ปะทิว,ชุมพร,อนุบาล–ประถมศึกษา
โรงเรียนบ้านน้ำเย็น,หินแก้ว,ท่าแซะ,ชุมพร,อนุบาล–ประถมศึกษา
โรงเรียนบ้านเนินทอง,สลุย,ท่าแซะ,ชุมพร,อนุบาล–มัธยมศึกษาตอนต้น
โรงเรียนบ้านในห้วย,ตากแดด,เมืองชุมพร,ชุมพร,อนุบาล–ประถมศึกษา
โรงเรียนบ้านบ่ออิฐ,ชุมโค,ปะทิว,ชุมพร,อนุบาล–ประถมศึกษา
โรงเรียนบ้านบางคอย,ท่ายาง,เมืองชุมพร,ชุมพร,อนุบาล–ประถมศึกษา
โรงเรียนบ้านบางจาก,ชุมโค,ปะทิว,ชุมพร,อนุบาล–มัธยมศึกษาตอนต้น
โรงเรียนบ้านบางไม้แก้วประชาสามัคคี,รับร่อ,ท่าแซะ,ชุมพร,อนุบาล–มัธยมศึกษาตอนต้น
โรงเรียนบ้านบางหลง,ท่ายาง,เมืองชุมพร,ชุมพร,อนุบาล–ประถมศึกษา
โรงเรียนบ้านบึงลัด,หงษ์เจริญ,ท่าแซะ,ชุมพร,อนุบาล–ประถมศึกษา
โรงเรียนบ้านปากคลอง,ปากคลอง,ปะทิว,ชุมพร,อนุบาล–ประถมศึกษา
โรงเรียนบ้านปากน้ำ (เผดิมจีนนาวาสงเคราะห์),ปากน้ำ,เมืองชุมพร,ชุมพร,อนุบาล–ประถมศึกษา
โรงเรียนบ้านพรุตะเคียน,สลุย,ท่าแซะ,ชุมพร,อนุบาล–ประถมศึกษา
โรงเรียนบ้านยายไท,หงษ์เจริญ,ท่าแซะ,ชุมพร,อนุบาล–ประถมศึกษา
โรงเรียนบ้านรับร่อ,รับร่อ,ท่าแซะ,ชุมพร,อนุบาล–ประถมศึกษา
โรงเรียนบ้านร้านตัดผม,สองพี่น้อง,ท่าแซะ,ชุมพร,อนุบาล–มัธยมศึกษาตอนต้น
โรงเรียนบ้านละมุ,นากระตาม,ท่าแซะ,ชุมพร,อนุบาล–ประถมศึกษา
โรงเรียนบ้านวังช้าง,ชุมโค,ปะทิว,ชุมพร,อนุบาล–ประถมศึกษา
โรงเรียนบ้านศาลาลอย,บางลึก,เมืองชุมพร,ชุมพร,อนุบาล–ประถมศึกษา
โรงเรียนบ้านสวนทรัพย์,สลุย,ท่าแซะ,ชุมพร,อนุบาล–ประถมศึกษา
โรงเรียนบ้านสะพลี (บางกอกโพสต์ศึกษา),สะพลี,ปะทิว,ชุมพร,อนุบาล–มัธยมศึกษาตอนต้น
โรงเรียนบ้านสามเสียม,นาชะอัง,เมืองชุมพร,ชุมพร,อนุบาล–ประถมศึกษา
โรงเรียนบ้านหนองเนียน,บางลึก,เมืองชุมพร,ชุมพร,อนุบาล–ประถมศึกษา
โรงเรียนบ้านหนองเรือ,ท่าข้าม,ท่าแซะ,ชุมพร,อนุบาล–ประถมศึกษา
โรงเรียนบ้านห้วยรากไม้,ดอนยาง,ปะทิว,ชุมพร,อนุบาล–ประถมศึกษา
โรงเรียนบ้านหัวถนน,ปากน้ำ,เมืองชุมพร,ชุมพร,อนุบาล–มัธยมศึกษาตอนต้น
โรงเรียนบ้านหัวว่าว,ท่าข้าม,ท่าแซะ,ชุมพร,อนุบาล–ประถมศึกษา
โรงเรียนบ้านหาดทรายรี,หาดทรายรี,เมืองชุมพร,ชุมพร,อนุบาล–ประถมศึกษา
โรงเรียนบ้านหาดใน,รับร่อ,ท่าแซะ,ชุมพร,อนุบาล–มัธยมศึกษาตอนต้น
โรงเรียนบ้านหาดภราดรภาพ,ปากน้ำ,เมืองชุมพร,ชุมพร,อนุบาล–ประถมศึกษา
โรงเรียนบ้านหาดส้มแป้น,ท่าข้าม,ท่าแซะ,ชุมพร,อนุบาล–ประถมศึกษา
โรงเรียนบ้านหาดหงส์,ท่าข้าม,ท่าแซะ,ชุมพร,อนุบาล–ประถมศึกษา
โรงเรียนบ้านหินกบ,ชุมโค,ปะทิว,ชุมพร,อนุบาล–ประถมศึกษา
โรงเรียนบ้านหินแก้ว,หินแก้ว,ท่าแซะ,ชุมพร,อนุบาล–มัธยมศึกษาตอนต้น
โรงเรียนบ้านเหมืองทอง,สลุย,ท่าแซะ,ชุมพร,อนุบาล–ประถมศึกษา
โรงเรียนบ้านใหม่พัฒนา,คุริง,ท่าแซะ,ชุมพร,อนุบาล–ประถมศึกษา
โรงเรียนบ้านใหม่สมบูรณ์,สลุย,ท่าแซะ,ชุมพร,อนุบาล–ประถมศึกษา
โรงเรียนประชานิคม 2,คุริง,ท่าแซะ,ชุมพร,อนุบาล–มัธยมศึกษาตอนต้น
โรงเรียนประชานิคม 4,หงษ์เจริญ,ท่าแซะ,ชุมพร,อนุบาล–มัธยมศึกษาตอนต้น
โรงเรียนประชาพัฒนา,สองพี่น้อง,ท่าแซะ,ชุมพร,อนุบาล–ประถมศึกษา
โรงเรียนประชาสันติ,นากระตาม,ท่าแซะ,ชุมพร,อนุบาล–ประถมศึกษา
โรงเรียนเมืองชุมพรบ้านเขาถล่ม,วังไผ่,เมืองชุมพร,ชุมพร,อนุบาล–มัธยมศึกษาตอนต้น
โรงเรียนวัดขุนกระทิง,ขุนกระทิง,เมืองชุมพร,ชุมพร,อนุบาล–ประถมศึกษา
โรงเรียนวัดควนมณี,นากระตาม,ท่าแซะ,ชุมพร,อนุบาล–ประถมศึกษา
โรงเรียนวัดคูขุด,บางหมาก,เมืองชุมพร,ชุมพร,อนุบาล–ประถมศึกษา
โรงเรียนวัดเชิงกระ,วิสัยเหนือ,เมืองชุมพร,ชุมพร,อนุบาล–ประถมศึกษา
โรงเรียนวัดดอนทรายแก้ว,ท่ายาง,เมืองชุมพร,ชุมพร,อนุบาล–มัธยมศึกษาตอนต้น
โรงเรียนวัดดอนมะม่วง,ทุ่งคา,เมืองชุมพร,ชุมพร,อนุบาล–ประถมศึกษา
โรงเรียนวัดดอนเมือง,วังไผ่,เมืองชุมพร,ชุมพร,อนุบาล–มัธยมศึกษาตอนต้น
โรงเรียนวัดดอนยาง,ดอนยาง,ปะทิว,ชุมพร,อนุบาล–ประถมศึกษา
โรงเรียนวัดดอนรวบ,บางหมาก,เมืองชุมพร,ชุมพร,อนุบาล–มัธยมศึกษาตอนต้น
โรงเรียนวัดทุ่งคา,ทุ่งคา,เมืองชุมพร,ชุมพร,อนุบาล–ประถมศึกษา
โรงเรียนวัดน้อมถวาย,วังใหม่,เมืองชุมพร,ชุมพร,อนุบาล–มัธยมศึกษาตอนต้น
โรงเรียนวัดนาทุ่ง,นาทุ่ง,เมืองชุมพร,ชุมพร,อนุบาล–ประถมศึกษา
โรงเรียนวัดบางลึก,บางลึก,เมืองชุมพร,ชุมพร,อนุบาล–ประถมศึกษา
โรงเรียนวัดบางแหวน,ปากคลอง,ปะทิว,ชุมพร,อนุบาล–มัธยมศึกษาตอนต้น
โรงเรียนวัดพิชัยยาราม,ท่ายาง,เมืองชุมพร,ชุมพร,อนุบาล–มัธยมศึกษาตอนต้น
โรงเรียนวัดวังครก,นากระตาม,ท่าแซะ,ชุมพร,อนุบาล–ประถมศึกษา
โรงเรียนวัดวังไผ่,วังไผ่,เมืองชุมพร,ชุมพร,อนุบาล–ประถมศึกษา
โรงเรียนวัดหัวกรูด,ปากน้ำ,เมืองชุมพร,ชุมพร,อนุบาล–มัธยมศึกษาตอนต้น
โรงเรียนวัดหาดทรายแก้ว,ตากแดด,เมืองชุมพร,ชุมพร,อนุบาล–มัธยมศึกษาตอนต้น
โรงเรียนวัดหูรอ,นาชะอัง,เมืองชุมพร,ชุมพร,อนุบาล–ประถมศึกษา
โรงเรียนอนุบาลชุมพร,ท่าตะเภา,เมืองชุมพร,ชุมพร,อนุบาล–ประถมศึกษา
โรงเรียนอนุบาลท่าแซะ (บ้านท่าแซะ),ท่าแซะ,ท่าแซะ,ชุมพร,อนุบาล–ประถมศึกษา
โรงเรียนอนุบาลบ้านเนินสำลี,สะพลี,ปะทิว,ชุมพร,อนุบาล–ประถมศึกษา
โรงเรียนอนุบาลปะทิว (บางสนพิพิธราษฎร์บำรุง),บางสน,ปะทิว,ชุมพร,อนุบาล–ประถมศึกษา
โรงเรียนอนุบาลเมืองชุมพรวัดสุบรรณนิมิตร,ตากแดด,เมืองชุมพร,ชุมพร,อนุบาล–มัธยมศึกษา
โรงเรียนค่ายลูกเสืออำเภอสวี,วิสัยใต้,สวี,ชุมพร,อนุบาล–ประถมศึกษา
โรงเรียนชุมชนบ้านเขาหลาง,ทุ่งหลวง,ละแม,ชุมพร,อนุบาล–มัธยมศึกษาตอนต้น
โรงเรียนชุมชนวัดขันเงิน,วังตะกอ,หลังสวน,ชุมพร,อนุบาล–ประถมศึกษา
โรงเรียนชุมชนวัดท่าสุธาราม,ตะโก,ทุ่งตะโก,ชุมพร,อนุบาล–มัธยมศึกษาตอนต้น
โรงเรียนชุมชนวัดธรรมถาวร,ทุ่งตะไคร,ทุ่งตะโก,ชุมพร,อนุบาล–มัธยมศึกษาตอนต้น
โรงเรียนชุมชนวัดหาดสำราญ,หาดยาย,หลังสวน,ชุมพร,อนุบาล–มัธยมศึกษาตอนต้น
โรงเรียนชุมชนสวี,นาโพธิ์,สวี,ชุมพร,อนุบาล–ประถมศึกษา
โรงเรียนบ้านแก่งกะทั่ง,นาสัก,สวี,ชุมพร,อนุบาล–ประถมศึกษา
โรงเรียนบ้านเขาค่าย,เขาค่าย,สวี,ชุมพร,อนุบาล–มัธยมศึกษาตอนต้น
โรงเรียนบ้านเขาแงน,วังตะกอ,หลังสวน,ชุมพร,อนุบาล–ประถมศึกษา
