name,subDistrict,district,province,level
โรงเรียนบ้านเขาตะเภาทอง,พะโต๊ะ,พะโต๊ะ,ชุมพร,อนุบาล–ประถมศึกษา
โรงเรียนบ้านเขาตากุน,สวนแตง,ละแม,ชุมพร,อนุบาล–ประถมศึกษา
โรงเรียนบ้านเขาทะลุ,เขาทะลุ,สวี,ชุมพร,อนุบาล–ประถมศึกษา
โรงเรียนบ้านเขาน้อยสามัคคี,นาสัก,สวี,ชุมพร,อนุบาล–ประถมศึกษา
โรงเรียนบ้านเขาล้าน,ครน,สวี,ชุมพร,อนุบาล–มัธยมศึกษาตอนต้น
โรงเรียนบ้านเขาวงกรด,ช่องไม้แก้ว,ทุ่งตะโก,ชุมพร,อนุบาล–ประถมศึกษา
โรงเรียนบ้านคลองกก,บ้านควน,หลังสวน,ชุมพร,อนุบาล–ประถมศึกษา
โรงเรียนบ้านคลองน้อย,ทุ่งระยะ,สวี,ชุมพร,อนุบาล–ประถมศึกษา
โรงเรียนบ้านคลองระ,วังตะกอ,หลังสวน,ชุมพร,อนุบาล–ประถมศึกษา
โรงเรียนบ้านคลองสง,ละแม,ละแม,ชุมพร,อนุบาล–ประถมศึกษา
โรงเรียนบ้านคลองเหนก,ปังหวาน,พะโต๊ะ,ชุมพร,อนุบาล–มัธยมศึกษาตอนต้น
โรงเรียนบ้านควนตะวันออก,นาพญา,หลังสวน,ชุมพร,อนุบาล–ประถมศึกษา
โรงเรียนบ้านคู,ครน,สวี,ชุมพร,อนุบาล–ประถมศึกษา
โรงเรียนบ้านดวด,สวนแตง,ละแม,ชุมพร,อนุบาล–ประถมศึกษา
โรงเรียนบ้านดอนแค,สวนแตง,ละแม,ชุมพร,อนุบาล–มัธยมศึกษาตอนต้น
โรงเรียนบ้านดอนนน,ท่ามะพลา,หลังสวน,ชุมพร,อนุบาล–ประถมศึกษา
โรงเรียนบ้านตรัง (จันทสิงห์อุทิศ),พะโต๊ะ,พะโต๊ะ,ชุมพร,อนุบาล–ประถมศึกษา
โรงเรียนบ้านต่อตั้ง,ปากทรง,พะโต๊ะ,ชุมพร,อนุบาล–ประถมศึกษา
โรงเรียนบ้านทรายทอง,ละแม,ละแม,ชุมพร,อนุบาล–ประถมศึกษา
โรงเรียนบ้านทับช้าง,ตะโก,ทุ่งตะโก,ชุมพร,อนุบาล–ประถมศึกษา
โรงเรียนบ้านทับใหม่,ทุ่งคาวัด,ละแม,ชุมพร,อนุบาล–มัธยมศึกษาตอนต้น
โรงเรียนบ้านท่าแพราษฎร์พัฒนา,ปังหวาน,พะโต๊ะ,ชุมพร,อนุบาล–มัธยมศึกษาตอนต้น
โรงเรียนบ้านทุ่งเขาสะบ้า,วิสัยใต้,สวี,ชุมพร,อนุบาล–มัธยมศึกษาตอนต้น
โรงเรียนบ้านทุ่งคาโตนด,เขาค่าย,สวี,ชุมพร,อนุบาล–มัธยมศึกษาตอนต้น
โรงเรียนบ้านไทยพัฒนา,นาสัก,สวี,ชุมพร,อนุบาล–มัธยมศึกษาตอนต้น
โรงเรียนบ้านไทรล่า,ครน,สวี,ชุมพร,อนุบาล–ประถมศึกษา
โรงเรียนบ้านนาเหรี่ยง,ครน,สวี,ชุมพร,อนุบาล–ประถมศึกษา
โรงเรียนบ้านน้ำฉา,ครน,สวี,ชุมพร,อนุบาล–ประถมศึกษา
โรงเรียนบ้านน้ำตก,บางมะพร้าว,หลังสวน,ชุมพร,อนุบาล–ประถมศึกษา
โรงเรียนบ้านน้ำลอด,บางน้ำจืด,หลังสวน,ชุมพร,อนุบาล–ประถมศึกษา
โรงเรียนบ้านน้ำลอดน้อย,ทุ่งระยะ,สวี,ชุมพร,อนุบาล–มัธยมศึกษาตอนต้น
โรงเรียนบ้านในกริม,หาดยาย,หลังสวน,ชุมพร,อนุบาล–มัธยมศึกษาตอนต้น
โรงเรียนบ้านในหุบ,เขาค่าย,สวี,ชุมพร,อนุบาล–มัธยมศึกษาตอนต้น
โรงเรียนบ้านในเหมือง,นาขา,หลังสวน,ชุมพร,อนุบาล–มัธยมศึกษาตอนต้น
โรงเรียนบ้านบางหยี,บางน้ำจืด,หลังสวน,ชุมพร,อนุบาล–มัธยมศึกษาตอนต้น
โรงเรียนบ้านปังหวาน,ปังหวาน,พะโต๊ะ,ชุมพร,อนุบาล–ประถมศึกษา
โรงเรียนบ้านปากทรง,ปากทรง,พะโต๊ะ,ชุมพร,อนุบาล–ประถมศึกษา
"โรงเรียนบ้านปากน้ำหลังสวน ""ประชานุเคราะห์""",บางมะพร้าว,หลังสวน,ชุมพร,อนุบาล–ประถมศึกษา
โรงเรียนบ้านปากเลข,พะโต๊ะ,พะโต๊ะ,ชุมพร,อนุบาล–ประถมศึกษา
โรงเรียนบ้านพระรักษ์ราษฎร์บำรุง,พระรักษ์,พะโต๊ะ,ชุมพร,อนุบาล–มัธยมศึกษาตอนต้น
โรงเรียนบ้านพังเหา,ปังหวาน,พะโต๊ะ,ชุมพร,อนุบาล–ประถมศึกษา
โรงเรียนบ้านแพรกแห้ง,วิสัยใต้,สวี,ชุมพร,อนุบาล–ประถมศึกษา
โรงเรียนบ้านยางงาม,นาสัก,สวี,ชุมพร,อนุบาล–ประถมศึกษา
โรงเรียนบ้านเล็บกะรอก,ด่านสวี,สวี,ชุมพร,อนุบาล–ประถมศึกษา
โรงเรียนบ้านวังปลา,ช่องไม้แก้ว,ทุ่งตะโก,ชุมพร,อนุบาล–ประถมศึกษา
โรงเรียนบ้านสวนจันทน์,หาดยาย,หลังสวน,ชุมพร,อนุบาล–ประถมศึกษา
โรงเรียนบ้านสวนสมบูรณ์,สวนแตง,ละแม,ชุมพร,อนุบาล–ประถมศึกษา
โรงเรียนบ้านสะพานยูง,นาพญา,หลังสวน,ชุมพร,อนุบาล–ประถมศึกษา
โรงเรียนบ้านสามแยกจำปา,ตะโก,ทุ่งตะโก,ชุมพร,อนุบาล–ประถมศึกษา
โรงเรียนบ้านหนองโพธิ์ มิตรภาพที่ 129,บ้านควน,หลังสวน,ชุมพร,อนุบาล–ประถมศึกษา
โรงเรียนบ้านหนองไก่ปิ้ง,บางน้ำจืด,หลังสวน,ชุมพร,อนุบาล–ประถมศึกษา
โรงเรียนบ้านหนองปลา,ท่าหิน,สวี,ชุมพร,อนุบาล–ประถมศึกษา
โรงเรียนบ้านหนองปลา,นาขา,หลังสวน,ชุมพร,อนุบาล–ประถมศึกษา
โรงเรียนบ้านห้วยกลาง,เขาทะลุ,สวี,ชุมพร,อนุบาล–มัธยมศึกษาตอนต้น
โรงเรียนบ้านห้วยชัน,ทุ่งระยะ,สวี,ชุมพร,อนุบาล–มัธยมศึกษาตอนต้น
โรงเรียนบ้านห้วยทรายขาว,นาสัก,สวี,ชุมพร,อนุบาล–ประถมศึกษา
โรงเรียนบ้านห้วยทับทอง,เขาทะลุ,สวี,ชุมพร,อนุบาล–ประถมศึกษา
โรงเรียนบ้านห้วยมุด,ทุ่งตะไคร,ทุ่งตะโก,ชุมพร,อนุบาล–ประถมศึกษา
โรงเรียนบ้านห้วยหลอด,บางมะพร้าว,หลังสวน,ชุมพร,อนุบาล–ประถมศึกษา
โรงเรียนบ้านห้วยใหญ่,นาสัก,สวี,ชุมพร,อนุบาล–ประถมศึกษา
โรงเรียนบ้านหาดทรายรี,ท่าหิน,สวี,ชุมพร,อนุบาล–ประถมศึกษา
โรงเรียนบ้านแหลมยางนา,ตะโก,ทุ่งตะโก,ชุมพร,อนุบาล–ประถมศึกษา
โรงเรียนบ้านแหลมสันติ,ละแม,ละแม,ชุมพร,อนุบาล–ประถมศึกษา
โรงเรียนบ้านโหมงราษฎร์พัฒนา,พระรักษ์,พะโต๊ะ,ชุมพร,อนุบาล–มัธยมศึกษาตอนต้น
โรงเรียนบ้านอ่าวมะม่วง,ปากตะโก,ทุ่งตะโก,ชุมพร,อนุบาล–ประถมศึกษา
โรงเรียนประชาเอื้ออารี,ละแม,ละแม,ชุมพร,อนุบาล–ประถมศึกษา
โรงเรียนประชาบุษยวิทย์,หาดยาย,หลังสวน,ชุมพร,อนุบาล–ประถมศึกษา
โรงเรียนพัฒนศึกษา,ปากทรง,พะโต๊ะ,ชุมพร,อนุบาล–มัธยมศึกษาตอนต้น
โรงเรียนเพียงหลวง 5 ในทูลกระหม่อมหญิงอุบลรัตนราชกัญญา สิริวัฒนาพรรณวดี,พะโต๊ะ,พะโต๊ะ,ชุมพร,อนุบาล–ประถมศึกษา
โรงเรียนราชประชานุเคราะห์ 3,ทุ่งตะไคร,ทุ่งตะโก,ชุมพร,อนุบาล–มัธยมศึกษาตอนต้น
โรงเรียนวัดจันทราวาส,ครน,สวี,ชุมพร,อนุบาล–ประถมศึกษา
โรงเรียนวัดชลธารวดี,บ้านควน,หลังสวน,ชุมพร,อนุบาล–ประถมศึกษา
โรงเรียนวัดชลธีนิมิตร,บางน้ำจืด,หลังสวน,ชุมพร,อนุบาล–ประถมศึกษา
โรงเรียนวัดชลธีพฤกษาราม,ปากตะโก,ทุ่งตะโก,ชุมพร,อนุบาล–มัธยมศึกษาตอนต้น
โรงเรียนวัดชุมแสง,ทุ่งระยะ,สวี,ชุมพร,อนุบาล–ประถมศึกษา
โรงเรียนวัดเชิงคีรี,ปากแพรก,สวี,ชุมพร,อนุบาล–ประถมศึกษา
โรงเรียนวัดดอนชัย,พ้อแดง,หลังสวน,ชุมพร,อนุบาล–ประถมศึกษา
โรงเรียนวัดถ้ำเขาล้าน,ด่านสวี,สวี,ชุมพร,อนุบาล–ประถมศึกษา
โรงเรียนวัดท้องตม,ด่านสวี,สวี,ชุมพร,อนุบาล–ประถมศึกษา
โรงเรียนวัดท่าทอง,ตะโก,ทุ่งตะโก,ชุมพร,อนุบาล–ประถมศึกษา
โรงเรียนวัดท่าหิน (ดรุณศึกษา),ท่าหิน,สวี,ชุมพร,อนุบาล–ประถมศึกษา
โรงเรียนวัดเทพนิมิตวนาราม,ตะโก,ทุ่งตะโก,ชุมพร,อนุบาล–ประถมศึกษา
โรงเรียนวัดธัญญาราม,นาโพธิ์,สวี,ชุมพร,อนุบาล–ประถมศึกษา
โรงเรียนวัดนพคุณ,นาขา,หลังสวน,ชุมพร,อนุบาล–ประถมศึกษา
โรงเรียนวัดนาทิการาม,บางมะพร้าว,หลังสวน,ชุมพร,อนุบาล–ประถมศึกษา
โรงเรียนวัดนาสัก,นาสัก,สวี,ชุมพร,อนุบาล–ประถมศึกษา
โรงเรียนวัดบรรพตวารีเขต,ด่านสวี,สวี,ชุมพร,อนุบาล–ประถมศึกษา
โรงเรียนวัดประสาทนิกร,ขันเงิน,หลังสวน,ชุมพร,อนุบาล–มัธยมศึกษาตอนต้น
โรงเรียนวัดปากน้ำละแม,ละแม,ละแม,ชุมพร,อนุบาล–ประถมศึกษา
โรงเรียนวัดปิยะวัฒนาราม,ละแม,ละแม,ชุมพร,อนุบาล–ประถมศึกษา
โรงเรียนวัดผุสดีภูผาราม,ช่องไม้แก้ว,ทุ่งตะโก,ชุมพร,อนุบาล–ประถมศึกษา
โรงเรียนวัดพะงุ้น,สวี,สวี,ชุมพร,อนุบาล–ประถมศึกษา
โรงเรียนวัดมุจลินทาราม,ทุ่งตะไคร,ทุ่งตะโก,ชุมพร,อนุบาล–ประถมศึกษา
โรงเรียนวัดราชบุรณะ,ท่ามะพลา,หลังสวน,ชุมพร,อนุบาล–ประถมศึกษา
โรงเรียนวัดราษฎร์บำรุง,บางมะพร้าว,หลังสวน,ชุมพร,อนุบาล–มัธยมศึกษาตอนต้น
โรงเรียนวัดราษฎร์อรุณ,นาพญา,หลังสวน,ชุมพร,อนุบาล–ประถมศึกษา
โรงเรียนวัดวาลุการาม,แหลมทราย,หลังสวน,ชุมพร,อนุบาล–ประถมศึกษา
โรงเรียนวัดสมุหเขตตาราม,วังตะกอ,หลังสวน,ชุมพร,อนุบาล–ประถมศึกษา
โรงเรียนวัดสว่างมนัส,ปากน้ำ,หลังสวน,ชุมพร,อนุบาล–ประถมศึกษา
โรงเรียนวัดสุวรรณนิมิต,ทุ่งหลวง,ละแม,ชุมพร,อนุบาล–ประถมศึกษา
โรงเรียนวัดโสมสิริวัฒนาราม,ทุ่งหลวง,ละแม,ชุมพร,ประถมศึกษา
โรงเรียนวัดหนองบัว,นาสัก,สวี,ชุมพร,อนุบาล–ประถมศึกษา
โรงเรียนวัดแหลมปอ,สวี,สวี,ชุมพร,อนุบาล–ประถมศึกษา
โรงเรียนวัดอัมพาวาส,นาพญา,หลังสวน,ชุมพร,อนุบาล–ประถมศึกษา
โรงเรียนสหกรณ์นิคมอุปถัมภ์,บ้านควน,หลังสวน,ชุมพร,อนุบาล–ประถมศึกษา
โรงเรียนสหกรณ์พัฒนา,ทุ่งคาวัด,ละแม,ชุมพร,อนุบาล–มัธยมศึกษาตอนต้น
โรงเรียนสามัคคีวัฒนา,ละแม,ละแม,ชุมพร,อนุบาล–ประถมศึกษา
โรงเรียนอนุบาลพะโต๊ะ,พะโต๊ะ,พะโต๊ะ,ชุมพร,อนุบาล–ประถมศึกษา
โรงเรียนอนุบาลสวี (บ้านนาโพธิ์),นาโพธิ์,สวี,ชุมพร,อนุบาล–ประถมศึกษา
โรงเรียนชุมพรปัญญานุกูล,สะพลี,ปะทิว,ชุมพร,
โรงเรียนราชประชานุเคราะห์ 20,สลุย,ท่าแซะ,ชุมพร,ประถมศึกษา-มัธยมศึกษา
โรงเรียนบ้านทับวัง,บ้านควน,หลังสวน,ชุมพร,อนุบาล–มัธยมศึกษา
โรงเรียนสหกรณ์ประชานุกูล,ทะเลทรัพย์,ปะทิว,ชุมพร,อนุบาล–มัธยมศึกษา
โรงเรียนเทศบาล 1 (บ้านท่าตะเภา),ท่าตะเภา,เมืองชุมพร,ชุมพร,อนุบาล–มัธยมศึกษา
โรงเรียนเทศบาล 2 (วัดเกาะแก้ว),วังไผ่,เมืองชุมพร,ชุมพร,อนุบาล–ประถมศึกษา
โรงเรียนเทศบาลวัดด่านประชากร,หลังสวน,หลังสวน,ชุมพร,อนุบาล–ประถมศึกษา
โรงเรียนอุดมวิทยากร,หลังสวน,หลังสวน,ชุมพร,มัธยมศึกษา
โรงเรียนชุมพรศึกษา,วังไผ่,เมืองชุมพร,ชุมพร,เตรียมอนุบาล–ประถมศึกษา
โรงเรียนนานาชาติธีโอดอร์,ตากแดด,เมืองชุมพร,ชุมพร,
โรงเรียนนานาชาติลิตเติ้ลแลมบ์ คริสเตียน,นาทุ่ง,เมืองชุมพร,ชุมพร,อนุบาล–ประถมศึกษา
โรงเรียนนิรมลชุมพร,ตากแดด,เมืองชุมพร,ชุมพร,เตรียมอนุบาล–มัธยมศึกษา
โรงเรียนบุญสมบูรณ์ศึกษา,บางหมาก,เมืองชุมพร,ชุมพร,
โรงเรียนบุญสิทธิ์อนุสรณ์,นาโพธิ์,สวี,ชุมพร,
โรงเรียนบุณยสมบัติวิทยา,นาโพธิ์,สวี,ชุมพร,
โรงเรียนปัญญาพัฒนา,ตากแดด,เมืองชุมพร,ชุมพร,เตรียมอนุบาล–อนุบาล
โรงเรียนฝวาหมินกงลิ,ท่าตะเภา,เมืองชุมพร,ชุมพร,
โรงเรียนพัฒนศาสน์วิทยาท่าแซะ,ท่าแซะ,ท่าแซะ,ชุมพร,ประถมศึกษา–มัธยมศึกษาตอนต้น
โรงเรียนพุทธยาคมศรียาภัย,นาทุ่ง,เมืองชุมพร,ชุมพร,เตรียมอนุบาล–มัธยมศึกษาตอนต้น
โรงเรียนภูบดินทร์พิทยาลัย,ขันเงิน,หลังสวน,ชุมพร,เตรียมอนุบาล–มัธยมศึกษาตอนต้น
โรงเรียนมันตานุสรณ์,ตากแดด,เมืองชุมพร,ชุมพร,เตรียมอนุบาล–ประถมศึกษา
โรงเรียนลิตเติ้ลแลมบ์,ดอนยาง,ปะทิว,ชุมพร,เตรียมอนุบาล–ประถมศึกษา
โรงเรียนวังเด็กวัฒนา,วังตะกอ,หลังสวน,ชุมพร,เตรียมอนุบาล–มัธยมศึกษาตอนต้น
โรงเรียนสหศึกษา,ท่าตะเภา,เมืองชุมพร,ชุมพร,เตรียมอนุบาล–ประถมศึกษา
โรงเรียนหลังสวนเทศบาลอุปถัมภ์,หลังสวน,หลังสวน,ชุมพร,เตรียมอนุบาล–ประถมศึกษา
โรงเรียนอนุบาลเกษมวิทยา,ขันเงิน,หลังสวน,ชุมพร,อนุบาล–ประถมศึกษา
โรงเรียนอนุบาลดรุณรัตน์,ท่าแซะ,ท่าแซะ,ชุมพร,อนุบาล–ประถมศึกษา
โรงเรียนอนุบาลทอรัก ทุ่งตะโก,ทุ่งตะไคร,ทุ่งตะโก,ชุมพร,เตรียมอนุบาล–อนุบาล
โรงเรียนอนุบาลบ้านเด็ก,ขันเงิน,หลังสวน,ชุมพร,เตรียมอนุบาล–อนุบาล
โรงเรียนอนุบาลปานฤทัย,ท่าแซะ,ท่าแซะ,ชุมพร,อนุบาล–ประถมศึกษา
โรงเรียนอนุบาลสุภาภรณ์,ดอนยาง,ปะทิว,ชุมพร,เตรียมอนุบาล–ประถมศึกษา
โรงเรียนอนุบาลอัลบานีย์,ท่าแซะ,ท่าแซะ,ชุมพร,อนุบาล
โรงเรียนอนุบาลอำนวยสุข,ดอนยาง,ปะทิว,ชุมพร,
โรงเรียนเอื้ออำพน,ละแม,ละแม,ชุมพร,เตรียมอนุบาล–ประถมศึกษา
โรงเรียนบ้านปากน้ำหลังสวน ประชานุเคราะห์,บางมะพร้าว,หลังสวน,ชุมพร,อนุบาล–ประถมศึกษา
โรงเรียนปากน้ำหลังสวนวิทยา,หลังสวน,หลังสวน,ชุมพร,มัธยมศึกษา