name,subDistrict,district,province,level
โรงเรียนดอนมัน,โคกกลาง,ประทาย,นครราชสีมา,อนุบาล–มัธยมศึกษา
โรงเรียนดอนใหญ่พัฒนา,ดอนมัน,ประทาย,นครราชสีมา,อนุบาล–ประถมศึกษา
โรงเรียนดอนอีลุ่ม (ประชารัฐพัฒนา),ตลาดไทร,ประทาย,นครราชสีมา,อนุบาล–มัธยมศึกษาตอนต้น
โรงเรียนตลาดไทรโนนดู่หนองจิกวิทยา,ตลาดไทร,ชุมพวง,นครราชสีมา,อนุบาล–ประถมศึกษา
โรงเรียนไตรราษฎร์สามัคคี,หนองค่าย,ประทาย,นครราชสีมา,อนุบาล–ประถมศึกษา
โรงเรียนท่าเรือวิทยา,กระเบื้องนอก,เมืองยาง,นครราชสีมา,อนุบาล–ประถมศึกษา
โรงเรียนท่าลาด,ท่าลาด,ชุมพวง,นครราชสีมา,อนุบาล–มัธยมศึกษา
โรงเรียนท้าวสุรนารี (ระดมอนุสรณ์),ในเมือง,พิมาย,นครราชสีมา,อนุบาล–ประถมศึกษา
โรงเรียนไทยรัฐวิทยา 82 (โคกตองเจริญ),ท่าลาด,ชุมพวง,นครราชสีมา,อนุบาล–มัธยมศึกษาตอนต้น
โรงเรียนนิคมสร้างตนเองพิมาย 2,นิคมสร้างตนเอง,พิมาย,นครราชสีมา,อนุบาล–ประถมศึกษา
โรงเรียนนิคมสร้างตนเองพิมาย 3,นิคมสร้างตนเอง,พิมาย,นครราชสีมา,อนุบาล–ประถมศึกษา
โรงเรียนนิคมสร้างตนเองพิมาย 4,หนองระเวียง,พิมาย,นครราชสีมา,อนุบาล–มัธยมศึกษาตอนต้น
โรงเรียนนิคมสร้างตนเองพิมาย 5,รังกาใหญ่,พิมาย,นครราชสีมา,อนุบาล–ประถมศึกษา
โรงเรียนนิคมสร้างตนเองพิมาย 6,นิคมสร้างตนเอง,พิมาย,นครราชสีมา,อนุบาล–ประถมศึกษา
โรงเรียนโนนขุยสามัคคี,หนองหลัก,ชุมพวง,นครราชสีมา,อนุบาล–ประถมศึกษา
"โรงเรียนโนนตูม ""รัฐราษฎร์รังสรรค์""",โนนตูม,ชุมพวง,นครราชสีมา,อนุบาล–ประถมศึกษา
โรงเรียนโนนเพ็ดวิทยา,โนนเพ็ด,ประทาย,นครราชสีมา,อนุบาล–ประถมศึกษา
โรงเรียนโนนสมบูรณ์หนองมะเขือ,ละหานปลาค้าว,เมืองยาง,นครราชสีมา,12|อนุบาล–ประถมศึก
โรงเรียนบ้านกระทุ่มราย,กระทุ่มราย,ประทาย,นครราชสีมา,อนุบาล–มัธยมศึกษาตอนต้น
โรงเรียนบ้านกระเบื้อง,กระชอน,พิมาย,นครราชสีมา,อนุบาล–ประถมศึกษา
โรงเรียนบ้านกระเบื้องวิทยาคาร,กระเบื้องนอก,เมืองยาง,นครราชสีมา,อนุบาล–ประถมศึกษา
โรงเรียนบ้านกระเบื้องใหญ่,กระเบื้องใหญ่,พิมาย,นครราชสีมา,อนุบาล–มัธยมศึกษาตอนต้น
โรงเรียนบ้านกล้วย,ดงใหญ่,พิมาย,นครราชสีมา,อนุบาล–มัธยมศึกษาตอนต้น
โรงเรียนบ้านโกรกสำโรง,ดอนยาวใหญ่,โนนแดง,นครราชสีมา,อนุบาล–มัธยมศึกษาตอนต้น
โรงเรียนบ้านขามใต้,ดงใหญ่,พิมาย,นครราชสีมา,อนุบาล–ประถมศึกษา
โรงเรียนบ้านขามขุนร่ม,ประสุข,ชุมพวง,นครราชสีมา,อนุบาล–ประถมศึกษา
โรงเรียนบ้านขุยวิทยา,ขุย,ลำทะเมนชัย,นครราชสีมา,อนุบาล–มัธยมศึกษาตอนต้น
โรงเรียนบ้านเขว้าวิทยา,กระทุ่มราย,ประทาย,นครราชสีมา,อนุบาล–มัธยมศึกษาตอนต้น
โรงเรียนบ้านครบุรีศึกษา,ละหานปลาค้าว,เมืองยาง,นครราชสีมา,อนุบาล–มัธยมศึกษาตอนต้น
โรงเรียนบ้านคล้า,สัมฤทธิ์,พิมาย,นครราชสีมา,อนุบาล–ประถมศึกษา
โรงเรียนบ้านคึมหญ้านาง,วังไม้แดง,ประทาย,นครราชสีมา,อนุบาล–ประถมศึกษา
โรงเรียนบ้านโคกขาม (นาคพัฒนา),โบสถ์,พิมาย,นครราชสีมา,อนุบาล–มัธยมศึกษาตอนต้น
โรงเรียนบ้านโคกเพชร,โนนรัง,ชุมพวง,นครราชสีมา,อนุบาล–ประถมศึกษา
โรงเรียนบ้านโคกล่ามขี้เหล็ก,ทุ่งสว่าง,ประทาย,นครราชสีมา,อนุบาล–ประถมศึกษา
โรงเรียนบ้านโคกหินช้าง,สาหร่าย,ชุมพวง,นครราชสีมา,อนุบาล–ประถมศึกษา
โรงเรียนบ้านจาบ,โนนแดง,โนนแดง,นครราชสีมา,อนุบาล–ประถมศึกษา
โรงเรียนบ้านฉกาจช่องโค,รังกาใหญ่,พิมาย,นครราชสีมา,อนุบาล–ประถมศึกษา
โรงเรียนบ้านช่องแมว,ช่องแมว,ลำทะเมนชัย,นครราชสีมา,อนุบาล–ประถมศึกษา
โรงเรียนบ้านชีวาน,ชีวาน,พิมาย,นครราชสีมา,อนุบาล–ประถมศึกษา
โรงเรียนบ้านซาด,ชีวาน,พิมาย,นครราชสีมา,อนุบาล–ประถมศึกษา
โรงเรียนบ้านซึม (ศีลราษฎร์นุเคราะห์),สัมฤทธิ์,พิมาย,นครราชสีมา,อนุบาล–มัธยมศึกษาตอนต้น
โรงเรียนบ้านดงบัง (สว่างวิทยา),โนนรัง,ชุมพวง,นครราชสีมา,อนุบาล–ประถมศึกษา
โรงเรียนบ้านดงประชานุกูล,ดงใหญ่,พิมาย,นครราชสีมา,อนุบาล–มัธยมศึกษาตอนต้น
โรงเรียนบ้านดงหลบใหม่สามัคคีวิทยา,ช่องแมว,ลำทะเมนชัย,นครราชสีมา,อนุบาล–มัธยมศึกษาตอนต้น
โรงเรียนบ้านดอนเขว้า,ชีวาน,พิมาย,นครราชสีมา,อนุบาล–มัธยมศึกษาตอนต้น
โรงเรียนบ้านดอนแซะ,ในเมือง,พิมาย,นครราชสีมา,อนุบาล–ประถมศึกษา
โรงเรียนบ้านดอนตัดเรือ,โนนแดง,โนนแดง,นครราชสีมา,อนุบาล–มัธยมศึกษาตอนต้น
โรงเรียนบ้านดอนยาว,ดอนยาวใหญ่,โนนแดง,นครราชสีมา,อนุบาล–มัธยมศึกษาตอนต้น
โรงเรียนบ้านดอนลำดวน,ประสุข,ชุมพวง,นครราชสีมา,อนุบาล–ประถมศึกษา
โรงเรียนบ้านดอนวัว,เมืองโดน,ประทาย,นครราชสีมา,อนุบาล–ประถมศึกษา
โรงเรียนบ้านดอนสามัคคี,เมืองโดน,ประทาย,นครราชสีมา,อนุบาล–ประถมศึกษา
โรงเรียนบ้านดอนหวาย,หนองระเวียง,พิมาย,นครราชสีมา,อนุบาล–ประถมศึกษา
โรงเรียนบ้านตลาดไทร,ตลาดไทร,ประทาย,นครราชสีมา,อนุบาล–ประถมศึกษา
โรงเรียนบ้านตลาดประดู่,กระชอน,พิมาย,นครราชสีมา,อนุบาล–ประถมศึกษา
โรงเรียนบ้านตะคร้อ,โบสถ์,พิมาย,นครราชสีมา,อนุบาล–ประถมศึกษา
โรงเรียนบ้านตะบอง,โบสถ์,พิมาย,นครราชสีมา,อนุบาล–มัธยมศึกษาตอนต้น
โรงเรียนบ้านเตยกระโตน,ประทาย,ประทาย,นครราชสีมา,อนุบาล–ประถมศึกษา
โรงเรียนบ้านเตยประชาบำรุง,กระเบื้องใหญ่,พิมาย,นครราชสีมา,อนุบาล–ประถมศึกษา
โรงเรียนบ้านถนน,ท่าหลวง,พิมาย,นครราชสีมา,อนุบาล–ประถมศึกษา
โรงเรียนบ้านทับควาย,ชีวาน,พิมาย,นครราชสีมา,อนุบาล–ประถมศึกษา
โรงเรียนบ้านท่าแดง,สัมฤทธิ์,พิมาย,นครราชสีมา,อนุบาล–ประถมศึกษา
โรงเรียนบ้านท่าเยี่ยมวิทยายล,กระเบื้องนอก,เมืองยาง,นครราชสีมา,อนุบาล–ประถมศึกษา
โรงเรียนบ้านท่าหลวง,ท่าหลวง,พิมาย,นครราชสีมา,อนุบาล–ประถมศึกษา
โรงเรียนบ้านทุ่งมนวิทยาคาร,หนองค่าย,ประทาย,นครราชสีมา,อนุบาล–ประถมศึกษา
โรงเรียนบ้านนางโทพัฒนา,เมืองยาง,เมืองยาง,นครราชสีมา,อนุบาล–ประถมศึกษา
โรงเรียนบ้านนาดี,ดอนยาวใหญ่,โนนแดง,นครราชสีมา,อนุบาล–ประถมศึกษา
โรงเรียนบ้านโนนกระเบื้องหนองหัวช้างสามัคคี,นิคมสร้างตนเอง,พิมาย,นครราชสีมา,อนุบาล–มัธยมศึกษาตอนต้น
โรงเรียนบ้านโนนโชงโลง,ดงใหญ่,พิมาย,นครราชสีมา,อนุบาล–มัธยมศึกษาตอนต้น
โรงเรียนบ้านโนนตะแบก,กระชอน,พิมาย,นครราชสีมา,อนุบาล–ประถมศึกษา
โรงเรียนบ้านโนนตาเถร,โนนตาเถร,โนนแดง,นครราชสีมา,อนุบาล–ประถมศึกษา
โรงเรียนบ้านโนนตาสุดวิทยาสรรค์,เมืองยาง,เมืองยาง,นครราชสีมา,อนุบาล–ประถมศึกษา
โรงเรียนบ้านโนนตำหนัก,เมืองยาง,เมืองยาง,นครราชสีมา,อนุบาล–ประถมศึกษา
โรงเรียนบ้านโนนปีบ,โนนอุดม,เมืองยาง,นครราชสีมา,อนุบาล–ประถมศึกษา
โรงเรียนบ้านโนนพุทรา,กระชอน,พิมาย,นครราชสีมา,อนุบาล–ประถมศึกษา
โรงเรียนบ้านโนนเพชรพิทยาคม,ละหานปลาค้าว,เมืองยาง,นครราชสีมา,อนุบาล–ประถมศึกษา
โรงเรียนบ้านโนนภิบาลโคกกลาง,วังไม้แดง,ประทาย,นครราชสีมา,อนุบาล–ประถมศึกษา
โรงเรียนบ้านโนนม่วง,ท่าหลวง,พิมาย,นครราชสีมา,อนุบาล–ประถมศึกษา
โรงเรียนบ้านโนนไม้งาม,เมืองยาง,เมืองยาง,นครราชสีมา,อนุบาล–ประถมศึกษา
โรงเรียนบ้านโนนยอ,โนนยอ,ชุมพวง,นครราชสีมา,อนุบาล–มัธยมศึกษา
โรงเรียนบ้านโนนรัง,โนนรัง,ชุมพวง,นครราชสีมา,อนุบาล–มัธยมศึกษาตอนต้น
โรงเรียนบ้านโนนสูง,นางรำ,ประทาย,นครราชสีมา,อนุบาล–มัธยมศึกษาตอนต้น
โรงเรียนบ้านโนนอุดมนภดลอุปถัมภ์,โนนอุดม,เมืองยาง,นครราชสีมา,อนุบาล–มัธยมศึกษาตอนต้น
โรงเรียนบ้านประทาย,ตลาดไทร,ประทาย,นครราชสีมา,อนุบาล–ประถมศึกษา
โรงเรียนบ้านประสุข,ประสุข,ชุมพวง,นครราชสีมา,อนุบาล–มัธยมศึกษา
โรงเรียนบ้านป่าตะแบง,ดอนยาวใหญ่,โนนแดง,นครราชสีมา,อนุบาล–มัธยมศึกษาตอนต้น
โรงเรียนบ้านฝาง,สำพะเนียง,โนนแดง,นครราชสีมา,อนุบาล–ประถมศึกษา
โรงเรียนบ้านฝาผนัง,ทุ่งสว่าง,ประทาย,นครราชสีมา,อนุบาล–ประถมศึกษา
โรงเรียนบ้านพะงาดวิทยา,ท่าลาด,ชุมพวง,นครราชสีมา,อนุบาล–มัธยมศึกษาตอนต้น
โรงเรียนบ้านพุทรา,รังกาใหญ่,พิมาย,นครราชสีมา,อนุบาล–ประถมศึกษา
โรงเรียนบ้านโพธิ์งามหนองหญ้าขาววิทยา,นิคมสร้างตนเอง,พิมาย,นครราชสีมา,อนุบาล–ประถมศึกษา
โรงเรียนบ้านไพล,ไพล,ลำทะเมนชัย,นครราชสีมา,อนุบาล–มัธยมศึกษาตอนต้น
โรงเรียนบ้านม่วงขามประชารักษ์,ในเมือง,พิมาย,นครราชสีมา,อนุบาล–ประถมศึกษา
โรงเรียนบ้านมะกอก,ดงใหญ่,พิมาย,นครราชสีมา,อนุบาล–มัธยมศึกษาตอนต้น
โรงเรียนบ้านมาบป่าแดง,ช่องแมว,ลำทะเมนชัย,นครราชสีมา,อนุบาล–ประถมศึกษา
โรงเรียนบ้านเมืองไผ่,หนองหลัก,ชุมพวง,นครราชสีมา,อนุบาล–ประถมศึกษา
โรงเรียนบ้านยางวิทยา,โนนยอ,ชุมพวง,นครราชสีมา,อนุบาล–มัธยมศึกษาตอนต้น
โรงเรียนบ้านละเลิงหิน,โคกกลาง,ประทาย,นครราชสีมา,อนุบาล–ประถมศึกษา
โรงเรียนบ้านละโว้,ประสุข,ชุมพวง,นครราชสีมา,อนุบาล–มัธยมศึกษาตอนต้น
โรงเรียนบ้านละหานสามัคคี,ละหานปลาค้าว,เมืองยาง,นครราชสีมา,อนุบาล–มัธยมศึกษาตอนต้น
โรงเรียนบ้านลำทะเมนชัย,ไพล,ลำทะเมนชัย,นครราชสีมา,อนุบาล–ประถมศึกษา
โรงเรียนบ้านลุงตามัน,โบสถ์,พิมาย,นครราชสีมา,อนุบาล–มัธยมศึกษาตอนต้น
โรงเรียนบ้านลุงประดู่,ท่าลาด,ชุมพวง,นครราชสีมา,อนุบาล–ประถมศึกษา
โรงเรียนบ้านวังม่วง,ทุ่งสว่าง,ประทาย,นครราชสีมา,อนุบาล–ประถมศึกษา
โรงเรียนบ้านศาลา,ดงใหญ่,พิมาย,นครราชสีมา,อนุบาล–ประถมศึกษา
โรงเรียนบ้านสว่างนาดี,โนนตูม,ชุมพวง,นครราชสีมา,อนุบาล–ประถมศึกษา
โรงเรียนบ้านสะแกงาม,นิคมสร้างตนเอง,พิมาย,นครราชสีมา,อนุบาล–ประถมศึกษา
โรงเรียนบ้านสัมฤทธิ์,สัมฤทธิ์,พิมาย,นครราชสีมา,อนุบาล–มัธยมศึกษาตอนต้น
โรงเรียนบ้านสาหร่ายวิทยา,โนนตูม,ชุมพวง,นครราชสีมา,อนุบาล–มัธยมศึกษาตอนต้น
โรงเรียนบ้านสำพะเนียง,สำพะเนียง,โนนแดง,นครราชสีมา,อนุบาล–มัธยมศึกษา
โรงเรียนบ้านสี่เหลี่ยม,ช่องแมว,ลำทะเมนชัย,นครราชสีมา,อนุบาล–ประถมศึกษา
โรงเรียนบ้านโสกดู่,บ้านยาง,ลำทะเมนชัย,นครราชสีมา,อนุบาล–ประถมศึกษา
โรงเรียนบ้านหญ้าคา,นางรำ,ประทาย,นครราชสีมา,อนุบาล–มัธยมศึกษาตอนต้น
โรงเรียนบ้านหนองขาม,โบสถ์,พิมาย,นครราชสีมา,อนุบาล–มัธยมศึกษาตอนต้น
โรงเรียนบ้านหนองข่าวิทยานุสรณ์,โนนรัง,ชุมพวง,นครราชสีมา,อนุบาล–ประถมศึกษา
โรงเรียนบ้านหนองจานกุดกี่สามัคคี,ช่องแมว,ลำทะเมนชัย,นครราชสีมา,อนุบาล–มัธยมศึกษาตอนต้น
โรงเรียนบ้านหนองจานใต้,ช่องแมว,ลำทะเมนชัย,นครราชสีมา,อนุบาล–ประถมศึกษา
โรงเรียนบ้านหนองดู่,บ้านยาง,ลำทะเมนชัย,นครราชสีมา,อนุบาล–ประถมศึกษา
โรงเรียนบ้านหนองโดนรกฟ้า,โนนตูม,ชุมพวง,นครราชสีมา,อนุบาล–ประถมศึกษา
โรงเรียนบ้านหนองตะคลอง,ท่าลาด,ชุมพวง,นครราชสีมา,อนุบาล–ประถมศึกษา
โรงเรียนบ้านหนองตาด,ตลาดไทร,ชุมพวง,นครราชสีมา,อนุบาล–ประถมศึกษา
โรงเรียนบ้านหนองทุ่มโนนหาดวิทยา,โนนรัง,ชุมพวง,นครราชสีมา,อนุบาล–ประถมศึกษา
โรงเรียนบ้านหนองนกคู่,ท่าลาด,ชุมพวง,นครราชสีมา,อนุบาล–มัธยมศึกษาตอนต้น
โรงเรียนบ้านหนองโน (คุรุราษฎร์พัฒนา),ประทาย,ประทาย,นครราชสีมา,อนุบาล–ประถมศึกษา
โรงเรียนบ้านหนองบง,โนนแดง,โนนแดง,นครราชสีมา,อนุบาล–ประถมศึกษา
โรงเรียนบ้านหนองบัว,ตลาดไทร,ชุมพวง,นครราชสีมา,อนุบาล–ประถมศึกษา
โรงเรียนบ้านหนองบัวคำ,หนองระเวียง,พิมาย,นครราชสีมา,อนุบาล–ประถมศึกษา
โรงเรียนบ้านหนองบัวนาค,โนนเพ็ด,ประทาย,นครราชสีมา,อนุบาล–มัธยมศึกษาตอนต้น
โรงเรียนบ้านหนองปรือ (รัฐราษฎร์พัฒนา),โบสถ์,พิมาย,นครราชสีมา,อนุบาล–มัธยมศึกษาตอนต้น
โรงเรียนบ้านหนองปรือแก้ว,ท่าลาด,ชุมพวง,นครราชสีมา,อนุบาล–ประถมศึกษา
