name,subDistrict,district,province,level
โรงเรียนด่านอุดมวิทยา,อุดมทรัพย์,วังน้ำเขียว,นครราชสีมา,อนุบาล–มัธยมศึกษาตอนต้น
โรงเรียนตะแบกวิทยา,บ้านราษฎร์,เสิงสาง,นครราชสีมา,อนุบาล–มัธยมศึกษาตอนต้น
โรงเรียนท้าวสุรนารี (2521),เสิงสาง,เสิงสาง,นครราชสีมา,อนุบาล–ประถมศึกษา
โรงเรียนธงชัยเหนือวิทยา (โคกศิลา),ธงชัยเหนือ,ปักธงชัย,นครราชสีมา,อนุบาล–มัธยมศึกษาตอนต้น
โรงเรียนบ้านกลาง,บ่อปลาทอง,ปักธงชัย,นครราชสีมา,อนุบาล–ประถมศึกษา
โรงเรียนบ้านกุดโบสถ์,กุดโบสถ์,เสิงสาง,นครราชสีมา,อนุบาล–มัธยมศึกษาตอนต้น
โรงเรียนบ้านโกรกสำโรง,ครบุรี,ครบุรี,นครราชสีมา,อนุบาล–ประถมศึกษา
โรงเรียนบ้านโกรกหว้า,ดอน,ปักธงชัย,นครราชสีมา,อนุบาล–ประถมศึกษา
โรงเรียนบ้านเก่าปอแดง,สะแกราช,ปักธงชัย,นครราชสีมา,อนุบาล–ประถมศึกษา
โรงเรียนบ้านขี้เหล็ก,สะแกราช,ปักธงชัย,นครราชสีมา,อนุบาล–ประถมศึกษา
โรงเรียนบ้านเขาพญาปราบ,ตะขบ,ปักธงชัย,นครราชสีมา,อนุบาล–ประถมศึกษา
โรงเรียนบ้านครบุรีนครธรรมโฆสิตวิทยาคาร,ครบุรีใต้,ครบุรี,นครราชสีมา,อนุบาล–มัธยมศึกษาตอนต้น
โรงเรียนบ้านคลองกุ่ม,ระเริง,วังน้ำเขียว,นครราชสีมา,อนุบาล–ประถมศึกษา
โรงเรียนบ้านคลองซับน้อยสามัคคี,ลำนางแก้ว,ปักธงชัย,นครราชสีมา,อนุบาล–ประถมศึกษา
โรงเรียนบ้านคลองเตย,สะแกราช,ปักธงชัย,นครราชสีมา,อนุบาล–ประถมศึกษา
โรงเรียนบ้านคลองทราย,วังน้ำเขียว,วังน้ำเขียว,นครราชสีมา,อนุบาล–ประถมศึกษา
โรงเรียนบ้านคลองทุเรียน,วังน้ำเขียว,วังน้ำเขียว,นครราชสีมา,อนุบาล–ประถมศึกษา
โรงเรียนบ้านคลองบง,วังน้ำเขียว,วังน้ำเขียว,นครราชสีมา,อนุบาล–ประถมศึกษา
โรงเรียนบ้านคลองใบพัด,วังหมี,วังน้ำเขียว,นครราชสีมา,อนุบาล–ประถมศึกษา
โรงเรียนบ้านคลองยาง (มูลบนอุปถัมภ์),จระเข้หิน,ครบุรี,นครราชสีมา,อนุบาล–มัธยมศึกษาตอนต้น
โรงเรียนบ้านคลองสะท้อน,วังหมี,วังน้ำเขียว,นครราชสีมา,อนุบาล–ประถมศึกษา
โรงเรียนบ้านคลองสาริกา,ตะขบ,ปักธงชัย,นครราชสีมา,อนุบาล–ประถมศึกษา
โรงเรียนบ้านคลองหินร่อง,ระเริง,วังน้ำเขียว,นครราชสีมา,อนุบาล–ประถมศึกษา
โรงเรียนบ้านโคกเกษม (สหรัฐ-ราษฎร์สามัคคี),โคกไทย,ปักธงชัย,นครราชสีมา,อนุบาล–มัธยมศึกษาตอนต้น
โรงเรียนบ้านโคกกระชายโนนกุ่ม,โคกกระชาย,ครบุรี,นครราชสีมา,อนุบาล–มัธยมศึกษาตอนต้น
โรงเรียนบ้านโคกโจด,กุดโบสถ์,เสิงสาง,นครราชสีมา,อนุบาล–ประถมศึกษา
โรงเรียนบ้านโคกใบบัว,โคกกระชาย,ครบุรี,นครราชสีมา,อนุบาล–ประถมศึกษา
โรงเรียนบ้านโคกไม้งาม,สระตะเคียน,เสิงสาง,นครราชสีมา,อนุบาล–ประถมศึกษา
โรงเรียนบ้านโคกสะอาด,อรพิมพ์,ครบุรี,นครราชสีมา,อนุบาล–ประถมศึกษา
โรงเรียนบ้านโคกสันติสุข,วังหมี,วังน้ำเขียว,นครราชสีมา,อนุบาล–ประถมศึกษา
โรงเรียนบ้านโคกสำราญ,ตะขบ,ปักธงชัย,นครราชสีมา,อนุบาล–มัธยมศึกษาตอนต้น
โรงเรียนบ้านเฉลียง (คุรุราษฎร์บำรุง),เฉลียง,ครบุรี,นครราชสีมา,อนุบาล–ประถมศึกษา
โรงเรียนบ้านแชะ,แชะ,ครบุรี,นครราชสีมา,อนุบาล–มัธยมศึกษาตอนต้น
โรงเรียนบ้านไชยวาล,ครบุรี,ครบุรี,นครราชสีมา,อนุบาล–ประถมศึกษา
โรงเรียนบ้านซับก้านเหลือง,ครบุรีใต้,ครบุรี,นครราชสีมา,อนุบาล–มัธยมศึกษาตอนต้น
โรงเรียนบ้านซับเต่า,อุดมทรัพย์,วังน้ำเขียว,นครราชสีมา,อนุบาล–ประถมศึกษา
โรงเรียนบ้านซับไทรทอง,วังน้ำเขียว,วังน้ำเขียว,นครราชสีมา,อนุบาล–ประถมศึกษา
โรงเรียนบ้านซับสะเดา,บ้านใหม่,ครบุรี,นครราชสีมา,อนุบาล–ประถมศึกษา
โรงเรียนบ้านดอน (สหรัฐ-ราษฎร์อุทิศ),ดอน,ปักธงชัย,นครราชสีมา,อนุบาล–ประถมศึกษา
โรงเรียนบ้านดอนกรูด,แชะ,ครบุรี,นครราชสีมา,อนุบาล–ประถมศึกษา
โรงเรียนบ้านดอนแขวนประชานุกูล,สุขไพบูลย์,เสิงสาง,นครราชสีมา,อนุบาล–ประถมศึกษา
โรงเรียนบ้านดอนแสนสุข,ครบุรี,ครบุรี,นครราชสีมา,อนุบาล–ประถมศึกษา
โรงเรียนบ้านดู่ (สหราษฎร์วิทยา),เมืองปัก,ปักธงชัย,นครราชสีมา,อนุบาล–มัธยมศึกษาตอนต้น
โรงเรียนบ้านตะกุดโนนระเวียง,โคกกระชาย,ครบุรี,นครราชสีมา,อนุบาล–ประถมศึกษา
โรงเรียนบ้านเตาเหล็ก-ลุมปุ๊ก,กุดโบสถ์,เสิงสาง,นครราชสีมา,อนุบาล–ประถมศึกษา
โรงเรียนบ้านไผ่,จระเข้หิน,ครบุรี,นครราชสีมา,อนุบาล–ประถมศึกษา
โรงเรียนบ้านทรัพย์เจริญ,ลำเพียก,ครบุรี,นครราชสีมา,อนุบาล–มัธยมศึกษาตอนต้น
โรงเรียนบ้านท่าเยี่ยม,กุดโบสถ์,เสิงสาง,นครราชสีมา,อนุบาล–ประถมศึกษา
โรงเรียนบ้านท่าวังไทรสามัคคี,วังหมี,วังน้ำเขียว,นครราชสีมา,อนุบาล–ประถมศึกษา
โรงเรียนบ้านทุ่งแขวน,เฉลียง,ครบุรี,นครราชสีมา,อนุบาล–ประถมศึกษา
โรงเรียนบ้านเทพนิมิต,ตะแบกบาน,ครบุรี,นครราชสีมา,อนุบาล–ประถมศึกษา
โรงเรียนบ้านไทยสามัคคี,ไทยสามัคคี,วังน้ำเขียว,นครราชสีมา,อนุบาล–มัธยมศึกษา
โรงเรียนบ้านไทรงาม,ระเริง,วังน้ำเขียว,นครราชสีมา,อนุบาล–มัธยมศึกษาตอนต้น
โรงเรียนบ้านน้อย,ตะขบ,ปักธงชัย,นครราชสีมา,อนุบาล–ประถมศึกษา
โรงเรียนบ้านนางเหริญ,เกษมทรัพย์,ปักธงชัย,นครราชสีมา,อนุบาล–ประถมศึกษา
โรงเรียนบ้านน้ำซับ,วังน้ำเขียว,วังน้ำเขียว,นครราชสีมา,อนุบาล–ประถมศึกษา
โรงเรียนบ้านโนนแดง,ภูหลวง,ปักธงชัย,นครราชสีมา,อนุบาล–ประถมศึกษา
โรงเรียนบ้านโนนสมบูรณ์,โนนสมบูรณ์,เสิงสาง,นครราชสีมา,อนุบาล–ประถมศึกษา
โรงเรียนบ้านโนนสาวเอ้,วังหมี,ปักธงชัย,นครราชสีมา,อนุบาล–ประถมศึกษา
โรงเรียนบ้านโนนเหลื่อม,อุดมทรัพย์,วังน้ำเขียว,นครราชสีมา,อนุบาล–มัธยมศึกษาตอนต้น
โรงเรียนบ้านบ่อปลา,บ่อปลาทอง,ปักธงชัย,นครราชสีมา,อนุบาล–ประถมศึกษา
โรงเรียนบ้านบ่อลิงประชาสรรค์,โนนสมบูรณ์,เสิงสาง,นครราชสีมา,อนุบาล–ประถมศึกษา
โรงเรียนบ้านบะใหญ่,อุดมทรัพย์,วังน้ำเขียว,นครราชสีมา,อนุบาล–มัธยมศึกษาตอนต้น
โรงเรียนบ้านบุเจ้าคุณ (หลวงพ่อกัณหา สุขกาโม อุปถัมภ์),วังหมี,วังน้ำเขียว,นครราชสีมา,อนุบาล–มัธยมศึกษาตอนต้น
โรงเรียนบ้านบุตะโก,วังน้ำเขียว,วังน้ำเขียว,นครราชสีมา,อนุบาล–มัธยมศึกษาตอนต้น
โรงเรียนบ้านบุตาโฮ-โนนกลาง,บ้านใหม่,ครบุรี,นครราชสีมา,อนุบาล–ประถมศึกษา
โรงเรียนบ้านบุไผ่,ไทยสามัคคี,วังน้ำเขียว,นครราชสีมา,อนุบาล–มัธยมศึกษาตอนต้น
โรงเรียนบ้านบุมะค่า (ชาวไร่สามัคคี),มาบตะโกเอน,ครบุรี,นครราชสีมา,อนุบาล–ประถมศึกษา
โรงเรียนบ้านบุยายแลบ,มาบตะโกเอน,ครบุรี,นครราชสีมา,อนุบาล–ประถมศึกษา
โรงเรียนบ้านบุหว้าสามัคคี,สระว่านพระยา,ครบุรี,นครราชสีมา,อนุบาล–มัธยมศึกษาตอนต้น
โรงเรียนบ้านบุหัวช้าง,ตะขบ,ปักธงชัย,นครราชสีมา,อนุบาล–ประถมศึกษา
โรงเรียนบ้านประชาสันต์,เสิงสาง,เสิงสาง,นครราชสีมา,อนุบาล–ประถมศึกษา
โรงเรียนบ้านปลายดาบ,สุขเกษม,ปักธงชัย,นครราชสีมา,อนุบาล–มัธยมศึกษาตอนต้น
โรงเรียนบ้านปางไม้,บ้านราษฎร์,เสิงสาง,นครราชสีมา,อนุบาล–มัธยมศึกษาตอนต้น
โรงเรียนบ้านโป่งสามัคคี,สะแกราช,ปักธงชัย,นครราชสีมา,อนุบาล–ประถมศึกษา
โรงเรียนบ้านโปร่งสนวน,ลำเพียก,ครบุรี,นครราชสีมา,อนุบาล–ประถมศึกษา
โรงเรียนบ้านพนาหนองหิน,แชะ,ครบุรี,นครราชสีมา,อนุบาล–มัธยมศึกษาตอนต้น
โรงเรียนบ้านพัดทะเล,ลำนางแก้ว,ปักธงชัย,นครราชสีมา,อนุบาล–ประถมศึกษา
โรงเรียนบ้านพันธ์สงวน,ธงชัยเหนือ,ปักธงชัย,นครราชสีมา,อนุบาล–ประถมศึกษา
โรงเรียนบ้านพุปลาไหล,สุขเกษม,ปักธงชัย,นครราชสีมา,อนุบาล–ประถมศึกษา
โรงเรียนบ้านมาบกราด,โคกกระชาย,ครบุรี,นครราชสีมา,อนุบาล–มัธยมศึกษาตอนต้น
โรงเรียนบ้านมาบตะโกเอน,มาบตะโกเอน,ครบุรี,นครราชสีมา,อนุบาล–ประถมศึกษา
โรงเรียนบ้านเมืองปักสามัคคี,เมืองปัก,ปักธงชัย,นครราชสีมา,อนุบาล–มัธยมศึกษาตอนต้น
โรงเรียนบ้านยางกระทุง,ตะขบ,ปักธงชัย,นครราชสีมา,อนุบาล–ประถมศึกษา
โรงเรียนบ้านระเริง,ระเริง,วังน้ำเขียว,นครราชสีมา,อนุบาล–มัธยมศึกษา
โรงเรียนบ้านราษฎร์พัฒนา,บ้านราษฎร์,เสิงสาง,นครราชสีมา,อนุบาล–มัธยมศึกษาตอนต้น
โรงเรียนบ้านราษฎร์สามัคคี,โนนสมบูรณ์,เสิงสาง,นครราชสีมา,อนุบาล–ประถมศึกษา
โรงเรียนบ้านไร่แหลมทอง,ลำเพียก,ครบุรี,นครราชสีมา,อนุบาล–ประถมศึกษา
โรงเรียนบ้านลำไซกง,บ้านราษฎร์,เสิงสาง,นครราชสีมา,อนุบาล–ประถมศึกษา
โรงเรียนบ้านลำนางแก้ว,ลำนางแก้ว,ปักธงชัย,นครราชสีมา,อนุบาล–มัธยมศึกษาตอนต้น
โรงเรียนบ้านลำเพียก,ลำเพียก,ครบุรี,นครราชสีมา,อนุบาล–มัธยมศึกษาตอนต้น
โรงเรียนบ้านวังตะเคียน,ลำนางแก้ว,ปักธงชัย,นครราชสีมา,อนุบาล–ประถมศึกษา
โรงเรียนบ้านวังน้ำเขียว,อุดมทรัพย์,วังน้ำเขียว,นครราชสีมา,อนุบาล–ประถมศึกษา
โรงเรียนบ้านวังหมี,วังหมี,วังน้ำเขียว,นครราชสีมา,อนุบาล–มัธยมศึกษาตอนต้น
โรงเรียนบ้านวังหิน,ตะคุ,ปักธงชัย,นครราชสีมา,อนุบาล–ประถมศึกษา
โรงเรียนบ้านศาลเจ้าพ่อ,วังน้ำเขียว,วังน้ำเขียว,นครราชสีมา,อนุบาล–มัธยมศึกษาตอนต้น
โรงเรียนบ้านสมบัติเจริญ,กุดโบสถ์,เสิงสาง,นครราชสีมา,อนุบาล–มัธยมศึกษาตอนต้น
โรงเรียนบ้านสระตะเคียน,สระตะเคียน,เสิงสาง,นครราชสีมา,อนุบาล–มัธยมศึกษาตอนต้น
โรงเรียนบ้านสระประทีป,เสิงสาง,เสิงสาง,นครราชสีมา,อนุบาล–มัธยมศึกษาตอนต้น
โรงเรียนบ้านสระผักโพด,ครบุรีใต้,ครบุรี,นครราชสีมา,อนุบาล–ประถมศึกษา
โรงเรียนบ้านสระว่านพระยา,สระว่านพระยา,ครบุรี,นครราชสีมา,อนุบาล–ประถมศึกษา
โรงเรียนบ้านสันติสุข,สระตะเคียน,เสิงสาง,นครราชสีมา,อนุบาล–มัธยมศึกษาตอนต้น
โรงเรียนบ้านสุขไพบูลย์,สุขไพบูลย์,เสิงสาง,นครราชสีมา,อนุบาล–มัธยมศึกษาตอนต้น
โรงเรียนบ้านสุขัง (ราษฎร์สามัคคี),ตะคุ,ปักธงชัย,นครราชสีมา,อนุบาล–มัธยมศึกษาตอนต้น
โรงเรียนบ้านหนองกก,ภูหลวง,ปักธงชัย,นครราชสีมา,อนุบาล–ประถมศึกษา
โรงเรียนบ้านหนองกระทุ่ม,ภูหลวง,ปักธงชัย,นครราชสีมา,อนุบาล–ประถมศึกษา
โรงเรียนบ้านหนองขนาก,สุขไพบูลย์,เสิงสาง,นครราชสีมา,อนุบาล–ประถมศึกษา
โรงเรียนบ้านหนองแคทราย,ลำเพียก,ครบุรี,นครราชสีมา,อนุบาล–มัธยมศึกษาตอนต้น
โรงเรียนบ้านหนองแดง,กุดโบสถ์,เสิงสาง,นครราชสีมา,อนุบาล–มัธยมศึกษาตอนต้น
โรงเรียนบ้านหนองโดน,สุขเกษม,ปักธงชัย,นครราชสีมา,อนุบาล–ประถมศึกษา
โรงเรียนบ้านหนองต้อ,ครบุรี,ครบุรี,นครราชสีมา,อนุบาล–ประถมศึกษา
โรงเรียนบ้านหนองตะเข้-หนองตูม,สุขไพบูลย์,เสิงสาง,นครราชสีมา,อนุบาล–มัธยมศึกษาตอนต้น
โรงเรียนบ้านหนองตะแบก,ตะแบกบาน,ครบุรี,นครราชสีมา,อนุบาล–มัธยมศึกษาตอนต้น
โรงเรียนบ้านหนองตาด,ตะคุ,ปักธงชัย,นครราชสีมา,อนุบาล–ประถมศึกษา
โรงเรียนบ้านหนองไทร,ลำเพียก,ครบุรี,นครราชสีมา,อนุบาล–ประถมศึกษา
โรงเรียนบ้านหนองนมนาง,ตะคุ,ปักธงชัย,นครราชสีมา,อนุบาล–ประถมศึกษา
โรงเรียนบ้านหนองโบสถ์,โคกกระชาย,ครบุรี,นครราชสีมา,อนุบาล–มัธยมศึกษาตอนต้น
โรงเรียนบ้านหนองผักไร,ดอน,ปักธงชัย,นครราชสีมา,อนุบาล–ประถมศึกษา
โรงเรียนบ้านหนองไผ่ใหญ่,เสิงสาง,เสิงสาง,นครราชสีมา,อนุบาล–ประถมศึกษา
โรงเรียนบ้านหนองแฟบ (วุฒิรัฐประชาสรรค์),สะแกราช,ปักธงชัย,นครราชสีมา,อนุบาล–ประถมศึกษา
โรงเรียนบ้านหนองเมา,สระว่านพระยา,ครบุรี,นครราชสีมา,อนุบาล–ประถมศึกษา
โรงเรียนบ้านหนองไม้สัก,ระเริง,วังน้ำเขียว,นครราชสีมา,อนุบาล–มัธยมศึกษาตอนต้น
โรงเรียนบ้านหนองรัง,แชะ,ครบุรี,นครราชสีมา,อนุบาล–ประถมศึกษา
โรงเรียนบ้านหนองล้างช้าง,โคกไทย,ปักธงชัย,นครราชสีมา,อนุบาล–ประถมศึกษา
โรงเรียนบ้านหนองแวง,อุดมทรัพย์,วังน้ำเขียว,นครราชสีมา,อนุบาล–ประถมศึกษา
โรงเรียนบ้านหนองสนวน,กุดโบสถ์,เสิงสาง,นครราชสีมา,อนุบาล–มัธยมศึกษาตอนต้น
