name,subDistrict,district,province,level
โรงเรียนกระเบื้องนอกพิทยาคม,กระเบื้องนอก,เมืองยาง,นครราชสีมา,มัธยมศึกษา
โรงเรียนเกล็ดลิ้นวิทยา,ขุนทอง,บัวใหญ่,นครราชสีมา,มัธยมศึกษา
โรงเรียนแก้งสนามนางพิทยาคม,แก้งสนามนาง,แก้งสนามนาง,นครราชสีมา,มัธยมศึกษา
โรงเรียนขามทะเลสอวิทยา,ขามทะเลสอ,ขามทะเลสอ,นครราชสีมา,มัธยมศึกษา
โรงเรียนขามสะแกแสง,ขามสะแกแสง,ขามสะแกแสง,นครราชสีมา,มัธยมศึกษา
โรงเรียนโคราชพิทยาคม,ในเมือง,เมืองนครราชสีมา,นครราชสีมา,มัธยมศึกษา
โรงเรียนจระเข้หินสังฆกิจวิทยา,จระเข้หิน,ครบุรี,นครราชสีมา,มัธยมศึกษา
โรงเรียนจักราชวิทยา,จักราช,จักราช,นครราชสีมา,มัธยมศึกษา
โรงเรียนชุมพวงศึกษา,ชุมพวง,ชุมพวง,นครราชสีมา,มัธยมศึกษา
โรงเรียนโชคชัยสามัคคี,โชคชัย,โชคชัย,นครราชสีมา,มัธยมศึกษา
โรงเรียนท่าช้างราษฎร์บำรุง,ช้างทอง,เฉลิมพระเกียรติ,นครราชสีมา,มัธยมศึกษา
โรงเรียนเทพาลัย,เทพาลัย,คง,นครราชสีมา,มัธยมศึกษา
โรงเรียนธารปราสาทเพชรวิทยา,ธารปราสาท,โนนสูง,นครราชสีมา,มัธยมศึกษา
โรงเรียนโนนสมบูรณ์วิทยา,โนนสมบูรณ์,เสิงสาง,นครราชสีมา,มัธยมศึกษา
โรงเรียนโนนสูงศรีธานี,โนนสูง,โนนสูง,นครราชสีมา,มัธยมศึกษา
โรงเรียนนิคมพิมายศึกษา,นิคมสร้างตนเอง,พิมาย,นครราชสีมา,มัธยมศึกษา
โรงเรียนบ้านเหลื่อมพิทยาสรรพ์,บ้านเหลื่อม,บ้านเหลื่อม,นครราชสีมา,มัธยมศึกษา
โรงเรียนบึงพะไล,บึงพะไล,แก้งสนามนาง,นครราชสีมา,มัธยมศึกษา
โรงเรียนบุญวัฒนา,หัวทะเล,เมืองนครราชสีมา,นครราชสีมา,มัธยมศึกษา
โรงเรียนบุญวัฒนา 2,หัวทะเล,เมืองนครราชสีมา,นครราชสีมา,มัธยมศึกษา
โรงเรียนบุญเหลือวิทยานุสรณ์,โคกสูง,เมืองนครราชสีมา,นครราชสีมา,มัธยมศึกษา
โรงเรียนบุญเหลือวิทยานุสรณ์ 2,หนองหอย,พระทองคำ,นครราชสีมา,มัธยมศึกษา
โรงเรียนปักธงชัยประชานิรมิต,เมืองปัก,ปักธงชัย,นครราชสีมา,มัธยมศึกษา
โรงเรียนปากช่อง,หนองสาหร่าย,ปากช่อง,นครราชสีมา,มัธยมศึกษา
โรงเรียนพิมายดำรงวิทยาคม,รังกาใหญ่,พิมาย,นครราชสีมา,มัธยมศึกษา
โรงเรียนพิมายวิทยา,ในเมือง,พิมาย,นครราชสีมา,มัธยมศึกษา
โรงเรียนพุดซาพิทยาคม,พุดซา,เมืองนครราชสีมา,นครราชสีมา,มัธยมศึกษา
โรงเรียนภู่วิทยา,โนนแดง,โนนแดง,นครราชสีมา,มัธยมศึกษา
โรงเรียนมหิศราธิบดี,บ้านโพธิ์,เมืองนครราชสีมา,นครราชสีมา,มัธยมศึกษา
โรงเรียนมัธยมด่านขุนทด,ด่านขุนทด,ด่านขุนทด,นครราชสีมา,มัธยมศึกษา
โรงเรียนมัธยมวชิราลงกรณวราราม,หนองน้ำแดง,ปากช่อง,นครราชสีมา,มัธยมศึกษา
โรงเรียนมิตรภาพวิทยา,ดอนยาวใหญ่,โนนแดง,นครราชสีมา,มัธยมศึกษา
โรงเรียนเมืองคง,เมืองคง,คง,นครราชสีมา,มัธยมศึกษา
โรงเรียนเมืองพลับพลาพิทยาคม,เมืองพลับพลา,ห้วยแถลง,นครราชสีมา,มัธยมศึกษา
โรงเรียนราชสีมาวิทยาลัย,ในเมือง,เมืองนครราชสีมา,นครราชสีมา,มัธยมศึกษา
โรงเรียนลำทะเมนไชยพิทยาคม,ขุย,ลำทะเมนชัย,นครราชสีมา,มัธยมศึกษา
โรงเรียนศรีสุขวิทยา,ดอนชมพู,โนนสูง,นครราชสีมา,มัธยมศึกษา
โรงเรียนสมเด็จพระธีรญาณมุนี,ตะคุ,ปักธงชัย,นครราชสีมา,มัธยมศึกษา
โรงเรียนสีดาวิทยา,โพนทอง,สีดา,นครราชสีมา,มัธยมศึกษา
โรงเรียนสุรธรรมพิทักษ์,โพธิ์กลาง,เมืองนครราชสีมา,นครราชสีมา,มัธยมศึกษา
โรงเรียนสุรนารีวิทยา,ในเมือง,เมืองนครราชสีมา,นครราชสีมา,มัธยมศึกษา
โรงเรียนสุรนารีวิทยา 2,หนองกระทุ่ม,เมืองนครราชสีมา,นครราชสีมา,มัธยมศึกษา
โรงเรียนเสิงสาง,เสิงสาง,เสิงสาง,นครราชสีมา,มัธยมศึกษา
โรงเรียนหนองกราดวัฒนา,หนองกราด,ด่านขุนทด,นครราชสีมา,มัธยมศึกษา
โรงเรียนหนองน้ำใสพิทยาคม,หนองน้ำใส,สีคิ้ว,นครราชสีมา,มัธยมศึกษา
โรงเรียนหนองบัวละครวิทยา,หนองบัวละคร,ด่านขุนทด,นครราชสีมา,มัธยมศึกษา
โรงเรียนหนองบุญมากประสงค์วิทยา,หนองหัวแรต,หนองบุญมาก,นครราชสีมา,มัธยมศึกษา
โรงเรียนห้วยแถลงพิทยาคม,ห้วยแถลง,ห้วยแถลง,นครราชสีมา,มัธยมศึกษา
โรงเรียนหันห้วยทรายพิทยาคม,หันห้วยทราย,ประทาย,นครราชสีมา,มัธยมศึกษา
โรงเรียนอุบลรัตนราชกัญญาราชวิทยาลัย นครราชสีมา,บ้านใหม่,เมืองนครราชสีมา,นครราชสีมา,มัธยมศึกษา
โรงเรียนกันเกราพิทยาคม,ใหม่,โนนสูง,นครราชสีมา,อนุบาล–มัธยมศึกษาตอนต้น
โรงเรียนการไฟฟ้าส่วนภูมิภาคสงเคราะห์ 3 (บ้านใหม่เกษม),ธารปราสาท,โนนสูง,นครราชสีมา,อนุบาล–ประถมศึกษา
โรงเรียนเคหะประชาสามัคคี,ในเมือง,เมืองนครราชสีมา,นครราชสีมา,อนุบาล–ประถมศึกษา
โรงเรียนโคกเพชรสระมโนรา,โคกกรวด,เมืองนครราชสีมา,นครราชสีมา,อนุบาล–ประถมศึกษา
โรงเรียนชลประทานสงเคราะห์,ในเมือง,เมืองนครราชสีมา,นครราชสีมา,อนุบาล–ประถมศึกษา
โรงเรียนชุมชนบ้านเพชร,บิง,โนนสูง,นครราชสีมา,อนุบาล–ประถมศึกษา
โรงเรียนชุมชนบ้านประโดก-โคกไผ่,หมื่นไวย,เมืองนครราชสีมา,นครราชสีมา,อนุบาล–ประถมศึกษา
โรงเรียนชุมชนบ้านศีรษะละเลิง,บ้านใหม่,เมืองนครราชสีมา,นครราชสีมา,อนุบาล–ประถมศึกษา
โรงเรียนดอนท้าววิทยา,เมืองปราสาท,โนนสูง,นครราชสีมา,อนุบาล–มัธยมศึกษาตอนต้น
โรงเรียนตำบลโคกกรวด (ผดุงรัฐประชานุกูล),โคกกรวด,เมืองนครราชสีมา,นครราชสีมา,อนุบาล–มัธยมศึกษาตอนต้น
โรงเรียนตำบลบ้านโพธิ์,บ้านโพธิ์,เมืองนครราชสีมา,นครราชสีมา,อนุบาล–มัธยมศึกษาตอนต้น
โรงเรียนไตรคามสามัคคี,ขามเฒ่า,โนนสูง,นครราชสีมา,อนุบาล–ประถมศึกษา
โรงเรียนไตรมิตรวิทยา,ลำมูล,โนนสูง,นครราชสีมา,อนุบาล–มัธยมศึกษาตอนต้น
โรงเรียนทหารอากาศบำรุง,หนองไผ่ล้อม,เมืองนครราชสีมา,นครราชสีมา,อนุบาล–ประถมศึกษา
โรงเรียนบ้านกระเพรา,เมืองปราสาท,โนนสูง,นครราชสีมา,อนุบาล–ประถมศึกษา
โรงเรียนบ้านกระโดน,หนองไข่น้ำ,เมืองนครราชสีมา,นครราชสีมา,อนุบาล–ประถมศึกษา
โรงเรียนบ้านกระถินหนองเครือชุด,ลำคอหงษ์,โนนสูง,นครราชสีมา,อนุบาล–มัธยมศึกษาตอนต้น
โรงเรียนบ้านกรูดหนองออก,จอหอ,เมืองนครราชสีมา,นครราชสีมา,อนุบาล–ประถมศึกษา
โรงเรียนบ้านกล้วยจอหอ,จอหอ,เมืองนครราชสีมา,นครราชสีมา,อนุบาล–ประถมศึกษา
โรงเรียนบ้านเกรียมโนนสำโรง,ขามเฒ่า,โนนสูง,นครราชสีมา,อนุบาล–ประถมศึกษา
โรงเรียนบ้านโกรกเดือนห้า,สุรนารี,เมืองนครราชสีมา,นครราชสีมา,อนุบาล–ประถมศึกษา
โรงเรียนบ้านขนายดี (ประชารัฐบำรุง),บิง,โนนสูง,นครราชสีมา,อนุบาล–ประถมศึกษา
โรงเรียนบ้านขามเฒ่า,ขามเฒ่า,โนนสูง,นครราชสีมา,อนุบาล–ประถมศึกษา
โรงเรียนบ้านขามชั่งโค,บิง,โนนสูง,นครราชสีมา,อนุบาล–ประถมศึกษา
โรงเรียนบ้านคนชุม,ปรุใหญ่,เมืองนครราชสีมา,นครราชสีมา,อนุบาล–ประถมศึกษา
โรงเรียนบ้านคล้าโนนคราม,เมืองปราสาท,โนนสูง,นครราชสีมา,อนุบาล–ประถมศึกษา
โรงเรียนบ้านคอนน้อย,ด่านคล้า,โนนสูง,นครราชสีมา,อนุบาล–ประถมศึกษา
โรงเรียนบ้านคอหงษ์,ลำคอหงษ์,โนนสูง,นครราชสีมา,อนุบาล–ประถมศึกษา
โรงเรียนบ้านโคกไผ่-ขนาย,บ้านเกาะ,เมืองนครราชสีมา,นครราชสีมา,อนุบาล–ประถมศึกษา
โรงเรียนบ้านโคกสูง,โคกสูง,เมืองนครราชสีมา,นครราชสีมา,อนุบาล–ประถมศึกษา
โรงเรียนบ้านจอหอ,จอหอ,เมืองนครราชสีมา,นครราชสีมา,อนุบาล–มัธยมศึกษาตอนต้น
โรงเรียนบ้านจันอัด,จันอัด,โนนสูง,นครราชสีมา,อนุบาล–ประถมศึกษา
โรงเรียนบ้านไชยมงคล (สืบสินวิทยา),ไชยมงคล,เมืองนครราชสีมา,นครราชสีมา,อนุบาล–มัธยมศึกษาตอนต้น
โรงเรียนบ้านซาด,หลุมข้าว,โนนสูง,นครราชสีมา,อนุบาล–ประถมศึกษา
โรงเรียนบ้านดงพลอง (สำนักงานสลากกินแบ่งสงเคราะห์ 539),หลุมข้าว,โนนสูง,นครราชสีมา,อนุบาล–มัธยมศึกษาตอนต้น
โรงเรียนบ้านดอนกระทิง-ศีรษะช้าง,พุดซา,เมืองนครราชสีมา,นครราชสีมา,อนุบาล–ประถมศึกษา
โรงเรียนบ้านดอนขวาง,หัวทะเล,เมืองนครราชสีมา,นครราชสีมา,อนุบาล–ประถมศึกษา
โรงเรียนบ้านดอนชมพู (สังฆประชานุเคราะห์),ดอนชมพู,โนนสูง,นครราชสีมา,อนุบาล–มัธยมศึกษาตอนต้น
โรงเรียนบ้านดอนผวา,ลำคอหงษ์,โนนสูง,นครราชสีมา,อนุบาล–ประถมศึกษา
โรงเรียนบ้านดอนม่วง,ใหม่,โนนสูง,นครราชสีมา,อนุบาล–ประถมศึกษา
โรงเรียนบ้านดอนหวาย (สิงห์คุรุประชาสรรค์),ดอนหวาย,โนนสูง,นครราชสีมา,อนุบาล–มัธยมศึกษาตอนต้น
โรงเรียนบ้านด่านเกวียน,โตนด,โนนสูง,นครราชสีมา,อนุบาล–ประถมศึกษา
โรงเรียนบ้านด่านติง,จันอัด,โนนสูง,นครราชสีมา,อนุบาล–ประถมศึกษา
โรงเรียนบ้านด่านทองหลาง,โตนด,โนนสูง,นครราชสีมา,อนุบาล–มัธยมศึกษาตอนต้น
โรงเรียนบ้านเดิ่นหัวบึงวิทยา,มะค่า,โนนสูง,นครราชสีมา,อนุบาล–ประถมศึกษา
โรงเรียนบ้านต่างตา,หนองจะบก,เมืองนครราชสีมา,นครราชสีมา,อนุบาล–ประถมศึกษา
โรงเรียนบ้านโตนด,โตนด,โนนสูง,นครราชสีมา,อนุบาล–ประถมศึกษา
โรงเรียนบ้านถนนถั่ว (กองทัพบกประชาสามัคคี),ใหม่,โนนสูง,นครราชสีมา,อนุบาล–ประถมศึกษา
โรงเรียนบ้านทับช้าง,หนองระเวียง,เมืองนครราชสีมา,นครราชสีมา,อนุบาล–มัธยมศึกษาตอนต้น
โรงเรียนบ้านทุ่งกระโดน,สีมุม,เมืองนครราชสีมา,นครราชสีมา,ประถมศึกษา
โรงเรียนบ้านธารปราสาท,ธารปราสาท,โนนสูง,นครราชสีมา,อนุบาล–ประถมศึกษา
โรงเรียนบ้านโนนมะกอก,ดอนหวาย,โนนสูง,นครราชสีมา,อนุบาล–ประถมศึกษา
โรงเรียนบ้านโนนมันเทศ,ลำมูล,โนนสูง,นครราชสีมา,อนุบาล–ประถมศึกษา
โรงเรียนบ้านบิง (สุประชาจูงกลางนุสสรณ์),บิง,โนนสูง,นครราชสีมา,อนุบาล–มัธยมศึกษาตอนต้น
โรงเรียนบ้านบึงตะโก,พลกรัง,เมืองนครราชสีมา,นครราชสีมา,อนุบาล–ประถมศึกษา
โรงเรียนบ้านบึงทับช้าง,จอหอ,เมืองนครราชสีมา,นครราชสีมา,อนุบาล–ประถมศึกษา
โรงเรียนบ้านบึงสาร,มะเริง,เมืองนครราชสีมา,นครราชสีมา,อนุบาล–มัธยมศึกษาตอนต้น
โรงเรียนบ้านบุ (ประชารัฐพัฒนา),ตลาด,เมืองนครราชสีมา,นครราชสีมา,อนุบาล–มัธยมศึกษาตอนต้น
โรงเรียนบ้านปราสาท (สุวรรณราษฎร์ประสิทธิ์),เมืองปราสาท,โนนสูง,นครราชสีมา,อนุบาล–ประถมศึกษา
โรงเรียนบ้านเปราะหอมพัฒนา,พลสงคราม,โนนสูง,นครราชสีมา,อนุบาล–ประถมศึกษา
โรงเรียนบ้านเปลาะปลอเมืองที (ประชารัฐสามัคคี),ดอนชมพู,โนนสูง,นครราชสีมา,อนุบาล–ประถมศึกษา
โรงเรียนบ้านโป่งแมลงวัน,โคกกรวด,เมืองนครราชสีมา,นครราชสีมา,อนุบาล–มัธยมศึกษาตอนต้น
โรงเรียนบ้านฝ้ายนาตมส้มป่อย,หนองกระทุ่ม,เมืองนครราชสีมา,นครราชสีมา,อนุบาล–ประถมศึกษา
โรงเรียนบ้านพลกรัง (เดชาติวงค์คงฤทธิ์อนุสรณ์),พลกรัง,เมืองนครราชสีมา,นครราชสีมา,อนุบาล–มัธยมศึกษาตอนต้น
โรงเรียนบ้านพลจลก,มะค่า,โนนสูง,นครราชสีมา,อนุบาล–มัธยมศึกษาตอนต้น
โรงเรียนบ้านพลสงคราม (แพงรัฐราษฎร์วิทยา),พลสงคราม,โนนสูง,นครราชสีมา,อนุบาล–ประถมศึกษา
โรงเรียนบ้านพะเนา,พะเนา,เมืองนครราชสีมา,นครราชสีมา,อนุบาล–ประถมศึกษา
โรงเรียนบ้านพะไล,หัวทะเล,เมืองนครราชสีมา,นครราชสีมา,อนุบาล–มัธยมศึกษาตอนต้น
โรงเรียนบ้านพุดซา,พุดซา,เมืองนครราชสีมา,นครราชสีมา,อนุบาล–ประถมศึกษา
โรงเรียนบ้านเพิก (รัฐประชาสามัคคี),หลุมข้าว,โนนสูง,นครราชสีมา,อนุบาล–ประถมศึกษา
โรงเรียนบ้านไพ,ขามเฒ่า,โนนสูง,นครราชสีมา,อนุบาล–ประถมศึกษา
โรงเรียนบ้านไพล (ไตรมิตรสามัคคี),หลุมข้าว,โนนสูง,นครราชสีมา,อนุบาล–ประถมศึกษา
โรงเรียนบ้านภูเขาลาด,บ้านใหม่,เมืองนครราชสีมา,นครราชสีมา,อนุบาล–ประถมศึกษา
โรงเรียนบ้านมะขามเฒ่า (เปรมประชารัฐวิทยา),บ้านใหม่,เมืองนครราชสีมา,นครราชสีมา,อนุบาล–มัธยมศึกษาตอนต้น
โรงเรียนบ้านมะค่า,บ้านโพธิ์,เมืองนครราชสีมา,นครราชสีมา,อนุบาล–ประถมศึกษา
โรงเรียนบ้านมะค่า (คงฤทธิบัวสุวรรณอนุสรณ์),มะค่า,โนนสูง,นครราชสีมา,อนุบาล–ประถมศึกษา
โรงเรียนบ้านมะรุม,พลสงคราม,โนนสูง,นครราชสีมา,อนุบาล–ประถมศึกษา
