name,subDistrict,district,province,level
โรงเรียนบ้านเนินมะค่า,น้ำรอบ,ลานสัก,อุทัยธานี,
โรงเรียนบ้านห้วยทราย,น้ำรอบ,ลานสัก,อุทัยธานี,
โรงเรียนบ้านหนองม่วง,น้ำรอบ,ลานสัก,อุทัยธานี,
โรงเรียนบ้านอีมาดอีทราย,แก่นมะกรูด,บ้านไร่,อุทัยธานี,
โรงเรียนบ้านใหม่คลองอังวะ,แก่นมะกรูด,บ้านไร่,อุทัยธานี,
โรงเรียนบ้านหนองจอก,หนองจอก,บ้านไร่,อุทัยธานี,
โรงเรียนบ้านหนองไม้แก่น,หนองจอก,บ้านไร่,อุทัยธานี,
โรงเรียนบ้านจัน,หนองจอก,บ้านไร่,อุทัยธานี,
โรงเรียนบ้านวังหิน,วังหิน,บ้านไร่,อุทัยธานี,
โรงเรียนบ้านคลองตะขาบ,วังหิน,บ้านไร่,อุทัยธานี,
โรงเรียนบ้านวังพง,วังหิน,บ้านไร่,อุทัยธานี,
โรงเรียนบ้านใหม่คลองเคียน,บ้านใหม่คลองเคียน,บ้านไร่,อุทัยธานี,
โรงเรียนสง่ารวมราษฎร์,บ้านใหม่คลองเคียน,บ้านไร่,อุทัยธานี,
โรงเรียนบ้านเขาลูกโล่,บ้านใหม่คลองเคียน,บ้านไร่,อุทัยธานี,
โรงเรียนบ้านหน้าฝายบึงตาโพ,บ้านบึง,บ้านไร่,อุทัยธานี,
โรงเรียนบ้านห้วยบง,บ้านบึง,บ้านไร่,อุทัยธานี,
โรงเรียนบ้านวังตอสามัคคี,บ้านบึง,บ้านไร่,อุทัยธานี,
โรงเรียนบ้านคลองหวาย,คอกควาย,บ้านไร่,อุทัยธานี,
โรงเรียนบ้านดง,คอกควาย,บ้านไร่,อุทัยธานี,
โรงเรียนวัดทองหลาง,คอกควาย,บ้านไร่,อุทัยธานี,
โรงเรียนบ้านหนองบ่มกล้วย,หนองบ่มกล้วย,บ้านไร่,อุทัยธานี,
โรงเรียนบ้านหินงามสามัคคี,หนองบ่มกล้วย,บ้านไร่,อุทัยธานี,
โรงเรียนบ้านลานคา,หนองบ่มกล้วย,บ้านไร่,อุทัยธานี,
โรงเรียนบ้านทุ่งนาสวน,หนองบ่มกล้วย,บ้านไร่,อุทัยธานี,
โรงเรียนอนุบาลบ้านไร่,บ้านไร่,บ้านไร่,อุทัยธานี,
โรงเรียนบ้านพุบอน,บ้านไร่,บ้านไร่,อุทัยธานี,
โรงเรียนบ้านศาลาคลอง,บ้านไร่,บ้านไร่,อุทัยธานี,
โรงเรียนวัดสะนำ,บ้านไร่,บ้านไร่,อุทัยธานี,
โรงเรียนบ้านห้วยป่าปก,บ้านไร่,บ้านไร่,อุทัยธานี,
โรงเรียนบ้านหินตุ้ม,บ้านไร่,บ้านไร่,อุทัยธานี,
โรงเรียนบ้านหูช้าง,หูช้าง,บ้านไร่,อุทัยธานี,
โรงเรียนบ้านซับสุราษฎร์,หูช้าง,บ้านไร่,อุทัยธานี,
โรงเรียนบ้านหนองฝาง,หูช้าง,บ้านไร่,อุทัยธานี,
โรงเรียนบ้านร่องมะดูก,หูช้าง,บ้านไร่,อุทัยธานี,
โรงเรียนบ้านเจ้าวัด,เจ้าวัด,บ้านไร่,อุทัยธานี,
โรงเรียนบ้านบุ่ง,เจ้าวัด,บ้านไร่,อุทัยธานี,
โรงเรียนบ้านใหม่ร่มเย็น,เจ้าวัด,บ้านไร่,อุทัยธานี,
โรงเรียนวัดพุ่มบำเพ็ญธรรม,เจ้าวัด,บ้านไร่,อุทัยธานี,
โรงเรียนชุมชนบ้านเมืองการุ้ง มิตรภาพที่ 52,เมืองการุ้ง,บ้านไร่,อุทัยธานี,
โรงเรียนบ้านตะกรุด,เมืองการุ้ง,บ้านไร่,อุทัยธานี,
โรงเรียนบ้านหนองอาสา,เมืองการุ้ง,บ้านไร่,อุทัยธานี,
โรงเรียนบ้านคลองโป่ง,เมืองการุ้ง,บ้านไร่,อุทัยธานี,
โรงเรียนบ้านหนองแกเชียงราย,เมืองการุ้ง,บ้านไร่,อุทัยธานี,
โรงเรียนวัดห้วยแห้ง,ห้วยแห้ง,บ้านไร่,อุทัยธานี,
โรงเรียนวัดผาทั่ง,ห้วยแห้ง,บ้านไร่,อุทัยธานี,
โรงเรียนบ้านห้วยพลู,ห้วยแห้ง,บ้านไร่,อุทัยธานี,
โรงเรียนบ้านนาทุ่งเชือก,ห้วยแห้ง,บ้านไร่,อุทัยธานี,
โรงเรียนวัดทัพหลวง,ทัพหลวง,บ้านไร่,อุทัยธานี,
โรงเรียนวัดทัพคล้าย,ทัพหลวง,บ้านไร่,อุทัยธานี,
โรงเรียนวัดทัพหมัน,ทัพหลวง,บ้านไร่,อุทัยธานี,
โรงเรียนบ้านพุต่อ,ทัพหลวง,บ้านไร่,อุทัยธานี,
โรงเรียนบ้านใหม่หนองแก,ทัพหลวง,บ้านไร่,อุทัยธานี,
โรงเรียนชุมชนเทศบาลวัดมณีสถิตกปิฏฐาราม,อุทัยใหม่,เมืองอุทัยธานี,อุทัยธานี,
โรงเรียนเทศบาลบ้านปากกะบาด,อุทัยใหม่,เมืองอุทัยธานี,อุทัยธานี,
โรงเรียนเทศบาลวัดธรรมโศภิต,อุทัยใหม่,เมืองอุทัยธานี,อุทัยธานี,
โรงเรียนเทศบาลวัดหลวงราชาวาส,อุทัยใหม่,เมืองอุทัยธานี,อุทัยธานี,
โรงเรียนเทศบาลวัดอมฤตวารี,อุทัยใหม่,เมืองอุทัยธานี,อุทัยธานี,
โรงเรียนอุทัยธรรมานุวัตรวิทยา,หนองสรวง,หนองฉาง,อุทัยธานี,มัธยมศึกษา
โรงเรียนพระสุธรรมยานเถระวิทยา,น้ำซึม,เมืองอุทัยธานี,อุทัยธานี,มัธยมศึกษา
โรงเรียนพิทักษ์ศิษย์วิทยา,อุทัยใหม่,เมืองอุทัยธานี,อุทัยธานี,เตรียมอนุบาล-ประถมศึกษา
โรงเรียนอนุศิษย์วิทยา 3,อุทัยใหม่,เมืองอุทัยธานี,อุทัยธานี,เตรียมอนุบาล-ประถมศึกษา
โรงเรียนอนุศิษย์วิทยา 4,สะแกกรัง,เมืองอุทัยธานี,อุทัยธานี,อนุบาล-ประถมศึกษา
โรงเรียนอนุบาลรจนา,ตลุกดู่,ทัพทัน,อุทัยธานี,เตรียมอนุบาล-อนุบาล
โรงเรียนอนุบาลสีฟ้า,บ้านไร่,บ้านไร่,อุทัยธานี,อนุบาล
โรงเรียนสีฟ้าพัฒนวิทย์,บ้านไร่,บ้านไร่,อุทัยธานี,ประถมศึกษา
โรงเรียนนอนุบาลรัศมี,เมืองการุ้ง,บ้านไร่,อุทัยธานี,อนุบาล-ประถมศึกษา
โรงเรียนทองประสาทเวทย์,หนองฉาง,หนองฉาง,อุทัยธานี,อนุบาล-ประถมศึกษา