name,subDistrict,district,province,level
โรงเรียนบ้านยางวังกางฮุง,บุ่งไหม,วารินชำราบ,อุบลราชธานี,
โรงเรียนบ้านกุดระงุม,บุ่งไหม,วารินชำราบ,อุบลราชธานี,
โรงเรียนบ้านโนนเกษม,ท่าลาด,วารินชำราบ,อุบลราชธานี,
โรงเรียนบ้านถ่อน,ท่าลาด,วารินชำราบ,อุบลราชธานี,
โรงเรียนบ้านท่าลาด,ท่าลาด,วารินชำราบ,อุบลราชธานี,
โรงเรียนบ้านโนนทรายน้อย,ท่าลาด,วารินชำราบ,อุบลราชธานี,
โรงเรียนบ้านโพธิ์,โพธิ์ใหญ่,วารินชำราบ,อุบลราชธานี,
โรงเรียนบ้านแมดคำลือชา (ราษฎร์สามัคคี),โพธิ์ใหญ่,วารินชำราบ,อุบลราชธานี,
โรงเรียนบ้านโนนแดง,โพธิ์ใหญ่,วารินชำราบ,อุบลราชธานี,
โรงเรียนบ้านคูเมือง (อ่อนอนุเคราะห์),คูเมือง,วารินชำราบ,อุบลราชธานี,
โรงเรียนวัดบ้านค้อหวาง,คูเมือง,วารินชำราบ,อุบลราชธานี,
โรงเรียนบ้านศีรษะกระบือ (อิสระคุรุราษฎร์),คูเมือง,วารินชำราบ,อุบลราชธานี,
โรงเรียนบ้านดอนผอุง,คูเมือง,วารินชำราบ,อุบลราชธานี,
โรงเรียนบ้านโนนจิก,คูเมือง,วารินชำราบ,อุบลราชธานี,
โรงเรียนอนุบาลวารินชำราบ (ก่อวิทยาคาร),แสนสุข,วารินชำราบ,อุบลราชธานี,
โรงเรียนบ้านธาตุ,แสนสุข,วารินชำราบ,อุบลราชธานี,
โรงเรียนบ้านคำเจริญ,แสนสุข,วารินชำราบ,อุบลราชธานี,
โรงเรียนชุมชนบ้านศรีไค (ศรีวัฒนาวิทยาคาร),เมืองศรีไค,วารินชำราบ,อุบลราชธานี,
โรงเรียนโนนชาดผดุงวิทย์,เมืองศรีไค,วารินชำราบ,อุบลราชธานี,
โรงเรียนบ้านคำขวาง,คำขวาง,วารินชำราบ,อุบลราชธานี,
โรงเรียนบ้านแฮหนามแท่ง,คำขวาง,วารินชำราบ,อุบลราชธานี,
โรงเรียนบ้านบัววัด,ธาตุ,วารินชำราบ,อุบลราชธานี,
โรงเรียนบ้านหนองสอห้อ,ธาตุ,วารินชำราบ,อุบลราชธานี,
โรงเรียนบ้านดอนกลาง (ราษฎร์สงเคราะห์),ธาตุ,วารินชำราบ,อุบลราชธานี,
โรงเรียนบ้านโนนโหนน (อ่อนอุปการ),โนนโหนน,วารินชำราบ,อุบลราชธานี,
โรงเรียนบ้านหนองคู (โสภณประชานุกูล),โนนโหนน,วารินชำราบ,อุบลราชธานี,
โรงเรียนบ้านคอนสาย,โนนโหนน,วารินชำราบ,อุบลราชธานี,
โรงเรียนบ้านนาโหนนน้อย,โนนโหนน,วารินชำราบ,อุบลราชธานี,
โรงเรียนบ้านสระสมิง,สระสมิง,วารินชำราบ,อุบลราชธานี,
โรงเรียนบ้านแสนคำ (นาชุมสามัคคี),สระสมิง,วารินชำราบ,อุบลราชธานี,
โรงเรียนบ้านหนองบัวแดนเกษม,สระสมิง,วารินชำราบ,อุบลราชธานี,
โรงเรียนประชารัฐสามัคคี (ธนาคารกรุงเทพ 13),สระสมิง,วารินชำราบ,อุบลราชธานี,
โรงเรียนบ้านบาก,สระสมิง,วารินชำราบ,อุบลราชธานี,
โรงเรียนบ้านหนองตาปู่,สระสมิง,วารินชำราบ,อุบลราชธานี,
โรงเรียนบ้านโนนยาง,สระสมิง,วารินชำราบ,อุบลราชธานี,
โรงเรียนบ้านคำนางรวย,คำน้ำแซบ,วารินชำราบ,อุบลราชธานี,
โรงเรียนบ้านโพธิ์มูลเพียเภ้า,คำน้ำแซบ,วารินชำราบ,อุบลราชธานี,
โรงเรียนบ้านท่าข้องเหล็ก,คำน้ำแซบ,วารินชำราบ,อุบลราชธานี,
โรงเรียนบ้านท่างอย,บุ่งหวาย,วารินชำราบ,อุบลราชธานี,
โรงเรียนบ้านบุ่งหวาย,บุ่งหวาย,วารินชำราบ,อุบลราชธานี,
โรงเรียนบ้านโนนบอน (คำหล้าประชานุเคราะห์),บุ่งหวาย,วารินชำราบ,อุบลราชธานี,
โรงเรียนบ้านวังยาง,บุ่งหวาย,วารินชำราบ,อุบลราชธานี,
โรงเรียนบ้านดอนชาด,บุ่งหวาย,วารินชำราบ,อุบลราชธานี,
โรงเรียนบ้านห่องชัน,บุ่งหวาย,วารินชำราบ,อุบลราชธานี,
โรงเรียนบ้านปากกุดหวาย,หนองกินเพล,วารินชำราบ,อุบลราชธานี,
โรงเรียนบ้านหนองกินเพล,หนองกินเพล,วารินชำราบ,อุบลราชธานี,
โรงเรียนบ้านขัวไม้แก่น (มหิดลอนุสรณ์ 3),หนองกินเพล,วารินชำราบ,อุบลราชธานี,
โรงเรียนบ้านทางสาย,หนองกินเพล,วารินชำราบ,อุบลราชธานี,
โรงเรียนบ้านคูสว่าง,หนองกินเพล,วารินชำราบ,อุบลราชธานี,
โรงเรียนบ้านกุดชุม,หนองกินเพล,วารินชำราบ,อุบลราชธานี,
โรงเรียนบ้านนาสะแบง,หนองกินเพล,วารินชำราบ,อุบลราชธานี,
โรงเรียนบ้านกุดปลาขาว,วารินชำราบ,วารินชำราบ,อุบลราชธานี,
โรงเรียนชุมชนบ้านกุดเป่ง,วารินชำราบ,วารินชำราบ,อุบลราชธานี,
โรงเรียนบ้านหาดสวนยา,วารินชำราบ,วารินชำราบ,อุบลราชธานี,
โรงเรียนบ้านท่าบ้งมั่ง (ทหารอากาศอเมริกันสงเคราะห์),วารินชำราบ,วารินชำราบ,อุบลราชธานี,
โรงเรียนบ้านห้วยขะยุง (คุรุพานิชวิทยาคาร),ห้วยขะยุง,วารินชำราบ,อุบลราชธานี,
โรงเรียนบ้านน้ำเที่ยง,ห้วยขะยุง,วารินชำราบ,อุบลราชธานี,
โรงเรียนบ้านนากระแซง,นากระแซง,เดชอุดม,อุบลราชธานี,
โรงเรียนพิชัยศึกษา,นากระแซง,เดชอุดม,อุบลราชธานี,
โรงเรียนบ้านดอนกลาง,นากระแซง,เดชอุดม,อุบลราชธานี,
โรงเรียนบ้านเตย,นากระแซง,เดชอุดม,อุบลราชธานี,
โรงเรียนบ้านหนองไฮ,นากระแซง,เดชอุดม,อุบลราชธานี,
โรงเรียนบ้านหนองแต้,นากระแซง,เดชอุดม,อุบลราชธานี,
โรงเรียนบ้านหนองเงินฮ้อย,นากระแซง,เดชอุดม,อุบลราชธานี,
โรงเรียนบ้านหม้อทอง,นากระแซง,เดชอุดม,อุบลราชธานี,
โรงเรียนบ้านโนนสวาง,นากระแซง,เดชอุดม,อุบลราชธานี,
โรงเรียนบ้านกุดประทาย,กุดประทาย,เดชอุดม,อุบลราชธานี,
โรงเรียนบ้านสุขสมบูรณ์,กุดประทาย,เดชอุดม,อุบลราชธานี,
โรงเรียนบ้านอุดมสุข,กุดประทาย,เดชอุดม,อุบลราชธานี,
โรงเรียนบ้านดอนม่วย,กุดประทาย,เดชอุดม,อุบลราชธานี,
โรงเรียนบ้านนาทุ่ง,กุดประทาย,เดชอุดม,อุบลราชธานี,
โรงเรียนบ้านแสนสุข,กุดประทาย,เดชอุดม,อุบลราชธานี,
โรงเรียนบ้านนาอุดม,กุดประทาย,เดชอุดม,อุบลราชธานี,
โรงเรียนบ้านโนนกอย,กุดประทาย,เดชอุดม,อุบลราชธานี,
โรงเรียนบ้านโนนขาม,กุดประทาย,เดชอุดม,อุบลราชธานี,
โรงเรียนบ้านหนองคู,กุดประทาย,เดชอุดม,อุบลราชธานี,
โรงเรียนบ้านนากระแซง,กุดประทาย,เดชอุดม,อุบลราชธานี,
โรงเรียนบ้านแก้ง,แก้ง,เดชอุดม,อุบลราชธานี,
โรงเรียนบ้านไฮตาก,แก้ง,เดชอุดม,อุบลราชธานี,
โรงเรียนบ้านประหูต,แก้ง,เดชอุดม,อุบลราชธานี,
โรงเรียนบ้านห้วยสำราญ,แก้ง,เดชอุดม,อุบลราชธานี,
โรงเรียนบ้านยาง,แก้ง,เดชอุดม,อุบลราชธานี,
โรงเรียนบ้านคำสำราญ,ตบหู,เดชอุดม,อุบลราชธานี,
โรงเรียนบ้านป่าตาว,ตบหู,เดชอุดม,อุบลราชธานี,
โรงเรียนบ้านโนนแคน,ตบหู,เดชอุดม,อุบลราชธานี,
โรงเรียนบ้านโนนกาเร็น,ตบหู,เดชอุดม,อุบลราชธานี,
โรงเรียนบ้านโนนแก้ง,ตบหู,เดชอุดม,อุบลราชธานี,
โรงเรียนบ้านโพนดวน,ตบหู,เดชอุดม,อุบลราชธานี,
โรงเรียนบ้านสองคอน,ตบหู,เดชอุดม,อุบลราชธานี,
โรงเรียนบ้านโพธิ์ไทร,ตบหู,เดชอุดม,อุบลราชธานี,
โรงเรียนนาเจริญ,นาเจริญ,เดชอุดม,อุบลราชธานี,
โรงเรียนบ้านหนองบัวแดง,นาเจริญ,เดชอุดม,อุบลราชธานี,
โรงเรียนบ้านโนนจิก,นาเจริญ,เดชอุดม,อุบลราชธานี,
โรงเรียนบ้านห่องคำ,นาเจริญ,เดชอุดม,อุบลราชธานี,
โรงเรียนบ้านห่องเตย,นาเจริญ,เดชอุดม,อุบลราชธานี,
โรงเรียนบ้านโชคชัย,นาเจริญ,เดชอุดม,อุบลราชธานี,
โรงเรียนสมสะอาดสวนฝ้าย,สมสะอาด,เดชอุดม,อุบลราชธานี,
โรงเรียนบ้านหนองบัวหลวง,สมสะอาด,เดชอุดม,อุบลราชธานี,
โรงเรียนบ้านท่าหลวงนาคำ,สมสะอาด,เดชอุดม,อุบลราชธานี,
โรงเรียนบ้านโนนสนาม,สมสะอาด,เดชอุดม,อุบลราชธานี,
โรงเรียนบ้านม่วงนาดี,สมสะอาด,เดชอุดม,อุบลราชธานี,
โรงเรียนบ้านนาส่วง,นาส่วง,เดชอุดม,อุบลราชธานี,
โรงเรียนบ้านกระเบื้อง,นาส่วง,เดชอุดม,อุบลราชธานี,
โรงเรียนบ้านม่วงโนนกระแต,นาส่วง,เดชอุดม,อุบลราชธานี,
โรงเรียนบ้านเสาเล้า,นาส่วง,เดชอุดม,อุบลราชธานี,
โรงเรียนบ้านนาห้วยแคน,นาส่วง,เดชอุดม,อุบลราชธานี,
โรงเรียนบ้านหนองบัว,นาส่วง,เดชอุดม,อุบลราชธานี,
โรงเรียนบ้านท่าโพธิ์ศรี,ท่าโพธิ์ศรี,เดชอุดม,อุบลราชธานี,
โรงเรียนบ้านวารีอุดม,ท่าโพธิ์ศรี,เดชอุดม,อุบลราชธานี,
โรงเรียนบ้านโพธิ์สง่า,ท่าโพธิ์ศรี,เดชอุดม,อุบลราชธานี,
โรงเรียนบ้านโนนหลี่,ท่าโพธิ์ศรี,เดชอุดม,อุบลราชธานี,
โรงเรียนบ้านทุ่งเทิง,ทุ่งเทิง,เดชอุดม,อุบลราชธานี,
โรงเรียนบ้านสว่างโนนทอง,ทุ่งเทิง,เดชอุดม,อุบลราชธานี,
โรงเรียนบ้านโนน,ทุ่งเทิง,เดชอุดม,อุบลราชธานี,
โรงเรียนบ้านบัวเจริญ,ทุ่งเทิง,เดชอุดม,อุบลราชธานี,
โรงเรียนบ้านโนนสมบูรณ์,โนนสมบูรณ์,เดชอุดม,อุบลราชธานี,
โรงเรียนอุดมสามัคคี,โนนสมบูรณ์,เดชอุดม,อุบลราชธานี,
โรงเรียนบ้านสวนสวรรค์,โนนสมบูรณ์,เดชอุดม,อุบลราชธานี,
โรงเรียนบ้านนาแก,โนนสมบูรณ์,เดชอุดม,อุบลราชธานี,
โรงเรียนบ้านป่าโมง,ป่าโมง,เดชอุดม,อุบลราชธานี,
โรงเรียนบ้านป่าหวาย,ป่าโมง,เดชอุดม,อุบลราชธานี,
โรงเรียนบ้านโนนค้อ,ป่าโมง,เดชอุดม,อุบลราชธานี,
โรงเรียนบ้านโนนสว่าง,โพนงาม,เดชอุดม,อุบลราชธานี,
โรงเรียนชุมชนบ้านหนองยาว,โพนงาม,เดชอุดม,อุบลราชธานี,
โรงเรียนนิคมสร้างตนเองลำโดมใหญ่,โพนงาม,เดชอุดม,อุบลราชธานี,
โรงเรียนบ้านบัวงาม,บัวงาม,เดชอุดม,อุบลราชธานี,
โรงเรียนบ้านหนองสนม,บัวงาม,เดชอุดม,อุบลราชธานี,
โรงเรียนบ้านนาเลิง,บัวงาม,เดชอุดม,อุบลราชธานี,
โรงเรียนบ้านโนนแฝก,บัวงาม,เดชอุดม,อุบลราชธานี,
โรงเรียนบ้านราษฎร์สามัคคี,บัวงาม,เดชอุดม,อุบลราชธานี,
โรงเรียนบ้านบัวทอง,บัวงาม,เดชอุดม,อุบลราชธานี,
โรงเรียนประชานุเคราะห์ศึกษา,บัวงาม,เดชอุดม,อุบลราชธานี,
โรงเรียนบ้านคำครั่ง,คำครั่ง,เดชอุดม,อุบลราชธานี,
โรงเรียนบ้านนานวล,คำครั่ง,เดชอุดม,อุบลราชธานี,
โรงเรียนบ้านนาสมบูรณ์,คำครั่ง,เดชอุดม,อุบลราชธานี,
โรงเรียนบ้านนาประดู่,คำครั่ง,เดชอุดม,อุบลราชธานี,
โรงเรียนบ้านกลาง,กลาง,เดชอุดม,อุบลราชธานี,
โรงเรียนบ้านหมากมาย,กลาง,เดชอุดม,อุบลราชธานี,
โรงเรียนดำรงสินสงเคราะห์,กลาง,เดชอุดม,อุบลราชธานี,
โรงเรียนบ้านเม็กใหญ่,กลาง,เดชอุดม,อุบลราชธานี,
โรงเรียนบ้านบัวเทียม,กลาง,เดชอุดม,อุบลราชธานี,
โรงเรียนบ้านโนนสวรรค์,กลาง,เดชอุดม,อุบลราชธานี,
โรงเรียนนาจะหลวย (กรป.กลางอุปถัมภ์),นาจะหลวย,นาจะหลวย,อุบลราชธานี,
โรงเรียนผอบ ณ นคร 2,นาจะหลวย,นาจะหลวย,อุบลราชธานี,
โรงเรียนบ้านโคกใหญ่,นาจะหลวย,นาจะหลวย,อุบลราชธานี,
โรงเรียนสมเด็จพระบรมราชชนนี (บ้านแก่งเรือง),นาจะหลวย,นาจะหลวย,อุบลราชธานี,
โรงเรียนบ้านดงขวางคำโทน,นาจะหลวย,นาจะหลวย,อุบลราชธานี,
โรงเรียนบ้านท่าก่อ,นาจะหลวย,นาจะหลวย,อุบลราชธานี,
โรงเรียนบ้านแก้งขี้เหล็ก,นาจะหลวย,นาจะหลวย,อุบลราชธานี,
โรงเรียนบ้านโนนว่าน,โนนสวรรค์,นาจะหลวย,อุบลราชธานี,
โรงเรียนบ้านตบหู,โนนสวรรค์,นาจะหลวย,อุบลราชธานี,
โรงเรียนบ้านคำอุดม,โนนสวรรค์,นาจะหลวย,อุบลราชธานี,
โรงเรียนบ้านป่าก้าว,โนนสมบูรณ์,นาจะหลวย,อุบลราชธานี,
โรงเรียนบ้านโคกเทียม,โนนสมบูรณ์,นาจะหลวย,อุบลราชธานี,
โรงเรียนบ้านกวางดีด,โนนสมบูรณ์,นาจะหลวย,อุบลราชธานี,
โรงเรียนบ้านป่าพอก,โนนสมบูรณ์,นาจะหลวย,อุบลราชธานี,
โรงเรียนบ้านโนนบก,โนนสมบูรณ์,นาจะหลวย,อุบลราชธานี,
โรงเรียนบ้านโนนคูณแสนสุข,โนนสมบูรณ์,นาจะหลวย,อุบลราชธานี,
โรงเรียนบ้านม่วง,พรสวรรค์,นาจะหลวย,อุบลราชธานี,
โรงเรียนบ้านฝั่งเพ,พรสวรรค์,นาจะหลวย,อุบลราชธานี,
โรงเรียนบ้านแก้งขอ,พรสวรรค์,นาจะหลวย,อุบลราชธานี,
โรงเรียนบ้านคุ้มแสนชะนี,พรสวรรค์,นาจะหลวย,อุบลราชธานี,
โรงเรียนบ้านบุ่งคำ,พรสวรรค์,นาจะหลวย,อุบลราชธานี,
โรงเรียนบ้านโสกแสง,โสกแสง,นาจะหลวย,อุบลราชธานี,
โรงเรียนบ้านป่าไร่,โสกแสง,นาจะหลวย,อุบลราชธานี,
โรงเรียนบ้านโนนสว่าง,โสกแสง,นาจะหลวย,อุบลราชธานี,
โรงเรียนบ้านดอนชัยชนะ,โสกแสง,นาจะหลวย,อุบลราชธานี,
โรงเรียนบ้านทุ่งเพียง,โสกแสง,นาจะหลวย,อุบลราชธานี,
โรงเรียนบ้านคำม่วง,โสกแสง,นาจะหลวย,อุบลราชธานี,
โรงเรียนบ้านทับไฮ,โสกแสง,นาจะหลวย,อุบลราชธานี,
โรงเรียนบ้านโพนแอวขัน,โสกแสง,นาจะหลวย,อุบลราชธานี,
โรงเรียนบ้านตูม (ราษฎร์บูรณะ),บ้านตูม,นาจะหลวย,อุบลราชธานี,
โรงเรียนบ้านดอนอาว,บ้านตูม,นาจะหลวย,อุบลราชธานี,
โรงเรียนบ้านคำบอน,บ้านตูม,นาจะหลวย,อุบลราชธานี,
โรงเรียนชุมชนบ้านโนนแดง,บ้านตูม,นาจะหลวย,อุบลราชธานี,
