name,subDistrict,district,province,level
โรงเรียนกาญจนาภิเษกวิทยาลัย อุทัยธานี,ดอนกลอย,หนองขาหย่าง,อุทัยธานี,มัธยมศึกษา
โรงเรียนการุ้งวิทยาคม,เมืองการุ้ง,บ้านไร่,อุทัยธานี,มัธยมศึกษา
โรงเรียนตลุกดู่วิทยาคม,ตลุกดู่,ทัพทัน,อุทัยธานี,มัธยมศึกษา
โรงเรียนทองหลางวิทยาคม,คอกควาย,บ้านไร่,อุทัยธานี,มัธยมศึกษา
โรงเรียนทัพทันอนุสรณ์,ทัพทัน,ทัพทัน,อุทัยธานี,มัธยมศึกษา
โรงเรียนทุ่งโพวิทยา,เขากวางทอง,หนองฉาง,อุทัยธานี,มัธยมศึกษา
โรงเรียนบ่อยางวิทยาคม,บ่อยาง,สว่างอารมณ์,อุทัยธานี,มัธยมศึกษา
โรงเรียนบ้านทุ่งนาวิทยา,เขาบางแกรก,หนองฉาง,อุทัยธานี,มัธยมศึกษา
โรงเรียนบ้านไร่วิทยา,บ้านบึง,บ้านไร่,อุทัยธานี,มัธยมศึกษา
โรงเรียนพุทธมงคลวิทยา,อุทัยใหม่,เมืองอุทัยธานี,อุทัยธานี,มัธยมศึกษา
โรงเรียนร่องตาทีวิทยา,ลานสัก,ลานสัก,อุทัยธานี,มัธยมศึกษา
โรงเรียนลานสักวิทยา,ป่าอ้อ,ลานสัก,อุทัยธานี,มัธยมศึกษา
โรงเรียนวังหินวิทยาคม,วังหิน,บ้านไร่,อุทัยธานี,มัธยมศึกษา
โรงเรียนสมอทองปทีปพลีผลอุปถัมภ์,ทองหลาง,ห้วยคต,อุทัยธานี,มัธยมศึกษา
โรงเรียนสว่างอารมณ์วิทยาคม,สว่างอารมณ์,สว่างอารมณ์,อุทัยธานี,มัธยมศึกษา
โรงเรียนหนองขาหย่างวิทยา,หนองขาหย่าง,หนองขาหย่าง,อุทัยธานี,มัธยมศึกษา
โรงเรียนหนองจอกประชานุสรณ์,หนองจอก,บ้านไร่,อุทัยธานี,มัธยมศึกษา
โรงเรียนหนองฉางวิทยา,หนองฉาง,หนองฉาง,อุทัยธานี,มัธยมศึกษา
โรงเรียนหนองเต่าวิทยา,หนองเต่า,เมืองอุทัยธานี,อุทัยธานี,มัธยมศึกษา
โรงเรียนห้วยคตพิทยาคม,สุขฤทัย,ห้วยคต,อุทัยธานี,มัธยมศึกษา
โรงเรียนอุทัยวิทยาคม,สะแกกรัง,เมืองอุทัยธานี,อุทัยธานี,มัธยมศึกษา
โรงเรียนอนุบาลเมืองอุทัยธานี,อุทัยใหม่,เมืองอุทัยธานี,อุทัยธานี,
โรงเรียนวัดหนองตางู,ดอนขวาง,เมืองอุทัยธานี,อุทัยธานี,
โรงเรียนวัดโนนเหล็ก (อุทัยประชาสรรค์),โนนเหล็ก,เมืองอุทัยธานี,อุทัยธานี,
โรงเรียนอนุบาลวัดหนองเต่า,หนองเต่า,เมืองอุทัยธานี,อุทัยธานี,
โรงเรียนบ้านหนองโพธิ์,หนองไผ่แบน,เมืองอุทัยธานี,อุทัยธานี,
โรงเรียนวัดหนองแก,หนองแก,เมืองอุทัยธานี,อุทัยธานี,
โรงเรียนบ้านเกาะเทโพ,เกาะเทโพ,เมืองอุทัยธานี,อุทัยธานี,
โรงเรียนวัดอัมพวัน (ประชาชนูทิศ),เกาะเทโพ,เมืองอุทัยธานี,อุทัยธานี,
โรงเรียนวัดหาดทนง,หาดทนง,เมืองอุทัยธานี,อุทัยธานี,
โรงเรียนวัดสะพานหิน,หาดทนง,เมืองอุทัยธานี,อุทัยธานี,
โรงเรียนบ้านท่าซุง,ท่าซุง,เมืองอุทัยธานี,อุทัยธานี,
โรงเรียนบ้านดงยางใต้,ท่าซุง,เมืองอุทัยธานี,อุทัยธานี,
โรงเรียนวัดสังกัสรัตนคีรี,น้ำซึม,เมืองอุทัยธานี,อุทัยธานี,
โรงเรียนบ้านภูมิธรรม,น้ำซึม,เมืองอุทัยธานี,อุทัยธานี,
โรงเรียนชุมชนวัดท่าซุง (เลิศ-สิน อุปถัมภ์),น้ำซึม,เมืองอุทัยธานี,อุทัยธานี,
โรงเรียนวัดจักษา,สะแกกรัง,เมืองอุทัยธานี,อุทัยธานี,
โรงเรียนวัดอุโปสถาราม,สะแกกรัง,เมืองอุทัยธานี,อุทัยธานี,
โรงเรียนวัดบุญลือ (อุเทสประชาสรรค์),เนินแจง,เมืองอุทัยธานี,อุทัยธานี,
โรงเรียนวัดบุญลือ (อุเทสประชาสรรค์) สาขาวัดเขาพะแวง,เนินแจง,เมืองอุทัยธานี,อุทัยธานี,
โรงเรียนวัดตานาด,เนินแจง,เมืองอุทัยธานี,อุทัยธานี,
โรงเรียนวัดหนองพังค่า (ประชานุกูล),หนองพังค่า,เมืองอุทัยธานี,อุทัยธานี,
โรงเรียนวัดเนื้อร้อน,หนองพังค่า,เมืองอุทัยธานี,อุทัยธานี,
โรงเรียนอนุบาลสว่างอารมณ์,สว่างอารมณ์,สว่างอารมณ์,อุทัยธานี,
โรงเรียนวัดดงแขวน,สว่างอารมณ์,สว่างอารมณ์,อุทัยธานี,
โรงเรียนบ้านหนองยายดา,สว่างอารมณ์,สว่างอารมณ์,อุทัยธานี,
โรงเรียนบ้านเนินก้าว,สว่างอารมณ์,สว่างอารมณ์,อุทัยธานี,
โรงเรียนบ้านบ่อยาง,บ่อยาง,สว่างอารมณ์,อุทัยธานี,
โรงเรียนวัดดอนหวาย,บ่อยาง,สว่างอารมณ์,อุทัยธานี,
โรงเรียนบ้านหนองตะเคียน,บ่อยาง,สว่างอารมณ์,อุทัยธานี,
โรงเรียนบ้านหนองแว่น,หนองหลวง,สว่างอารมณ์,อุทัยธานี,
โรงเรียนวัดเขาดาวเรือง,หนองหลวง,สว่างอารมณ์,อุทัยธานี,
โรงเรียนบ้านสระนารายณ์,หนองหลวง,สว่างอารมณ์,อุทัยธานี,
โรงเรียนบ้านสระนารายณ์ สาขาบ้านหนองตะคลอง,หนองหลวง,สว่างอารมณ์,อุทัยธานี,
โรงเรียนบ้านหนองกี่,พลวงสองนาง,สว่างอารมณ์,อุทัยธานี,
โรงเรียนบ้านหนองสมบูรณ์,พลวงสองนาง,สว่างอารมณ์,อุทัยธานี,
โรงเรียนบ้านหนองชุมเห็ด,พลวงสองนาง,สว่างอารมณ์,อุทัยธานี,
โรงเรียนบ้านหนองแขวนกูบ,พลวงสองนาง,สว่างอารมณ์,อุทัยธานี,
โรงเรียนบ้านเขาผาลาด,พลวงสองนาง,สว่างอารมณ์,อุทัยธานี,
โรงเรียนวัดเขาหินเทิน,พลวงสองนาง,สว่างอารมณ์,อุทัยธานี,
โรงเรียนบ้านหนองรัก,ไผ่เขียว,สว่างอารมณ์,อุทัยธานี,
โรงเรียนบ้านหนองเข้,ไผ่เขียว,สว่างอารมณ์,อุทัยธานี,
โรงเรียนบ้านเขาทองหลาง,ไผ่เขียว,สว่างอารมณ์,อุทัยธานี,
โรงเรียนวัดวังบุญ,ไผ่เขียว,สว่างอารมณ์,อุทัยธานี,
โรงเรียนชุมชนบ้านทุ่งสงบ,ไผ่เขียว,สว่างอารมณ์,อุทัยธานี,
โรงเรียนบ้านทุ่งมน,ไผ่เขียว,สว่างอารมณ์,อุทัยธานี,
โรงเรียนบ้านวังเกษตร,ไผ่เขียว,สว่างอารมณ์,อุทัยธานี,
โรงเรียนบ้านคลองข่อย,ไผ่เขียว,สว่างอารมณ์,อุทัยธานี,
โรงเรียนชุมชนวัดดงขวาง,ดงขวาง,หนองขาหย่าง,อุทัยธานี,
โรงเรียนวัดหนองระแหงเหนือ,หนองไผ่,หนองขาหย่าง,อุทัยธานี,
โรงเรียนวัดดอนกลอย,ดอนกลอย,หนองขาหย่าง,อุทัยธานี,
โรงเรียนอนุบาลหนองขาหย่าง,หนองขาหย่าง,หนองขาหย่าง,อุทัยธานี,
โรงเรียนวัดหนองแฟบ,หนองขาหย่าง,หนองขาหย่าง,อุทัยธานี,
โรงเรียนวัดทุ่งพึ่ง,ทุ่งพึ่ง,หนองขาหย่าง,อุทัยธานี,
โรงเรียนวัดหนองเขื่อน,ทุ่งพึ่ง,หนองขาหย่าง,อุทัยธานี,
โรงเรียนวัดท่าโพ,ท่าโพ,หนองขาหย่าง,อุทัยธานี,
โรงเรียนบ้านหลุมเข้า มิตรภาพที่ 117,หลุมเข้า,หนองขาหย่าง,อุทัยธานี,
โรงเรียนบ้านปากดง,หลุมเข้า,หนองขาหย่าง,อุทัยธานี,
โรงเรียนวัดห้วยรอบ,ห้วยรอบ,หนองขาหย่าง,อุทัยธานี,
โรงเรียนอนุบาลทัพทัน (อุดมพิทยา),ทัพทัน,ทัพทัน,อุทัยธานี,
โรงเรียนวัดดงพิกุล,หนองกลางดง,ทัพทัน,อุทัยธานี,
โรงเรียนบ้านหนองเมน,หนองยายดา,ทัพทัน,อุทัยธานี,
โรงเรียนวัดหนองสระ,หนองสระ,ทัพทัน,อุทัยธานี,
โรงเรียนบ้านท่าดาน,หนองหญ้าปล้อง,ทัพทัน,อุทัยธานี,
โรงเรียนวัดทุ่งนาไทย,เขาขี้ฝอย,ทัพทัน,อุทัยธานี,
โรงเรียนชุมชนบ้านโคกหม้อ,โคกหม้อ,ทัพทัน,อุทัยธานี,
โรงเรียนวัดตลุกดู่ (อุทิศเสมาประชาบำรุง),ตลุกดู่,ทัพทัน,อุทัยธานี,
โรงเรียนวัดเขาปฐวี,ตลุกดู่,ทัพทัน,อุทัยธานี,
โรงเรียนบ้านหนองไผ่,ตลุกดู่,ทัพทัน,อุทัยธานี,
โรงเรียนบ้านวังเตย,ตลุกดู่,ทัพทัน,อุทัยธานี,
โรงเรียนบ้านวังเตย สาขาบ้านสาลี,ตลุกดู่,ทัพทัน,อุทัยธานี,
โรงเรียนบ้านสวนขวัญ,ตลุกดู่,ทัพทัน,อุทัยธานี,
โรงเรียนบ้านโป่งเก้ง,ตลุกดู่,ทัพทัน,อุทัยธานี,
โรงเรียนบ้านหนองแห้ว,หนองกระทุ่ม,ทัพทัน,อุทัยธานี,
โรงเรียนบ้านหนองขุย (นาคสวัสดิ์ประชานุเคราะห์),หนองกระทุ่ม,ทัพทัน,อุทัยธานี,
โรงเรียนบ้านหนองหญ้าปล้อง,หนองกระทุ่ม,ทัพทัน,อุทัยธานี,
โรงเรียนวัดวังสาริกา,หนองกระทุ่ม,ทัพทัน,อุทัยธานี,
โรงเรียนบ้านคอดยาง,หนองกระทุ่ม,ทัพทัน,อุทัยธานี,
โรงเรียนบ้านเนินเคว่า (พูลประชาสรรค์),หนองกระทุ่ม,ทัพทัน,อุทัยธานี,
โรงเรียนบ้านเขากวางทอง,เขากวางทอง,หนองฉาง,อุทัยธานี,
โรงเรียนบ้านดงประดาพระ,เขากวางทอง,หนองฉาง,อุทัยธานี,
โรงเรียนบ้านประดาหัก,เขากวางทอง,หนองฉาง,อุทัยธานี,
โรงเรียนบ้านหนองกระทุ่ม,เขากวางทอง,หนองฉาง,อุทัยธานี,
โรงเรียนบ้านท่าชะอม,เขากวางทอง,หนองฉาง,อุทัยธานี,
โรงเรียนบ้านเขาน้อย,เขากวางทอง,หนองฉาง,อุทัยธานี,
โรงเรียนวัดหนองยาง,หนองยาง,หนองฉาง,อุทัยธานี,
โรงเรียนวัดหนองบัว,หนองยาง,หนองฉาง,อุทัยธานี,
โรงเรียนบ้านล่อมเสือโฮก,หนองยาง,หนองฉาง,อุทัยธานี,
โรงเรียนบ้านงิ้วงาม,หนองยาง,หนองฉาง,อุทัยธานี,
โรงเรียนบ้านทุ่งใหญ่,หนองยาง,หนองฉาง,อุทัยธานี,
โรงเรียนบ้านป่าเลา,เขาบางแกรก,หนองฉาง,อุทัยธานี,
โรงเรียนวัดเทพนิมิต,เขาบางแกรก,หนองฉาง,อุทัยธานี,
โรงเรียนชุมชนบ้านทุ่งนา,เขาบางแกรก,หนองฉาง,อุทัยธานี,
โรงเรียนบ้านวังผาลาด,เขาบางแกรก,หนองฉาง,อุทัยธานี,
โรงเรียนชุมชนบ้านหนองงาแซง,ทุ่งโพ,หนองฉาง,อุทัยธานี,
โรงเรียนบ้านกลาง,ห้วยคต,ห้วยคต,อุทัยธานี,
โรงเรียนบ้านน้ำพุพรหมานุสรณ์,ทุ่งโพ,หนองฉาง,อุทัยธานี,
โรงเรียนบ้านเนินพยอม,ทุ่งโพ,หนองฉาง,อุทัยธานี,
โรงเรียนบ้านเนินสาธารณ์,บ้านเก่า,หนองฉาง,อุทัยธานี,
โรงเรียนบ้านบ่อทับใต้,หนองสรวง,หนองฉาง,อุทัยธานี,
โรงเรียนบ้านหนองจิกยาว,อุทัยเก่า,หนองฉาง,อุทัยธานี,
โรงเรียนบ้านห้วยไผ่ขุย,หนองนางนวล,หนองฉาง,อุทัยธานี,
โรงเรียนวัดทุ่งโพ,ทุ่งโพ,หนองฉาง,อุทัยธานี,
โรงเรียนวัดทุ่งหลวง (เจริญราษฎร์บำรุง),ทุ่งพง,หนองฉาง,อุทัยธานี,
โรงเรียนวัดปทุมทอง,หนองนางนวล,หนองฉาง,อุทัยธานี,
โรงเรียนวัดหนองมะกอก,หนองนางนวล,หนองฉาง,อุทัยธานี,
โรงเรียนวัดห้วยพระจันทร์,หนองฉาง,หนองฉาง,อุทัยธานี,
โรงเรียนวัดหัวเมือง,อุทัยเก่า,หนองฉาง,อุทัยธานี,
โรงเรียนอนุบาลวัดหนองขุนชาติ (อุทิศพิทยาคาร),หนองสรวง,หนองฉาง,อุทัยธานี,
โรงเรียนอนุบาลห้วยคต (บ้านชุมทหารวิทยา),ห้วยคต,ห้วยคต,อุทัยธานี,
โรงเรียนไทยรัฐวิทยา 58 (ห้วยคตสามัคคี),ห้วยคต,ห้วยคต,อุทัยธานี,
โรงเรียนอนุบาลห้วยคต สาขบ้านหนองจอกพัฒนา,ห้วยคต,ห้วยคต,อุทัยธานี,
โรงเรียนบ้านหินโหง่น,ห้วยคต,ห้วยคต,อุทัยธานี,
โรงเรียนบ้านหนองลันราษฎร์บำรุง,สุขฤทัย,ห้วยคต,อุทัยธานี,
โรงเรียนบ้านหนองมะสัง,สุขฤทัย,ห้วยคต,อุทัยธานี,
โรงเรียนชุมชนวัดสุวรรณบรรพต,สุขฤทัย,ห้วยคต,อุทัยธานี,
โรงเรียนบ้านสมอทอง,ทองหลาง,ห้วยคต,อุทัยธานี,
โรงเรียนบ้านโป่งข่อย,ทองหลาง,ห้วยคต,อุทัยธานี,
โรงเรียนบ้านตลิ่งสูง,ทองหลาง,ห้วยคต,อุทัยธานี,
โรงเรียนบ้านหนองผักแพว,ทองหลาง,ห้วยคต,อุทัยธานี,
โรงเรียนบ้านคลองแห้งวิทยา,ทองหลาง,ห้วยคต,อุทัยธานี,
โรงเรียนบ้านนาไร่เดียว,ลานสัก,ลานสัก,อุทัยธานี,
โรงเรียนบ้านร่องตาที,ลานสัก,ลานสัก,อุทัยธานี,
โรงเรียนบ้านเพชรน้ำผึ้ง,ลานสัก,ลานสัก,อุทัยธานี,
โรงเรียนวัดเขาพระยาสังฆาราม,ลานสัก,ลานสัก,อุทัยธานี,
โรงเรียนอนุบาลลานสัก,ลานสัก,ลานสัก,อุทัยธานี,
โรงเรียนชุมชนบ้านประดู่ยืน,ประดู่ยืน,ลานสัก,อุทัยธานี,
โรงเรียนบ้านหนองผักกาด,ประดู่ยืน,ลานสัก,อุทัยธานี,
โรงเรียนบ้านทุ่งสามแท่ง,ประดู่ยืน,ลานสัก,อุทัยธานี,
โรงเรียนบ้านทัพยายปอน,ประดู่ยืน,ลานสัก,อุทัยธานี,
โรงเรียนวัดเขาฆ้องชัย,ลานสัก,ลานสัก,อุทัยธานี,
โรงเรียนบ้านป่าอ้อ,ป่าอ้อ,ลานสัก,อุทัยธานี,
โรงเรียนรัตนโกสินทร์ 2 (สมโภชกรุงรัตนโกสินทร์ 200 ปี),ป่าอ้อ,ลานสัก,อุทัยธานี,
โรงเรียนบ้านเขาวง,ป่าอ้อ,ลานสัก,อุทัยธานี,
โรงเรียนบ้านคลองชะนี,ป่าอ้อ,ลานสัก,อุทัยธานี,
โรงเรียนบ้านห้วยขาแข้งวิทยาคม,ระบำ,ลานสัก,อุทัยธานี,
โรงเรียนบ้านโป่งสามสิบ,ระบำ,ลานสัก,อุทัยธานี,
โรงเรียนบ้านห้วยเปล้า,ระบำ,ลานสัก,อุทัยธานี,
โรงเรียนบ้านปางไม้ไผ่,ระบำ,ลานสัก,อุทัยธานี,
โรงเรียนบ้านบุ่งอ้ายเจี้ยม,ระบำ,ลานสัก,อุทัยธานี,
โรงเรียนชุมชนบ้านทุ่งนางาม,ทุ่งนางาม,ลานสัก,อุทัยธานี,
โรงเรียนบ้านบุ่งฝาง,ทุ่งนางาม,ลานสัก,อุทัยธานี,
โรงเรียนบ้านน้ำวิ่ง,ทุ่งนางาม,ลานสัก,อุทัยธานี,
โรงเรียนบ้านเขาน้ำโจน,ทุ่งนางาม,ลานสัก,อุทัยธานี,
โรงเรียนบ้านห้วยโศก,ทุ่งนางาม,ลานสัก,อุทัยธานี,
โรงเรียนน้ำรอบ,น้ำรอบ,ลานสัก,อุทัยธานี,
โรงเรียนโกรกลึก,น้ำรอบ,ลานสัก,อุทัยธานี,
โรงเรียนบ้านบุ่งกะเซอร์,น้ำรอบ,ลานสัก,อุทัยธานี,
โรงเรียนวัดเขาผาแรต,น้ำรอบ,ลานสัก,อุทัยธานี,
