name,subDistrict,district,province,level
โรงเรียนกุดข้าวปุ้นวิทยา,ข้าวปุ้น,กุดข้าวปุ้น,อุบลราชธานี,มัธยมศึกษา
โรงเรียนเกษมสีมาวิทยาคาร,เกษม,ตระการพืชผล,อุบลราชธานี,มัธยมศึกษา
โรงเรียนเก่าขามวิทยา,ศรีสุข,เขื่องใน,อุบลราชธานี,มัธยมศึกษา
โรงเรียนขุมคำวิทยาคาร,แก่งเค็ง,กุดข้าวปุ้น,อุบลราชธานี,มัธยมศึกษา
โรงเรียนเขมราฐพิทยาคม,เขมราฐ,เขมราฐ,อุบลราชธานี,มัธยมศึกษา
โรงเรียนเขื่องในพิทยาคาร,เขื่องใน,เขื่องใน,อุบลราชธานี,มัธยมศึกษา
โรงเรียนโขงเจียมวิทยาคม,โขงเจียม,โขงเจียม,อุบลราชธานี,มัธยมศึกษา
โรงเรียนโคกสว่างคุ้มวิทยานุสรณ์,โคกสว่าง,สำโรง,อุบลราชธานี,มัธยมศึกษา
โรงเรียนชีทวนวิทยาสามัคคี,ชีทวน,เขื่องใน,อุบลราชธานี,มัธยมศึกษา
โรงเรียนเชียงแก้วพิทยาคม,จิกเทิง,ตาลสุม,อุบลราชธานี,มัธยมศึกษา
โรงเรียนดงยางวิทยาคม,ดุมใหญ่,ม่วงสามสิบ,อุบลราชธานี,มัธยมศึกษา
โรงเรียนดงสว่างวิทยา,โนนสวรรค์,นาจะหลวย,อุบลราชธานี,มัธยมศึกษา
โรงเรียนดอนมดแดงวิทยาคม,เหล่าแดง,ดอนมดแดง,อุบลราชธานี,มัธยมศึกษา
โรงเรียนเดชอุดม,เมืองเดช,เดชอุดม,อุบลราชธานี,มัธยมศึกษา
โรงเรียนโดมประดิษฐ์วิทยา,โดมประดิษฐ์,น้ำยืน,อุบลราชธานี,มัธยมศึกษา
โรงเรียนตาลสุมพัฒนา,ตาลสุม,ตาลสุม,อุบลราชธานี,มัธยมศึกษา
โรงเรียนเตรียมอุดมศึกษาพัฒนาการ อุบลราชธานี,ขามใหญ่,เมืองอุบลราชธานี,อุบลราชธานี,มัธยมศึกษา
โรงเรียนท่าโพธิ์ศรีพิทยา,ท่าโพธิ์ศรี,เดชอุดม,อุบลราชธานี,มัธยมศึกษา
โรงเรียนทุ่งเทิงยิ่งวัฒนา,ทุ่งเทิง,เดชอุดม,อุบลราชธานี,มัธยมศึกษา
โรงเรียนทุ่งศรีอุดม,โคกชำแระ,ทุ่งศรีอุดม,อุบลราชธานี,มัธยมศึกษา
โรงเรียนนากระแซงศึกษา,นากระแซง,เดชอุดม,อุบลราชธานี,มัธยมศึกษา
โรงเรียนนาจะหลวย,นาจะหลวย,นาจะหลวย,อุบลราชธานี,มัธยมศึกษา
โรงเรียนนาโพธิ์วิทยา,นาโพธิ์,บุณฑริก,อุบลราชธานี,มัธยมศึกษา
โรงเรียนนาเยียศึกษา รัชมังคลาภิเษก,นาเยีย,นาเยีย,อุบลราชธานี,มัธยมศึกษา
โรงเรียนนารีนุกูล,ในเมือง,เมืองอุบลราชธานี,อุบลราชธานี,มัธยมศึกษา
โรงเรียนนารีนุกูล 2,หัวเรือ,เมืองอุบลราชธานี,อุบลราชธานี,มัธยมศึกษา
โรงเรียนนาส่วงวิทยา,นาส่วง,เดชอุดม,อุบลราชธานี,มัธยมศึกษา
โรงเรียนน้ำยืนวิทยา,สีวิเชียร,น้ำยืน,อุบลราชธานี,มัธยมศึกษา
โรงเรียนโนนกุงวิทยาคม,โนนกุง,ตระการพืชผล,อุบลราชธานี,มัธยมศึกษา
โรงเรียนโนนสวางประชาสรรค์,โนนสวาง,กุดข้าวปุ้น,อุบลราชธานี,มัธยมศึกษา
โรงเรียนบ้านไทยวิทยาคม,บ้านไทย,เขื่องใน,อุบลราชธานี,มัธยมศึกษา
โรงเรียนบุณฑริกวิทยาคาร,โพนงาม,บุณฑริก,อุบลราชธานี,มัธยมศึกษา
โรงเรียนเบ็ญจะมะมหาราช,ในเมือง,เมืองอุบลราชธานี,อุบลราชธานี,มัธยมศึกษา
โรงเรียนปทุมพิทยาคม,ปทุม,เมืองอุบลราชธานี,อุบลราชธานี,มัธยมศึกษา
โรงเรียนไผ่ใหญ่ศึกษา,ไผ่ใหญ่,ม่วงสามสิบ,อุบลราชธานี,มัธยมศึกษา
โรงเรียนพะลานวิทยาคม,พะลาน,นาตาล,อุบลราชธานี,มัธยมศึกษา
โรงเรียนพังเคนพิทยา,พังเคน,นาตาล,อุบลราชธานี,มัธยมศึกษา
โรงเรียนโพธิ์ไทรพิทยาคาร,โพธิ์ไทร,โพธิ์ไทร,อุบลราชธานี,มัธยมศึกษา
โรงเรียนม่วงสามสิบอัมพวันวิทยา,ม่วงสามสิบ,ม่วงสามสิบ,อุบลราชธานี,มัธยมศึกษา
โรงเรียนมัธยมตระการพืชผล,ขุหลุ,ตระการพืชผล,อุบลราชธานี,มัธยมศึกษา
โรงเรียนลือคำหาญวารินชำราบ,แสนสุข,วารินชำราบ,อุบลราชธานี,มัธยมศึกษา
โรงเรียนวารินชำราบ,คำน้ำแซบ,วารินชำราบ,อุบลราชธานี,มัธยมศึกษา
โรงเรียนวิจิตราพิทยา,แสนสุข,วารินชำราบ,อุบลราชธานี,มัธยมศึกษา
โรงเรียนวิทยาศาสตร์จุฬาภรณราชวิทยาลัย อุบลราชธานี,กระโสบ,เมืองอุบลราชธานี,อุบลราชธานี,มัธยมศึกษา
โรงเรียนศรีน้ำคำศึกษา,เตย,ม่วงสามสิบ,อุบลราชธานี,มัธยมศึกษา
โรงเรียนศรีเมืองวิทยาคาร,นาคำ,ศรีเมืองใหม่,อุบลราชธานี,มัธยมศึกษา
โรงเรียนสว่างวีระวงศ์,สว่าง,สว่างวีระวงศ์,อุบลราชธานี,มัธยมศึกษา
โรงเรียนสหธาตุศึกษา,สหธาตุ,เขื่องใน,อุบลราชธานี,มัธยมศึกษา
โรงเรียนสะพือวิทยาคาร,สะพือ,ตระการพืชผล,อุบลราชธานี,มัธยมศึกษา
โรงเรียนสำโรงวิทยาคาร,โนนกลาง,สำโรง,อุบลราชธานี,มัธยมศึกษา
โรงเรียนสิรินธรวิทยานุสรณ์,นิคมสร้างตนเองลำโดมน้อย,สิรินธร,อุบลราชธานี,มัธยมศึกษา
โรงเรียนเสียมทองพิทยาคม,หัวดอน,เขื่องใน,อุบลราชธานี,มัธยมศึกษา
โรงเรียนหกสิบพรรษาวิทยาคม อุบลราชธานี,หนองบก,เหล่าเสือโก้ก,อุบลราชธานี,มัธยมศึกษา
โรงเรียนหนองขอนวิทยา,หนองขอน,เมืองอุบลราชธานี,อุบลราชธานี,มัธยมศึกษา
โรงเรียนหนองบ่อสามัคคีวิทยา,หนองบ่อ,เมืองอุบลราชธานี,อุบลราชธานี,มัธยมศึกษา
โรงเรียนหนามแท่งพิทยาคม รัชมังคลาภิเษก,หนามแท่ง,ศรีเมืองใหม่,อุบลราชธานี,มัธยมศึกษา
โรงเรียนห้วยขะยุงวิทยา,ห้วยขะยุง,วารินชำราบ,อุบลราชธานี,มัธยมศึกษา
โรงเรียนอ่างศิลา,อ่างศิลา,พิบูลมังสาหาร,อุบลราชธานี,มัธยมศึกษา
โรงเรียนเอือดใหญ่พิทยา,เอือดใหญ่,ศรีเมืองใหม่,อุบลราชธานี,มัธยมศึกษา
โรงเรียนปทุมวิทยากร,ในเมือง,เมืองอุบลราชธานี,อุบลราชธานี,
โรงเรียนมูลนิธิวัดศรีอุบลรัตนาราม ในพระอุปถัมภ์ฯ,ในเมือง,เมืองอุบลราชธานี,อุบลราชธานี,
โรงเรียนเมืองอุบล,ในเมือง,เมืองอุบลราชธานี,อุบลราชธานี,
โรงเรียนอนุบาลอุบลราชธานี,ในเมือง,เมืองอุบลราชธานี,อุบลราชธานี,
โรงเรียนอุบลวิทยาคม,ในเมือง,เมืองอุบลราชธานี,อุบลราชธานี,
โรงเรียนวัดท่าวังหิน,ในเมือง,เมืองอุบลราชธานี,อุบลราชธานี,
โรงเรียนบ้านนามึน,ไร่น้อย,เมืองอุบลราชธานี,อุบลราชธานี,
โรงเรียนบ้านปลาดุก,ไร่น้อย,เมืองอุบลราชธานี,อุบลราชธานี,
โรงเรียนบ้านยางลุ่ม,ไร่น้อย,เมืองอุบลราชธานี,อุบลราชธานี,
โรงเรียนกิตติญาณอุปถัมภ์,ไร่น้อย,เมืองอุบลราชธานี,อุบลราชธานี,
โรงเรียนบ้านนาเมือง,ไร่น้อย,เมืองอุบลราชธานี,อุบลราชธานี,
โรงเรียนกองบินอุบลสงเคราะห์,ไร่น้อย,เมืองอุบลราชธานี,อุบลราชธานี,
โรงเรียนบ้านปากห้วยวังนอง,ปทุม,เมืองอุบลราชธานี,อุบลราชธานี,
โรงเรียนบ้านปะอาว,ปะอาว,เมืองอุบลราชธานี,อุบลราชธานี,
โรงเรียนบ้านสร้างหมากแข้ง,ปะอาว,เมืองอุบลราชธานี,อุบลราชธานี,
โรงเรียนบ้านข่าโคม,ปะอาว,เมืองอุบลราชธานี,อุบลราชธานี,
โรงเรียนบ้านกระโสบ (เพียรประสิทธิ์วิทยา),กระโสบ,เมืองอุบลราชธานี,อุบลราชธานี,
โรงเรียนบ้านเค็ง,กระโสบ,เมืองอุบลราชธานี,อุบลราชธานี,
โรงเรียนบ้านหมากมี่,กระโสบ,เมืองอุบลราชธานี,อุบลราชธานี,
โรงเรียนบ้านโนนบ่อหวายดินดำ,กระโสบ,เมืองอุบลราชธานี,อุบลราชธานี,
โรงเรียนบ้านค้อกุดลาด,กุดลาด,เมืองอุบลราชธานี,อุบลราชธานี,
โรงเรียนบ้านปากน้ำ,กุดลาด,เมืองอุบลราชธานี,อุบลราชธานี,
โรงเรียนบ้านผาแก้ว,กุดลาด,เมืองอุบลราชธานี,อุบลราชธานี,
โรงเรียนบ้านนาคำ,กุดลาด,เมืองอุบลราชธานี,อุบลราชธานี,
โรงเรียนบ้านขี้เหล็กคำเจริญ,ขี้เหล็ก,เมืองอุบลราชธานี,อุบลราชธานี,
โรงเรียนบ้านหนองตอแก้ว,ขี้เหล็ก,เมืองอุบลราชธานี,อุบลราชธานี,
โรงเรียนบ้านหนองแต้,ขี้เหล็ก,เมืองอุบลราชธานี,อุบลราชธานี,
โรงเรียนบ้านสว่างหนองเสือ,ขี้เหล็ก,เมืองอุบลราชธานี,อุบลราชธานี,
โรงเรียนบ้านเชือก (ทวีปัญญา),หนองขอน,เมืองอุบลราชธานี,อุบลราชธานี,
โรงเรียนบ้านหนองไหล (พุธเพิ่มวัฒนราษฎร์),หนองขอน,เมืองอุบลราชธานี,อุบลราชธานี,
โรงเรียนบ้านหนองช้าง,หนองขอน,เมืองอุบลราชธานี,อุบลราชธานี,
โรงเรียนบ้านดอนชี (ศึริจันทรานุสรณ์),หนองขอน,เมืองอุบลราชธานี,อุบลราชธานี,
โรงเรียนบ้านทุ่งขุนใหญ่,หนองขอน,เมืองอุบลราชธานี,อุบลราชธานี,
โรงเรียนชุมชนบ้านหนองบ่อ (วิจิตรราษฎร์สามัคคี),หนองบ่อ,เมืองอุบลราชธานี,อุบลราชธานี,
โรงเรียนบ้านท่าสนามชัย,หนองบ่อ,เมืองอุบลราชธานี,อุบลราชธานี,
โรงเรียนบ้านจานตะโนน,หนองบ่อ,เมืองอุบลราชธานี,อุบลราชธานี,
โรงเรียนบ้านดงบัง (อาทรราษฎร์บำรุง),หนองบ่อ,เมืองอุบลราชธานี,อุบลราชธานี,
โรงเรียนบ้านโพนงาม (พูลเพิ่มวิทยาคาร),หนองบ่อ,เมืองอุบลราชธานี,อุบลราชธานี,
โรงเรียนบ้านมะเขือ,หนองบ่อ,เมืองอุบลราชธานี,อุบลราชธานี,
โรงเรียนบ้านท่าบ่อ,แจระแม,เมืองอุบลราชธานี,อุบลราชธานี,
โรงเรียนบ้านทุ่งขุนน้อยหนองจานวิทยา,แจระแม,เมืองอุบลราชธานี,อุบลราชธานี,
โรงเรียนบ้านหนองแก,แจระแม,เมืองอุบลราชธานี,อุบลราชธานี,
โรงเรียนบ้านคูเดื่อ,แจระแม,เมืองอุบลราชธานี,อุบลราชธานี,
โรงเรียนบ้านทัพไทย,แจระแม,เมืองอุบลราชธานี,อุบลราชธานี,
โรงเรียนประชาสามัคคี,ขามใหญ่,เมืองอุบลราชธานี,อุบลราชธานี,
โรงเรียนบ้านขามใหญ่,ขามใหญ่,เมืองอุบลราชธานี,อุบลราชธานี,
โรงเรียนบ้านหนองปลาปาก,ขามใหญ่,เมืองอุบลราชธานี,อุบลราชธานี,
โรงเรียนบ้านนาดูน,ขามใหญ่,เมืองอุบลราชธานี,อุบลราชธานี,
โรงเรียนบ้านหนองหว้า,ขามใหญ่,เมืองอุบลราชธานี,อุบลราชธานี,
โรงเรียนบ้านด้ามพร้า,ขามใหญ่,เมืองอุบลราชธานี,อุบลราชธานี,
โรงเรียนบ้านหัวคำ,ขามใหญ่,เมืองอุบลราชธานี,อุบลราชธานี,
โรงเรียนชุมชนบ้านหัวเรือ,หัวเรือ,เมืองอุบลราชธานี,อุบลราชธานี,
โรงเรียนบ้านหนองก่านคำไผ่,หัวเรือ,เมืองอุบลราชธานี,อุบลราชธานี,
โรงเรียนบ้านหนองมุก,หัวเรือ,เมืองอุบลราชธานี,อุบลราชธานี,
โรงเรียนบ้านหนองจำนัก,หัวเรือ,เมืองอุบลราชธานี,อุบลราชธานี,
โรงเรียนบ้านสำราญ,หัวเรือ,เมืองอุบลราชธานี,อุบลราชธานี,
โรงเรียนบ้านคำไฮใหญ่,คำไฮใหญ่,ดอนมดแดง,อุบลราชธานี,
โรงเรียนบ้านหนองแล้ง,คำไฮใหญ่,ดอนมดแดง,อุบลราชธานี,
โรงเรียนบ้านหนองหิน,คำไฮใหญ่,ดอนมดแดง,อุบลราชธานี,
โรงเรียนบ้านท่าเมือง,ท่าเมือง,ดอนมดแดง,อุบลราชธานี,
โรงเรียนดอนมดแดง (บ้านดงบัง),ดอนมดแดง,ดอนมดแดง,อุบลราชธานี,
โรงเรียนบ้านกุดกั่ว,ดอนมดแดง,ดอนมดแดง,อุบลราชธานี,
โรงเรียนบ้านยาง,ดอนมดแดง,ดอนมดแดง,อุบลราชธานี,
โรงเรียนบ้านยางกะเดา,ท่าเมือง,ดอนมดแดง,อุบลราชธานี,
โรงเรียนบ้านวังพระวังไฮ,ดอนมดแดง,ดอนมดแดง,อุบลราชธานี,
โรงเรียนบ้านแคน (สมเด็จอุปถัมภ์),ดอนมดแดง,ดอนมดแดง,อุบลราชธานี,
โรงเรียนบ้านสว่างโนนสวาง,ท่าเมือง,ดอนมดแดง,อุบลราชธานี,
โรงเรียนบ้านโอดนาดี,ท่าเมือง,ดอนมดแดง,อุบลราชธานี,
โรงเรียนบ้านท่าลาดหนองหล่มยางนกหอ,เหล่าแดง,ดอนมดแดง,อุบลราชธานี,
โรงเรียนบ้านกระบูน,เหล่าแดง,ดอนมดแดง,อุบลราชธานี,
โรงเรียนบ้านเหล่าแดง,เหล่าแดง,ดอนมดแดง,อุบลราชธานี,
โรงเรียนบ้านค้อ,เหล่าแดง,ดอนมดแดง,อุบลราชธานี,
โรงเรียนบ้านท่าศิลา,เหล่าแดง,ดอนมดแดง,อุบลราชธานี,
โรงเรียนบ้านแต้ใหม่,เหล่าเสือโก้ก,เหล่าเสือโก้ก,อุบลราชธานี,
โรงเรียนบ้านเหล่าเสือโก้ก,เหล่าเสือโก้ก,เหล่าเสือโก้ก,อุบลราชธานี,
โรงเรียนบ้านนาไผ่,เหล่าเสือโก้ก,เหล่าเสือโก้ก,อุบลราชธานี,
โรงเรียนบ้านเหล่าแค,เหล่าเสือโก้ก,เหล่าเสือโก้ก,อุบลราชธานี,
โรงเรียนบ้านเหล่าคำ,เหล่าเสือโก้ก,เหล่าเสือโก้ก,อุบลราชธานี,
โรงเรียนบ้านเป้า,เหล่าเสือโก้ก,เหล่าเสือโก้ก,อุบลราชธานี,
โรงเรียนบ้านแต้เก่า,หนองบก,เหล่าเสือโก้ก,อุบลราชธานี,
โรงเรียนบ้านหนองบก,หนองบก,เหล่าเสือโก้ก,อุบลราชธานี,
โรงเรียนบ้านดอนกลางทุ่งคำแต้,หนองบก,เหล่าเสือโก้ก,อุบลราชธานี,
โรงเรียนบ้านคำไฮน้อย,หนองบก,เหล่าเสือโก้ก,อุบลราชธานี,
โรงเรียนบ้านนาขมิ้น,หนองบก,เหล่าเสือโก้ก,อุบลราชธานี,
โรงเรียนบ้านดูน,หนองบก,เหล่าเสือโก้ก,อุบลราชธานี,
โรงเรียนชุมชนโพนเมืองวิทยา,โพนเมือง,เหล่าเสือโก้ก,อุบลราชธานี,
โรงเรียนบ้านหาด,โพนเมือง,เหล่าเสือโก้ก,อุบลราชธานี,
โรงเรียนบ้านขามน้อย,โพนเมือง,เหล่าเสือโก้ก,อุบลราชธานี,
