name,subDistrict,district,province,level
โรงเรียนบ้านกกเกลี้ยง,ผาบิ้ง,วังสะพุง,เลย,อนุบาล–ประถมศึกษา
โรงเรียนบ้านกกซ้อ,ทรายขาว,วังสะพุง,เลย,อนุบาล–ประถมศึกษา
โรงเรียนบ้านกกบก,หนองงิ้ว,วังสะพุง,เลย,อนุบาล–ประถมศึกษา
โรงเรียนบ้านกุดแกศรีสงคราม,ผาน้อย,วังสะพุง,เลย,อนุบาล–มัธยมศึกษาตอนต้น
โรงเรียนบ้านกุดโง้งวังเดื่อ,ปากปวน,วังสะพุง,เลย,ประถมศึกษา
โรงเรียนบ้านกุดลันน้อยคีรี,โคกขมิ้น,วังสะพุง,เลย,อนุบาล–ประถมศึกษา
โรงเรียนบ้านแก่งศรีภูมิ,แก่งศรีภูมิ,ภูหลวง,เลย,อนุบาล–ประถมศึกษา
โรงเรียนบ้านแก่งหินกกสะทอน,เขาหลวง,วังสะพุง,เลย,อนุบาล–ประถมศึกษา
โรงเรียนบ้านขอนแก่นโนนสวรรค์,เขาหลวง,วังสะพุง,เลย,อนุบาล–มัธยมศึกษาตอนต้น
โรงเรียนบ้านขอนยาง,โคกขมิ้น,วังสะพุง,เลย,อนุบาล–ประถมศึกษา
โรงเรียนบ้านโคกขมิ้น,โคกขมิ้น,วังสะพุง,เลย,อนุบาล–มัธยมศึกษาตอนต้น
โรงเรียนบ้านโคกผักหวาน,ผาขาว,ผาขาว,เลย,อนุบาล–ประถมศึกษา
โรงเรียนบ้านโคกแฝก,ผาน้อย,วังสะพุง,เลย,อนุบาล–ประถมศึกษา
โรงเรียนบ้านโคกมน,ผาน้อย,วังสะพุง,เลย,อนุบาล–มัธยมศึกษาตอนต้น
โรงเรียนบ้านโคกศรีเจริญ,เลยวังไสย์,ภูหลวง,เลย,อนุบาล–ประถมศึกษา
โรงเรียนบ้านโคกสว่างป่าไม้งาม,โคกขมิ้น,วังสะพุง,เลย,อนุบาล–ประถมศึกษา
โรงเรียนบ้านซำกกค้อ,โนนปอแดง,ผาขาว,เลย,อนุบาล–ประถมศึกษา
โรงเรียนบ้านซำไคร้,โนนปอแดง,ผาขาว,เลย,อนุบาล–ประถมศึกษา
โรงเรียนบ้านซำนกจิบ,โคกขมิ้น,วังสะพุง,เลย,อนุบาล–ประถมศึกษา
โรงเรียนบ้านซำบ่าง,ห้วยส้ม,ภูกระดึง,เลย,อนุบาล–ประถมศึกษา
โรงเรียนบ้านซำบุ่น,ทรัพย์ไพวัลย์,เอราวัณ,เลย,อนุบาล–ประถมศึกษา
โรงเรียนบ้านซำพร้าว,บ้านเพิ่ม,ผาขาว,เลย,อนุบาล–ประถมศึกษา
โรงเรียนบ้านซำม่วง,ผาสามยอด,เอราวัณ,เลย,อนุบาล–ประถมศึกษา
โรงเรียนบ้านซำไฮ,ผานกเค้า,ภูกระดึง,เลย,อนุบาล–ประถมศึกษา
โรงเรียนบ้านดงน้อย,ผาขาว,ผาขาว,เลย,อนุบาล–มัธยมศึกษาตอนต้น
โรงเรียนบ้านดงน้อยโคกหนองแก,ศรีสงคราม,วังสะพุง,เลย,อนุบาล–ประถมศึกษา
โรงเรียนบ้านตาดข่า,ตาดข่า,หนองหิน,เลย,อนุบาล–มัธยมศึกษาตอนต้น
โรงเรียนบ้านทรัพย์เจริญ,ห้วยสีเสียด,ภูหลวง,เลย,อนุบาล–ประถมศึกษา
โรงเรียนบ้านท่าช้างคล้องหนองอีเปี้ย,ท่าช้างคล้อง,ผาขาว,เลย,อนุบาล–มัธยมศึกษาตอนต้น
โรงเรียนบ้านทุ่งใหญ่,ภูกระดึง,ภูกระดึง,เลย,อนุบาล–ประถมศึกษา
โรงเรียนบ้านนาแก,ผาบิ้ง,วังสะพุง,เลย,อนุบาล–มัธยมศึกษาตอนต้น
โรงเรียนบ้านนาโก,ศรีฐาน,ภูกระดึง,เลย,อนุบาล–มัธยมศึกษาตอนต้น
โรงเรียนบ้านนาซำแซง,เขาหลวง,วังสะพุง,เลย,อนุบาล–ประถมศึกษา
โรงเรียนบ้านนาดอกไม้มิตรภาพที่ 120,หนองหญ้าปล้อง,วังสะพุง,เลย,อนุบาล–มัธยมศึกษาตอนต้น
โรงเรียนบ้านนาดินดำ,แก่งศรีภูมิ,ภูหลวง,เลย,อนุบาล–ประถมศึกษา
โรงเรียนบ้านนาตาดสมสะอาด,ท่าช้างคล้อง,ผาขาว,เลย,อนุบาล–มัธยมศึกษาตอนต้น
โรงเรียนบ้านนาน้อยแสนสุข,ศรีฐาน,ภูกระดึง,เลย,อนุบาล–ประถมศึกษา
โรงเรียนบ้านนาแปน,ศรีฐาน,ภูกระดึง,เลย,อนุบาล–มัธยมศึกษาตอนต้น
โรงเรียนบ้านนาฝายนาโพธิ์,ภูหอ,ภูหลวง,เลย,อนุบาล–ประถมศึกษา
โรงเรียนบ้านนามูลตุ่น,ห้วยสีเสียด,ภูหลวง,เลย,อนุบาล–มัธยมศึกษาตอนต้น
โรงเรียนบ้านนายาง,ภูกระดึง,ภูกระดึง,เลย,อนุบาล–ประถมศึกษา
โรงเรียนบ้านนาล้อม,โนนปอแดง,ผาขาว,เลย,อนุบาล–ประถมศึกษา
โรงเรียนบ้านนาวัวโพนงาม,ทรายขาว,วังสะพุง,เลย,อนุบาล–มัธยมศึกษาตอนต้น
โรงเรียนบ้านนาหลวงยางเดี่ยว,เขาหลวง,วังสะพุง,เลย,อนุบาล–ประถมศึกษา
โรงเรียนบ้านนาเหมือดแอ่,ท่าช้างคล้อง,ผาขาว,เลย,อนุบาล–ประถมศึกษา
โรงเรียนบ้านนาอ่างคำ,ทรัพย์ไพวัลย์,เอราวัณ,เลย,อนุบาล–มัธยมศึกษาตอนต้น
โรงเรียนบ้านนาอีเลิศ,วังสะพุง,วังสะพุง,เลย,อนุบาล–มัธยมศึกษาตอนต้น
โรงเรียนบ้านนาอุดมนาสมใจ,ผาสามยอด,เอราวัณ,เลย,อนุบาล–ประถมศึกษา
โรงเรียนบ้านน้ำค้อ,ทรายขาว,วังสะพุง,เลย,อนุบาล–ประถมศึกษา
โรงเรียนบ้านน้ำจันทร์,หนองงิ้ว,วังสะพุง,เลย,อนุบาล–ประถมศึกษา
โรงเรียนบ้านน้ำทบ,เขาหลวง,วังสะพุง,เลย,อนุบาล–ประถมศึกษา
โรงเรียนบ้านน้ำอ้อมเล้า,วังสะพุง,วังสะพุง,เลย,อนุบาล–ประถมศึกษา
โรงเรียนบ้านโนน,ผาน้อย,วังสะพุง,เลย,อนุบาล–ประถมศึกษา
โรงเรียนบ้านโนนกกข่า,โนนปอแดง,ผาขาว,เลย,อนุบาล–ประถมศึกษา
โรงเรียนบ้านโนนกกจาน,ผาน้อย,วังสะพุง,เลย,อนุบาล–ประถมศึกษา
โรงเรียนบ้านโนนปอแดง,โนนปอแดง,ผาขาว,เลย,อนุบาล–มัธยมศึกษาตอนต้น
โรงเรียนบ้านโนนป่าซาง,โนนป่าซาง,ผาขาว,เลย,อนุบาล–มัธยมศึกษาตอนต้น
โรงเรียนบ้านโนนภูทอง,ท่าช้างคล้อง,ผาขาว,เลย,อนุบาล–ประถมศึกษา
โรงเรียนบ้านโนนสมบูรณ์โปร่งสุวรรณ,ท่าช้างคล้อง,ผาขาว,เลย,อนุบาล–ประถมศึกษา
โรงเรียนบ้านโนนสวรรค์,ผาสามยอด,เอราวัณ,เลย,อนุบาล–มัธยมศึกษาตอนต้น
โรงเรียนบ้านโนนสว่าง,ศรีสงคราม,วังสะพุง,เลย,อนุบาล–ประถมศึกษา
โรงเรียนบ้านโนนสว่างโสกนกไก่นา,โนนป่าซาง,ผาขาว,เลย,อนุบาล–ประถมศึกษา
โรงเรียนบ้านบึงสวรรค์,หนองหญ้าปล้อง,วังสะพุง,เลย,อนุบาล–ประถมศึกษา
โรงเรียนบ้านบุ่งค้อ,ทรายขาว,วังสะพุง,เลย,ประถมศึกษา
โรงเรียนบ้านบุ่งตาข่าย,ปากปวน,วังสะพุง,เลย,อนุบาล–ประถมศึกษา
โรงเรียนบ้านปวนพุ,ปวนพุ,หนองหิน,เลย,อนุบาล–ประถมศึกษา
โรงเรียนบ้านปากปวน,ปากปวน,วังสะพุง,เลย,อนุบาล–มัธยมศึกษาตอนต้น
โรงเรียนบ้านป่าบง,โคกขมิ้น,วังสะพุง,เลย,อนุบาล–ประถมศึกษา
โรงเรียนบ้านโป่งศรีโทน,เอราวัณ,เอราวัณ,เลย,อนุบาล–มัธยมศึกษาตอนต้น
โรงเรียนบ้านผาขาว,ผาขาว,ผาขาว,เลย,อนุบาล–ประถมศึกษา
โรงเรียนบ้านผาฆ้อง,ห้วยส้ม,ภูกระดึง,เลย,อนุบาล–ประถมศึกษา
โรงเรียนบ้านผาน้อย,ผาน้อย,วังสะพุง,เลย,อนุบาล–ประถมศึกษา
โรงเรียนบ้านผาสะนา,ทรัพย์ไพวัลย์,เอราวัณ,เลย,อนุบาล–ประถมศึกษา
โรงเรียนบ้านผาสามยอด,ผานกเค้า,ภูกระดึง,เลย,อนุบาล–ประถมศึกษา
โรงเรียนบ้านผาสามยอด,ทรัพย์ไพวัลย์,เอราวัณ,เลย,อนุบาล–ประถมศึกษา
โรงเรียนบ้านผาหวาย,ปวนพุ,หนองหิน,เลย,อนุบาล–ประถมศึกษา
โรงเรียนบ้านพวยเด้งสันติสุข,ท่าช้างคล้อง,ผาขาว,เลย,อนุบาล–ประถมศึกษา
โรงเรียนบ้านพองหนีบ,ศรีฐาน,ภูกระดึง,เลย,อนุบาล–ประถมศึกษา
โรงเรียนบ้านเพิ่ม,บ้านเพิ่ม,ผาขาว,เลย,อนุบาล–มัธยมศึกษาตอนต้น
โรงเรียนบ้านโพนทอง,ทรายขาว,วังสะพุง,เลย,อนุบาล–ประถมศึกษา
โรงเรียนบ้านภูทองลานมันหลัก 160,หนองหิน,หนองหิน,เลย,อนุบาล–ประถมศึกษา
โรงเรียนบ้านร่องป่าไผ่,หนองหิน,หนองหิน,เลย,อนุบาล–ประถมศึกษา
โรงเรียนบ้านไร่พวยมิตรภาพที่ 18,ตาดข่า,หนองหิน,เลย,อนุบาล–มัธยมศึกษาตอนต้น
โรงเรียนบ้านไร่ศรีอุบล,หนองหิน,หนองหิน,เลย,อนุบาล–ประถมศึกษา
โรงเรียนบ้านไร่สุขสันต์,เลยวังไสย์,ภูหลวง,เลย,อนุบาล–ประถมศึกษา
โรงเรียนบ้านลาด,โคกขมิ้น,วังสะพุง,เลย,อนุบาล–ประถมศึกษา
โรงเรียนบ้านเลยวังไสย์,เลยวังไสย์,ภูหลวง,เลย,อนุบาล–มัธยมศึกษาตอนต้น
โรงเรียนบ้านเล้า,หนองงิ้ว,วังสะพุง,เลย,อนุบาล–ประถมศึกษา
โรงเรียนบ้านวังกกเดื่อ,หนองหญ้าปล้อง,วังสะพุง,เลย,อนุบาล–มัธยมศึกษาตอนต้น
โรงเรียนบ้านวังแท่น,ผาน้อย,วังสะพุง,เลย,อนุบาล–มัธยมศึกษาตอนต้น
โรงเรียนบ้านวังม่วง,เอราวัณ,เอราวัณ,เลย,อนุบาล–ประถมศึกษา
โรงเรียนบ้านวังยาง,ศรีฐาน,ภูกระดึง,เลย,อนุบาล–ประถมศึกษา
โรงเรียนบ้านวังลานวังทอง,ผานกเค้า,ภูกระดึง,เลย,อนุบาล–ประถมศึกษา
โรงเรียนบ้านวังเลาหัวฝาย,เอราวัณ,เอราวัณ,เลย,อนุบาล–มัธยมศึกษาตอนต้น
โรงเรียนบ้านวังสะพุง,วังสะพุง,วังสะพุง,เลย,อนุบาล–มัธยมศึกษาตอนต้น
โรงเรียนบ้านวังไหโนนสมบูรณ์,หนองหญ้าปล้อง,วังสะพุง,เลย,อนุบาล–มัธยมศึกษาตอนต้น
โรงเรียนบ้านศรีรักษา,ผานกเค้า,ภูกระดึง,เลย,อนุบาล–ประถมศึกษา
โรงเรียนบ้านศรีวิไลท่าสวนยา,โนนปอแดง,ผาขาว,เลย,อนุบาล–ประถมศึกษา
โรงเรียนบ้านศรีอุบลพัฒนา,หนองหญ้าปล้อง,วังสะพุง,เลย,อนุบาล–ประถมศึกษา
โรงเรียนบ้านสงป่าเปลือย,ภูกระดึง,ภูกระดึง,เลย,อนุบาล–ประถมศึกษา
โรงเรียนบ้านสวนปอ,แก่งศรีภูมิ,ภูหลวง,เลย,อนุบาล–มัธยมศึกษาตอนต้น
โรงเรียนบ้านสวนห้อมผางาม,ปวนพุ,หนองหิน,เลย,อนุบาล–ประถมศึกษา
โรงเรียนบ้านแสนสุข,ผาขาว,ผาขาว,เลย,อนุบาล–ประถมศึกษา
โรงเรียนบ้านหนองขาม,ผาน้อย,วังสะพุง,เลย,อนุบาล–ประถมศึกษา
โรงเรียนบ้านหนองเขียด (เกษตรศาสตร์อนุสรณ์ 12),ภูหอ,ภูหลวง,เลย,อนุบาล–ประถมศึกษา
โรงเรียนบ้านหนองงิ้วเหล่าแปน,หนองงิ้ว,วังสะพุง,เลย,อนุบาล–ประถมศึกษา
โรงเรียนบ้านหนองตานา,ท่าช้างคล้อง,ผาขาว,เลย,อนุบาล–มัธยมศึกษาตอนต้น
โรงเรียนบ้านหนองตูม,ผาสามยอด,เอราวัณ,เลย,อนุบาล–ประถมศึกษา
โรงเรียนบ้านหนองตูมท่ายาง,ภูกระดึง,ภูกระดึง,เลย,อนุบาล–ประถมศึกษา
โรงเรียนบ้านหนองแต้หนองโก,ท่าช้างคล้อง,ผาขาว,เลย,อนุบาล–ประถมศึกษา
โรงเรียนบ้านหนองนอ,หนองหญ้าปล้อง,วังสะพุง,เลย,อนุบาล–ประถมศึกษา
โรงเรียนบ้านหนองบัว,ภูหอ,ภูหลวง,เลย,อนุบาล–มัธยมศึกษาตอนต้น
โรงเรียนบ้านหนองปาดฟาน,หนองหญ้าปล้อง,วังสะพุง,เลย,อนุบาล–ประถมศึกษา
โรงเรียนบ้านหนองหมากแก้ว,ปวนพุ,หนองหิน,เลย,อนุบาล–ประถมศึกษา
โรงเรียนบ้านหนองใหญ่,ผาอินทร์แปลง,เอราวัณ,เลย,อนุบาล–มัธยมศึกษาตอนต้น
โรงเรียนบ้านหนองอีเก้ง,ภูหอ,ภูหลวง,เลย,อนุบาล–ประถมศึกษา
โรงเรียนบ้านหมากแข้งกกกอก,หนองงิ้ว,วังสะพุง,เลย,อนุบาล–ประถมศึกษา
โรงเรียนบ้านห้วยกาบเปลือย,โนนป่าซาง,ผาขาว,เลย,อนุบาล–ประถมศึกษา
โรงเรียนบ้านห้วยคะมะ,ภูกระดึง,ภูกระดึง,เลย,อนุบาล–ประถมศึกษา
โรงเรียนบ้านห้วยไคร้,โนนปอแดง,ผาขาว,เลย,อนุบาล–มัธยมศึกษาตอนต้น
โรงเรียนบ้านห้วยเดื่อโคกสว่าง,หนองหิน,หนองหิน,เลย,อนุบาล–ประถมศึกษา
โรงเรียนบ้านห้วยเดื่อน้อย,ปวนพุ,หนองหิน,เลย,อนุบาล–ประถมศึกษา
โรงเรียนบ้านห้วยเดื่อเหนือ,โนนป่าซาง,ผาขาว,เลย,อนุบาล–ประถมศึกษา
โรงเรียนบ้านห้วยทรายคำ,ศรีสงคราม,วังสะพุง,เลย,อนุบาล–ประถมศึกษา
โรงเรียนบ้านห้วยป่าน,ผาสามยอด,เอราวัณ,เลย,อนุบาล–ประถมศึกษา
โรงเรียนบ้านห้วยเป้าเหนือ,ปวนพุ,หนองหิน,เลย,อนุบาล–ประถมศึกษา
โรงเรียนบ้านห้วยผุก,เขาหลวง,วังสะพุง,เลย,อนุบาล–ประถมศึกษา
โรงเรียนบ้านห้วยไผ่,ห้วยส้ม,ภูกระดึง,เลย,อนุบาล–ประถมศึกษา
โรงเรียนบ้านห้วยไผ่ใต้,หนองหิน,หนองหิน,เลย,อนุบาล–ประถมศึกษา
โรงเรียนบ้านห้วยไผ่เหนือ,ปวนพุ,หนองหิน,เลย,อนุบาล–ประถมศึกษา
โรงเรียนบ้านห้วยยาง,โนนป่าซาง,ผาขาว,เลย,อนุบาล–ประถมศึกษา
โรงเรียนบ้านห้วยส้ม,ห้วยส้ม,ภูกระดึง,เลย,อนุบาล–มัธยมศึกษาตอนต้น
โรงเรียนบ้านห้วยส้มใต้,ผานกเค้า,ภูกระดึง,เลย,อนุบาล–มัธยมศึกษาตอนต้น
โรงเรียนบ้านห้วยสีเสียด,ห้วยสีเสียด,ภูหลวง,เลย,อนุบาล–ประถมศึกษา
โรงเรียนบ้านห้วยหมาก,ผานกเค้า,ภูกระดึง,เลย,อนุบาล–ประถมศึกษา
โรงเรียนบ้านหัวขัว,ท่าช้างคล้อง,ผาขาว,เลย,อนุบาล–ประถมศึกษา
โรงเรียนบ้านหัวฝาย,ผาขาว,ผาขาว,เลย,อนุบาล–ประถมศึกษา
โรงเรียนบ้านหินเกิ้ง,โคกขมิ้น,วังสะพุง,เลย,อนุบาล–ประถมศึกษา
โรงเรียนบ้านเหมืองแบ่ง,หนองหญ้าปล้อง,วังสะพุง,เลย,อนุบาล–ประถมศึกษา
โรงเรียนบ้านเหล่าใหญ่,ปวนพุ,หนองหิน,เลย,อนุบาล–ประถมศึกษา
โรงเรียนบ้านเหว่อฟากห้วยกุดตอเรือ,ทรายขาว,วังสะพุง,เลย,อนุบาล–ประถมศึกษา
โรงเรียนบ้านอีเลิศ,ศรีฐาน,ภูกระดึง,เลย,อนุบาล–มัธยมศึกษาตอนต้น
โรงเรียนบ้านอุ่ม,หนองคัน,ภูหลวง,เลย,อนุบาล–ประถมศึกษา
โรงเรียนบ้านเอราวัณ,ผาอินทร์แปลง,เอราวัณ,เลย,อนุบาล–ประถมศึกษา
