name,subDistrict,district,province,level
โรงเรียนอนุบาลณัฐพันธุ์ภูหลวง,ภูหอ,ภูหลวง,เลย,เตรียมอนุบาล–อนุบาล
โรงเรียนอนุบาลธีรญาฟ้าใส,เมือง,เมืองเลย,เลย,อนุบาล
โรงเรียนอนุบาลนารดา,เขาหลวง,วังสะพุง,เลย,เตรียมอนุบาล–ประถมศึกษา
โรงเรียนอนุบาลประจันตะ,วังสะพุง,วังสะพุง,เลย,เตรียมอนุบาล–ประถมศึกษา
โรงเรียนอนุบาลพระศรีสงคราม,กุดป่อง,เมืองเลย,เลย,เตรียมอนุบาล–อนุบาล
โรงเรียนอนุบาลพีระยาจันไทรรอด,วังสะพุง,วังสะพุง,เลย,เตรียมอนุบาล–อนุบาล
โรงเรียนอนุบาลภูกระดึง,ห้วยส้ม,ภูกระดึง,เลย,อนุบาล–ประถมศึกษา
โรงเรียนอนุบาลมณีรัตน์,กุดป่อง,เมืองเลย,เลย,เตรียมอนุบาล–อนุบาล
โรงเรียนอนุบาลมณีรัตน์เชียงคาน,เชียงคาน,เชียงคาน,เลย,เตรียมอนุบาล–ประถมศึกษา
โรงเรียนอนุบาลอรพัฒน์,กุดป่อง,เมืองเลย,เลย,อนุบาล
โรงเรียนสาธิตมหาวิทยาลัยมหามกุฏราชวิทยาลัย,โพนสูง,ด่านซ้าย,เลย,มัธยมศึกษา
โรงเรียนสาธิตมหาวิทยาลัยราชภัฏเลย,เมือง,เมืองเลย,เลย,เตรียมอนุบาล–มัธยมศึกษา