name,subDistrict,district,province,level
โรงเรียนบ้านแม่แฮเหนือ,แม่นาจร,แม่แจ่ม,เชียงใหม่,อนุบาล–มัธยมศึกษา
โรงเรียนบ้านแม่แฮเหนือ สาขาแม่แจ๊ะ,แม่นาจร,แม่แจ่ม,เชียงใหม่,อนุบาล–ประถมศึกษา
โรงเรียนบ้านโม่งหลวง,กองแขก,แม่แจ่ม,เชียงใหม่,อนุบาล–มัธยมศึกษาตอนต้น
โรงเรียนบ้านโม่งหลวง สาขาบ้านแม่อมลานใน,กองแขก,แม่แจ่ม,เชียงใหม่,อนุบาล–ประถมศึกษา
โรงเรียนบ้านโรงวัว,แม่สอย,จอมทอง,เชียงใหม่,อนุบาล–ประถมศึกษา
โรงเรียนบ้านวังน้ำหยาด,แม่สอย,จอมทอง,เชียงใหม่,อนุบาล–ประถมศึกษา
โรงเรียนบ้านสบแจ่มฝั่งซ้าย,บ้านแปะ,จอมทอง,เชียงใหม่,อนุบาล–ประถมศึกษา
โรงเรียนบ้านสบเตี๊ยะ,สบเตี๊ยะ,จอมทอง,เชียงใหม่,อนุบาล–ประถมศึกษา
โรงเรียนบ้านสบแปะ,บ้านแปะ,จอมทอง,เชียงใหม่,อนุบาล–ประถมศึกษา
โรงเรียนบ้านสบแม่รวม,แม่นาจร,แม่แจ่ม,เชียงใหม่,อนุบาล–ประถมศึกษา
โรงเรียนบ้านสบวาก,แม่นาจร,แม่แจ่ม,เชียงใหม่,ประถมศึกษา
โรงเรียนบ้านสองธาร,บ้านทับ,แม่แจ่ม,เชียงใหม่,อนุบาล–ประถมศึกษา
โรงเรียนบ้านสามสบ,ท่าผา,แม่แจ่ม,เชียงใหม่,อนุบาล–ประถมศึกษา
โรงเรียนบ้านหนองคัน,แม่สอย,จอมทอง,เชียงใหม่,อนุบาล–ประถมศึกษา
โรงเรียนบ้านห้วยทราย,บ้านแปะ,จอมทอง,เชียงใหม่,อนุบาล–มัธยมศึกษาตอนต้น
โรงเรียนบ้านห้วยน้ำดิบ,ข่วงเปา,จอมทอง,เชียงใหม่,อนุบาล–ประถมศึกษา
โรงเรียนบ้านห้วยปู,แม่แดด,กัลยาณิวัฒนา,เชียงใหม่,อนุบาล–ประถมศึกษา
โรงเรียนบ้านห้วยปู สาขาแม่ตะละใต้,แม่แดด,กัลยาณิวัฒนา,เชียงใหม่,อนุบาล–ประถมศึกษา
โรงเรียนบ้านห้วยผา,แม่นาจร,แม่แจ่ม,เชียงใหม่,ประถมศึกษา
โรงเรียนบ้านห้วยม่วง,สบเตี๊ยะ,จอมทอง,เชียงใหม่,อนุบาล–ประถมศึกษา
โรงเรียนบ้านห้วยม่วงฝั่งซ้าย,แม่สอย,จอมทอง,เชียงใหม่,อนุบาล–ประถมศึกษา
โรงเรียนบ้านห้วยยา,แจ่มหลวง,กัลยาณิวัฒนา,เชียงใหม่,อนุบาล–มัธยมศึกษาตอนต้น
โรงเรียนบ้านห้วยส้มป่อย,ดอยแก้ว,จอมทอง,เชียงใหม่,ประถมศึกษา–มัธยมศึกษาตอนต้น
โรงเรียนบ้านห้วยสะแพด,แม่สอย,จอมทอง,เชียงใหม่,อนุบาล–ประถมศึกษา
โรงเรียนบ้านหาดนาค,สบเตี๊ยะ,จอมทอง,เชียงใหม่,อนุบาล–ประถมศึกษา
โรงเรียนบ้านใหม่สารภี,แม่สอย,จอมทอง,เชียงใหม่,ประถมศึกษา–มัธยมศึกษาตอนต้น
โรงเรียนบ้านอมขูด,กองแขก,แม่แจ่ม,เชียงใหม่,อนุบาล–ประถมศึกษา
โรงเรียนบ้านอมเม็ง,กองแขก,แม่แจ่ม,เชียงใหม่,อนุบาล–ประถมศึกษา
โรงเรียนบ้านเฮาะวิทยา,ปางหินฝน,แม่แจ่ม,เชียงใหม่,อนุบาล–ประถมศึกษา
โรงเรียนป่ากล้วยพัฒนา,แม่สอย,จอมทอง,เชียงใหม่,อนุบาล–ประถมศึกษา
โรงเรียนวัดพระบาท,บ้านหลวง,จอมทอง,เชียงใหม่,อนุบาล–ประถมศึกษา
โรงเรียนวัดพุทธนิมิตร,สบเตี๊ยะ,จอมทอง,เชียงใหม่,อนุบาล–ประถมศึกษา
โรงเรียนศรีจอมทอง,ดอยแก้ว,จอมทอง,เชียงใหม่,อนุบาล–ประถมศึกษา
โรงเรียนสามัคคีสันม่วง,บ้านจันทร์,กัลยาณิวัฒนา,เชียงใหม่,อนุบาล–มัธยมศึกษาตอนต้น
โรงเรียนหลวงพัฒนาบ้านพุย,ปางหินฝน,แม่แจ่ม,เชียงใหม่,อนุบาล–ประถมศึกษา
โรงเรียนองค์การอุตสาหกรรมป่าไม้ 13,กองแขก,แม่แจ่ม,เชียงใหม่,อนุบาล–ประถมศึกษา
โรงเรียนอินทนนท์วิทยา,ช่างเคิ่ง,แม่แจ่ม,เชียงใหม่,อนุบาล–มัธยมศึกษาตอนต้น
โรงเรียนกาวิละอนุกูล,วัดเกต,เมืองเชียงใหม่,เชียงใหม่,
โรงเรียนราชประชานุเคราะห์ 30,แม่อาย,แม่อาย,เชียงใหม่,
โรงเรียนราชประชานุเคราะห์ 31,ช่างเคิ่ง,แม่แจ่ม,เชียงใหม่,
โรงเรียนราชประชานุเคราะห์ 60,ดอนแก้ว,แม่ริม,เชียงใหม่,
โรงเรียนราชประชานุเคราะห์ 61,ปิงโค้ง,เชียงดาว,เชียงใหม่,
โรงเรียนศรีสังวาลย์เชียงใหม่,หนองหาร,สันทราย,เชียงใหม่,
โรงเรียนสอนคนตาบอดภาคเหนือ ในพระบรมราชินูปถัมภ์,พระสิงห์,เมืองเชียงใหม่,เชียงใหม่,
โรงเรียนโสตศึกษาอนุสารสุนทร,ช้างเผือก,เมืองเชียงใหม่,เชียงใหม่,
โรงเรียนออทิสติกเชียงใหม่,ดอนแก้ว,แม่ริม,เชียงใหม่,
โรงเรียนต้นแก้วผดุงพิทยาลัย,ขุนคง,หางดง,เชียงใหม่,อนุบาล–มัธยมศึกษาตอนต้น
โรงเรียนบ้านแม่งอนขี้เหล็ก,แม่งอน,ฝาง,เชียงใหม่,อนุบาล–มัธยมศึกษาตอนต้น
โรงเรียนบ้านศาลา,ดอนแก้ว,แม่ริม,เชียงใหม่,อนุบาล–มัธยมศึกษาตอนต้น
โรงเรียนแม่อายวิทยาคม,แม่อาย,แม่อาย,เชียงใหม่,มัธยมศึกษา
โรงเรียนชุมชนเทศบาลวัดศรีดอนไชย,ช้างคลาน,เมืองเชียงใหม่,เชียงใหม่,อนุบาล–มัธยมศึกษาตอนต้น
โรงเรียนเทศบาลดอกเงิน,ช้างม่อย,เมืองเชียงใหม่,เชียงใหม่,อนุบาล–ประถมศึกษา
โรงเรียนเทศบาลวัดกู่คำ,วัดเกต,เมืองเชียงใหม่,เชียงใหม่,อนุบาล–ประถมศึกษา
โรงเรียนเทศบาลวัดเกตการาม,วัดเกต,เมืองเชียงใหม่,เชียงใหม่,อนุบาล–ประถมศึกษา
โรงเรียนเทศบาลวัดเชียงยืน,ศรีภูมิ,เมืองเชียงใหม่,เชียงใหม่,อนุบาล–ประถมศึกษา
โรงเรียนเทศบาลวัดท่าสะต๋อย,วัดเกต,เมืองเชียงใหม่,เชียงใหม่,อนุบาล–มัธยมศึกษาตอนต้น
โรงเรียนเทศบาลวัดป่าแพ่ง,ช้างม่อย,เมืองเชียงใหม่,เชียงใหม่,อนุบาล–ประถมศึกษา
โรงเรียนเทศบาลวัดพวกช้าง,หายยา,เมืองเชียงใหม่,เชียงใหม่,อนุบาล–ประถมศึกษา
โรงเรียนเทศบาลวัดศรีปิงเมือง,ช้างคลาน,เมืองเชียงใหม่,เชียงใหม่,อนุบาล–มัธยมศึกษาตอนต้น
โรงเรียนเทศบาลวัดศรีสุพรรณ,หายยา,เมืองเชียงใหม่,เชียงใหม่,อนุบาล–ประถมศึกษา
โรงเรียนเทศบาลวัดหมื่นเงินกอง,พระสิงห์,เมืองเชียงใหม่,เชียงใหม่,อนุบาล–ประถมศึกษา
โรงเรียนอนุบาลสานสายใยรัก เทศบาลเมืองเมืองแกนพัฒนา,อินทขิล,แม่แตง,เชียงใหม่,อนุบาล–มัธยมศึกษาตอนต้น
โรงเรียนอนุบาลเทศบาลเมืองแม่เหียะ,แม่เหียะ,เมืองเชียงใหม่,เชียงใหม่,อนุบาล
โรงเรียนอนุบาลเทศบาลตำบลจอมแจ้ง,ขี้เหล็ก,แม่แตง,เชียงใหม่,อนุบาล
โรงเรียนเทศบาลจอมทอง 1 (ชุมชนบ้านข่วงเปาเหนือ),ข่วงเปา,จอมทอง,เชียงใหม่,อนุบาล–ประถมศึกษา
โรงเรียนอนุบาลเทศบาลตำบลเจดีย์แม่ครัว,แม่แฝกใหม่,สันทราย,เชียงใหม่,อนุบาล
โรงเรียนอนุบาลเทศบาลตำบลชมภู,ชมภู,สารภี,เชียงใหม่,อนุบาล
โรงเรียนเทศบาล 1 ไชยปราการ,ปงตำ,ไชยปราการ,เชียงใหม่,อนุบาล–มัธยมศึกษาตอนต้น
โรงเรียนบ้านแม่เตี๊ยะ,ดอยแก้ว,จอมทอง,เชียงใหม่,
โรงเรียนบ้านแม่จ้อง,ตลาดใหญ่,ดอยสะเก็ด,เชียงใหม่,ประถมศึกษา
โรงเรียนอนุบาลเทศบาลตำบลตลาดใหญ่,ตลาดใหญ่,ดอยสะเก็ด,เชียงใหม่,อนุบาล
โรงเรียนอนุบาลเทศบาลตำบลท่าข้าม,หางดง,ฮอด,เชียงใหม่,อนุบาล
โรงเรียนบ้านห้วยเป้า,ทุ่งข้าวพวง,เชียงดาว,เชียงใหม่,อนุบาล–ประถมศึกษา
โรงเรียนเทศบาลบ้านขุนคอง,ทุ่งข้าวพวง,เชียงดาว,เชียงใหม่,อนุบาล
โรงเรียนเทศบาลตำบลทุ่งต้อม,ทุ่งต้อม,สันป่าตอง,เชียงใหม่,อนุบาล
โรงเรียนอนุบาลตำบลทุ่งสะโตก,ทุ่งสะโตก,สันป่าตอง,เชียงใหม่,อนุบาล
โรงเรียนอนุบาลเทศบาลตำบลบวกค้าง,บวกค้าง,สันกำแพง,เชียงใหม่,อนุบาล
โรงเรียนเทศบาล 1 (ทุ่งฟ้าบดราษฎร์บำรุง),มะขามหลวง,สันป่าตอง,เชียงใหม่,อนุบาล–มัธยมศึกษาตอนต้น
โรงเรียนอนุบาลเทศบาลตำบลบ้านแม่ข่า,แม่ข่า,ฝาง,เชียงใหม่,อนุบาล
โรงเรียนอนุบาลตำบลป่าไหน่,ป่าไหน่,พร้าว,เชียงใหม่,อนุบาล
โรงเรียนอนุบาลเทศบาลตำบลเมืองนะ 1,เมืองนะ,เชียงดาว,เชียงใหม่,อนุบาล
โรงเรียนอนุบาลเทศบาลตำบลเมืองนะ 2,เมืองนะ,เชียงดาว,เชียงใหม่,
โรงเรียนบ้านหล่ายฝาง,แม่ข่า,ฝาง,เชียงใหม่,อนุบาล–ประถมศึกษา
โรงเรียนอนุบาลเทศบาลตำบลแม่คือ,แม่คือ,ดอยสะเก็ด,เชียงใหม่,อนุบาล
โรงเรียนอนุบาลเทศบาลตำบลแม่แตง,แม่แตง,แม่แตง,เชียงใหม่,อนุบาล
โรงเรียนอนุบาลเทศบาลตำบลแม่แฝก,แม่แฝก,สันทราย,เชียงใหม่,อนุบาล
โรงเรียนเทศบาลตำบลแม่ริม,ริมใต้,แม่ริม,เชียงใหม่,อนุบาล
โรงเรียนเทศบาลวัดดอนเปา (กองคำราษฎร์นุสรณ์),ดอนเปา,แม่วาง,เชียงใหม่,อนุบาล–ประถมศึกษา
โรงเรียนอนุบาลเทศบาลตำบลแม่หอพระ,แม่หอพระ,แม่แตง,เชียงใหม่,อนุบาล
โรงเรียนอนุบาลเทศบาลตำบลแม่อาย (บ้านเด่น),แม่อาย,แม่อาย,เชียงใหม่,อนุบาล
โรงเรียนเทศบาลตำบลแม่ฮ้อยเงิน,แม่ฮ้อยเงิน,ดอยสะเก็ด,เชียงใหม่,อนุบาล
โรงเรียนเทศบาลตำบลยางเนิ้ง,ยางเนิ้ง,สารภี,เชียงใหม่,อนุบาล–ประถมศึกษา
โรงเรียนสันป่าตองเทศบาลตำบลยุหว่า 1,ยุหว่า,สันป่าตอง,เชียงใหม่,ประถมศึกษา
โรงเรียนอนุบาลเทศบาลตำบลยุหว่า,ยุหว่า,สันป่าตอง,เชียงใหม่,อนุบาล
โรงเรียนเทศบาลเวียงฝาง,เวียง,ฝาง,เชียงใหม่,อนุบาล–ประถมศึกษา
โรงเรียนวัดสองแคว,สองแคว,ดอยหล่อ,เชียงใหม่,อนุบาล–ประถมศึกษา
โรงเรียนอนุบาลเทศบาลตำบลสันกำแพง,สันกำแพง,สันกำแพง,เชียงใหม่,อนุบาล
โรงเรียนอนุบาลเทศบาลสันทราย,สันทราย,ฝาง,เชียงใหม่,อนุบาล
โรงเรียนอนุบาลเทศบาลตำบลสันปูเลย,สันปูเลย,ดอยสะเก็ด,เชียงใหม่,อนุบาล
โรงเรียนอนุบาลเทศบาลตำบลสันโป่ง,สันโป่ง,แม่ริม,เชียงใหม่,อนุบาล
โรงเรียนเทศบาลตำบลสันมหาพน,สันมหาพน,แม่แตง,เชียงใหม่,อนุบาล–ประถมศึกษา
โรงเรียนอนุบาลเทศบาลตำบลสะเมิงใต้,สะเมิงใต้,สะเมิง,เชียงใหม่,อนุบาล
โรงเรียนอนุบาลเทศบาลตำบลหนองควาย,หนองควาย,หางดง,เชียงใหม่,อนุบาล
โรงเรียนบ้านหนองตอง,หนองตอง,หางดง,เชียงใหม่,ประถมศึกษา–มัธยมศึกษาตอนต้น
โรงเรียนอนุบาลหนองป่าครั่ง,หนองป่าครั่ง,เมืองเชียงใหม่,เชียงใหม่,ประถมศึกษา–มัธยมศึกษาตอนต้น
โรงเรียนอนุบาลหนองป่าครั่ง 2,หนองป่าครั่ง,เมืองเชียงใหม่,เชียงใหม่,อนุบาล
โรงเรียนอนุบาลเทศบาลตำบลหนองแหย่ง,หนองแหย่ง,สันทราย,เชียงใหม่,อนุบาล
โรงเรียนเทศบาลหางดง (ประชาคมสร้างสรรค์),หางดง,หางดง,เชียงใหม่,อนุบาล–ประถมศึกษา
โรงเรียนอนุบาลเทศบาลตำบลอมก๋อย,อมก๋อย,อมก๋อย,เชียงใหม่,อนุบาล
โรงเรียนอนุบาลเทศบาลตำบลออนใต้,ออนใต้,สันกำแพง,เชียงใหม่,อนุบาล
โรงเรียนอนุบาล อบต.กื้ดช้าง 1,กื้ดช้าง,แม่แตง,เชียงใหม่,อนุบาล
โรงเรียนอนุบาล อบต.กื้ดช้าง 2,กื้ดช้าง,แม่แตง,เชียงใหม่,อนุบาล
โรงเรียนดอนแก้วเนรมิตปัญญา,ดอนแก้ว,แม่ริม,เชียงใหม่,อนุบาล–ประถมศึกษา
โรงเรียนบ้านดอนแก้ว,ดอนแก้ว,แม่ริม,เชียงใหม่,อนุบาล–ประถมศึกษา
โรงเรียนอนุบาลองค์การบริหารส่วนตำบลน้ำบ่อหลวง,น้ำบ่อหลวง,สันป่าตอง,เชียงใหม่,อนุบาล
โรงเรียนอนุบาลมะขามหลวง,มะขามหลวง,สันป่าตอง,เชียงใหม่,อนุบาล
โรงเรียนอนุบาลแม่แวน,แม่แวน,พร้าว,เชียงใหม่,อนุบาล
โรงเรียนบ้านล้องอ้อ,แม่สูน,ฝาง,เชียงใหม่,อนุบาล–มัธยมศึกษาตอนต้น
โรงเรียนแม่สาบดรุณศึกษา,แม่สาบ,สะเมิง,เชียงใหม่,อนุบาล
โรงเรียนอนุบาลองค์การบริหารส่วนตำบลแม่สาว,แม่สาว,แม่อาย,เชียงใหม่,อนุบาล
โรงเรียนอนุบาลองค์การบริหารส่วนตำบลร้องวัวแดง,ร้องวัวแดง,สันกำแพง,เชียงใหม่,อนุบาล
โรงเรียนอนุบาลองค์การบริหารส่วนตำบลสันกลาง,สันกลาง,สันป่าตอง,เชียงใหม่,อนุบาล
โรงเรียนอนุบาลองค์การบริหารส่วนตำบลสันต้นหมื้อ,สันต้นหมื้อ,แม่อาย,เชียงใหม่,อนุบาล
โรงเรียนอนุบาลสันทรายพัฒนา,สันทราย,พร้าว,เชียงใหม่,อนุบาล
โรงเรียนอนุบาลองค์การบริหารส่วนตำบลห้วยแก้ว,ห้วยแก้ว,แม่ออน,เชียงใหม่,อนุบาล
โรงเรียนอนุบาลโหล่งขอด,โหล่งขอด,พร้าว,เชียงใหม่,อนุบาล
โรงเรียนโกวิทธำรงเชียงใหม่,ศรีภูมิ,เมืองเชียงใหม่,เชียงใหม่,อนุบาล–มัธยมศึกษา
โรงเรียนขาลสุวรรณอนุสรณ์,วัดเกต,เมืองเชียงใหม่,เชียงใหม่,เตรียมอนุบาล–มัธยมศึกษาตอนต้น
โรงเรียนคริสเตียนเยอรมันเชียงใหม่,ท่าวังตาล,สารภี,เชียงใหม่,
โรงเรียนจิตราวิทยา,วัดเกต,เมืองเชียงใหม่,เชียงใหม่,เตรียมอนุบาล–มัธยมศึกษาตอนต้น
โรงเรียนเจ้าฟ้าอุบลรัตน์,เชียงดาว,เชียงดาว,เชียงใหม่,อนุบาล–มัธยมศึกษาตอนต้น
โรงเรียนฉัตรพฤกษ์วิทยา,ศรีดงเย็น,ไชยปราการ,เชียงใหม่,ประถมศึกษา–มัธยมศึกษาตอนต้น
